SET sql_mode='NO_ENGINE_SUBSTITUTION';
####################################
# SETUP
####################################
CREATE DATABASE statements_digest;
USE statements_digest;
CREATE TABLE t1(a int);
CREATE TABLE t2(a int);
CREATE TABLE t3(a int, b int);
CREATE TABLE t4(a int, b int);
CREATE TABLE t5(a int, b int, c int);
CREATE TABLE t6(a int, b int, c int, d int);
CREATE TABLE t11 (c CHAR(4));
CREATE TABLE t12 (c CHAR(4));
TRUNCATE TABLE performance_schema.events_statements_summary_by_digest;
####################################
# EXECUTION
####################################
SELECT 1 FROM t1;
1
SELECT 1 FROM `t1`;
1
SELECT 1,2 FROM t1;
1	2
SELECT 1, 2, 3, 4 FROM t1;
1	2	3	4
SELECT 1 FROM t2;
1
SELECT 1,2 FROM t2;
1	2
SELECT 1, 2, 3, 4 FROM t2;
1	2	3	4
INSERT INTO t1 VALUES (1);
INSERT INTO t2 VALUES (1);
INSERT INTO t3 VALUES (1, 2);
INSERT INTO t4 VALUES (1, 2);
INSERT INTO t5 VALUES (1, 2, 3);
INSERT INTO t1 VALUES (1), (2), (3);
INSERT INTO t1 VALUES (1), (2), (3), (4);
INSERT INTO t3 VALUES (1, 2), (3, 4), (5, 6);
INSERT INTO t5 VALUES (1, 2, 3), (4, 5, 6), (7, 8, 9);
SELECT * FROM t1 WHERE a IN (1);
a
1
1
1
SELECT * FROM t1 WHERE a IN (1, 2, 3);
a
1
1
2
3
1
2
3
INSERT INTO t1 VALUES (NULL);
INSERT INTO t3 VALUES (NULL,NULL);
INSERT INTO t3 VALUES (1,NULL);
INSERT INTO t3 VALUES (NULL,1);
INSERT INTO t6 VALUES (NULL, NULL, NULL, NULL);
INSERT INTO t6 VALUES (1, NULL, NULL, NULL);
INSERT INTO t6 VALUES (NULL, 2, NULL, NULL);
INSERT INTO t6 VALUES (1, 2, 3, NULL);
INSERT INTO t6 VALUES (1, 2, NULL, 4);
SELECT                                          1           +        1;
1           +        1
2
SELECT 1;
1
1
SELECT 1 /* This is an inline comment */ + 1;
1 /* This is an inline comment */ + 1
2
SELECT 1+
/*
this is a
multiple-line comment
*/
1;
1+
/*
this is a
multiple-line comment
*/
1
2
CREATE SCHEMA statements_digest_temp;
DROP SCHEMA statements_digest_temp;
CREATE DATABASE statements_digest_temp;
DROP DATABASE statements_digest_temp;
SELECT 1 FROM no_such_table;
ERROR 42S02: Table 'statements_digest.no_such_table' doesn't exist
CREATE TABLE dup_table (c char(4));
CREATE TABLE dup_table (c char(4));
ERROR 42S01: Table 'dup_table' already exists
DROP TABLE dup_table;
INSERT IGNORE INTO t11 VALUES("MySQL");
Warnings:
Warning	1265	Data truncated for column 'c' at row 1
PREPARE stmt FROM "SELECT * FROM t12";
EXECUTE stmt;
c
EXECUTE stmt;
c
DEALLOCATE PREPARE stmt;
CREATE PROCEDURE p1() BEGIN SELECT * FROM t12; END//
CALL p1();
c
CALL p1();
c
DROP PROCEDURE p1;
CREATE FUNCTION `func`(a INT, b INT) RETURNS int(11) RETURN a+b //
Warnings:
Warning	1681	Integer display width is deprecated and will be removed in a future release.
select func(3,4);
func(3,4)
7
select func(13,42);
func(13,42)
55
DROP FUNCTION func;
CREATE TRIGGER trg BEFORE INSERT ON t12 FOR EACH ROW SET @a:=1;
INSERT INTO t12 VALUES ("abc");
INSERT INTO t12 VALUES ("def");
DROP TRIGGER trg;
DELETE FROM t1;
INSERT INTO t1 VALUES (1),(2);
SELECT * FROM (SELECT a,1,1 FROM t1) AS dt (x,y,z);
x	y	z
1	1	1
2	1	1
SELECT * FROM (SELECT a,2,2 FROM t1) AS dt (x,y,z);
x	y	z
1	2	2
2	2	2
WITH cte (x,y,z)AS (SELECT a,1,1 FROM t1) SELECT 1, cte.* FROM cte;
1	x	y	z
1	1	1	1
1	2	1	1
WITH cte (x,y,z)AS (SELECT a,2,2 FROM t1) SELECT 2, cte.* FROM cte;
2	x	y	z
2	1	2	2
2	2	2	2
WITH cte (x,y,z)AS (SELECT a,1,1 FROM t1) SELECT 1, cte.*, cte2.* FROM cte, cte AS cte2;
1	x	y	z	x	y	z
1	1	1	1	1	1	1
1	1	1	1	2	1	1
1	2	1	1	1	1	1
1	2	1	1	2	1	1
WITH cte (x,y,z)AS (SELECT a,2,2 FROM t1) SELECT 2, cte.*, cte2.* FROM cte, cte AS cte2;
2	x	y	z	x	y	z
2	1	2	2	1	2	2
2	1	2	2	2	2	2
2	2	2	2	1	2	2
2	2	2	2	2	2	2
WITH RECURSIVE cte (x,y,z) AS
(SELECT a,1,1 FROM t1 UNION ALL SELECT a+1,a*1,11 FROM t1 WHERE 0)
SELECT 1, cte.*, cte2.* FROM cte, cte AS cte2;
1	x	y	z	x	y	z
1	1	1	1	1	1	1
1	1	1	1	2	1	1
1	2	1	1	1	1	1
1	2	1	1	2	1	1
WITH RECURSIVE cte (x,y,z) AS
(SELECT a,2,2 FROM t1 UNION ALL SELECT a+2,a*2,22 FROM t1 WHERE 0)
SELECT 2, cte.*, cte2.* FROM cte, cte AS cte2;
2	x	y	z	x	y	z
2	1	2	2	1	2	2
2	1	2	2	2	2	2
2	2	2	2	1	2	2
2	2	2	2	2	2	2
####################################
# Test for performance schema.
####################################
SELECT * FROM t1 AS t_digest;
EXPLAIN SELECT * FROM t1 AS t_digest;
EXPLAIN FORMAT = JSON SELECT * FROM t1 AS t_digest;
EXPLAIN FORMAT = TRADITIONAL SELECT * FROM t1 AS t_digest;
EXPLAIN FORMAT = 'JsOn' SELECT * FROM t1 AS t_digest;
EXPLAIN FORMAT = 'TrAdItIoNaL' SELECT * FROM t1 AS t_digest;
SELECT DIGEST,DIGEST_TEXT,COUNT_STAR FROM performance_schema.events_statements_summary_by_digest WHERE DIGEST_TEXT LIKE '%FROM `t1` AS `t_digest`' ORDER BY DIGEST_TEXT;
DIGEST	DIGEST_TEXT	COUNT_STAR
182f473bafb944a762643b7fa6746c2f8368abd9302218789231edf01f48d46e	EXPLAIN FORMAT = ? SELECT * FROM `t1` AS `t_digest`	2
02baebca27e23682c7fab431d7c4f66a4c17d92c6c7ee24d923a93a9a3500a4e	EXPLAIN FORMAT = `TRADITIONAL` SELECT * FROM `t1` AS `t_digest`	1
0c70c3bde4ca8b3e1e26436d740dc312b97b2af2193df24358e6af3d45941075	EXPLAIN FORMAT = JSON SELECT * FROM `t1` AS `t_digest`	1
a9a71d48557310acb963238e1f29ebd6427c4c9491369ea2a3e110692b3275b4	EXPLAIN SELECT * FROM `t1` AS `t_digest`	1
f162f9700a0e7c7623b1d548fda8a1887fe5328e60b4ad889753362f591e15f2	SELECT * FROM `t1` AS `t_digest`	1
SELECT SQL_TEXT,DIGEST,DIGEST_TEXT FROM performance_schema.events_statements_history WHERE DIGEST_TEXT LIKE '%FROM `t1` AS `t_digest`' ORDER BY SQL_TEXT;
SQL_TEXT	DIGEST	DIGEST_TEXT
EXPLAIN FORMAT = 'JsOn' SELECT * FROM t1 AS t_digest	182f473bafb944a762643b7fa6746c2f8368abd9302218789231edf01f48d46e	EXPLAIN FORMAT = ? SELECT * FROM `t1` AS `t_digest`
EXPLAIN FORMAT = 'TrAdItIoNaL' SELECT * FROM t1 AS t_digest	182f473bafb944a762643b7fa6746c2f8368abd9302218789231edf01f48d46e	EXPLAIN FORMAT = ? SELECT * FROM `t1` AS `t_digest`
EXPLAIN FORMAT = JSON SELECT * FROM t1 AS t_digest	0c70c3bde4ca8b3e1e26436d740dc312b97b2af2193df24358e6af3d45941075	EXPLAIN FORMAT = JSON SELECT * FROM `t1` AS `t_digest`
EXPLAIN FORMAT = TRADITIONAL SELECT * FROM t1 AS t_digest	02baebca27e23682c7fab431d7c4f66a4c17d92c6c7ee24d923a93a9a3500a4e	EXPLAIN FORMAT = `TRADITIONAL` SELECT * FROM `t1` AS `t_digest`
EXPLAIN SELECT * FROM t1 AS t_digest	a9a71d48557310acb963238e1f29ebd6427c4c9491369ea2a3e110692b3275b4	EXPLAIN SELECT * FROM `t1` AS `t_digest`
SELECT * FROM t1 AS t_digest	f162f9700a0e7c7623b1d548fda8a1887fe5328e60b4ad889753362f591e15f2	SELECT * FROM `t1` AS `t_digest`
####################################
# CLEANUP
####################################
DROP TABLE IF EXISTS t1;
DROP TABLE IF EXISTS t2;
DROP TABLE IF EXISTS t3;
DROP TABLE IF EXISTS t4;
DROP TABLE IF EXISTS t5;
DROP TABLE IF EXISTS t6;
DROP TABLE IF EXISTS t11;
DROP TABLE IF EXISTS t12;
DROP DATABASE IF EXISTS statements_digest;
SET sql_mode=default;
