include/master-slave.inc
Warnings:
Note	####	Sending passwords in plain text without SSL/TLS is extremely insecure.
Note	####	Storing MySQL user name or password information in the master info repository is not secure and is therefore not recommended. Please consider using the USER and PASSWORD connection options for START SLAVE; see the 'START SLAVE Syntax' in the MySQL Manual for more information.
[connection master]
Skip unique check test of online copied ddl
# Establish another connection (user=root) for concurrent DML
###################################################################
case 1 Skip unique check with online DML
###################################################################
case 1.1 new table copies hidden pk and unique sk from old table, DML will insert duplicate key
###################################################################
CREATE TABLE t1(a INT, b VARCHAR(100), d FLOAT, UNIQUE KEY uk1_1(b));
INSERT INTO t1 VALUES (1, 'aaaa', 0.1), (2, 'bbbb', 0.2);
SET DEBUG_SYNC= 'xengine.inplace_copy_ddl_scan_base_begin SIGNAL start_dml WAIT_FOR dml_done';
ALTER TABLE t1 ADD COLUMN c CHAR(10) DEFAULT NULL AFTER b, ALGORITHM=INPLACE;
# Switch to dml connection
SET DEBUG_SYNC= 'now WAIT_FOR start_dml';
INSERT INTO t1 VALUES(3, 'cccc', 0.3);
INSERT INTO t1 VALUES(4, 'bbbb', 0.4);
ERROR 23000: Duplicate entry 'bbbb' for key 'uk1_1'
UPDATE t1 SET b='bbbbcccc' WHERE a=3;
SELECT * FROM t1;
a	b	d
1	aaaa	0.1
2	bbbb	0.2
3	bbbbcccc	0.3
SET DEBUG_SYNC= 'now SIGNAL dml_done';
CHECK TABLE t1;
Table	Op	Msg_type	Msg_text
test.t1	check	status	OK
include/rpl_sync.inc
show create table t1;
Table	Create Table
t1	CREATE TABLE `t1` (
  `a` int(11) DEFAULT NULL,
  `b` varchar(100) COLLATE utf8mb4_general_ci DEFAULT NULL,
  `c` char(10) COLLATE utf8mb4_general_ci DEFAULT NULL,
  `d` float DEFAULT NULL,
  UNIQUE KEY `uk1_1` (`b`)
) ENGINE=XENGINE DEFAULT CHARSET=utf8mb4 COLLATE=utf8mb4_general_ci
show create table t1;
Table	Create Table
t1	CREATE TABLE `t1` (
  `a` int(11) DEFAULT NULL,
  `b` varchar(100) DEFAULT NULL,
  `c` char(10) DEFAULT NULL,
  `d` float DEFAULT NULL,
  UNIQUE KEY `uk1_1` (`b`)
) ENGINE=InnoDB DEFAULT CHARSET=utf8mb4 COLLATE=utf8mb4_0900_ai_ci
include/assert.inc [master-slave t1 is same]
SELECT * FROM t1;
a	b	c	d
1	aaaa	NULL	0.1
2	bbbb	NULL	0.2
3	bbbbcccc	NULL	0.3
DROP TABLE t1;
###################################################################
case 1.2 new table copies user defined pk and unique sk from old table, DML will insert duplicate key
###################################################################
CREATE TABLE t1(a INT PRIMARY KEY, b VARCHAR(100), d FLOAT, UNIQUE KEY uk1_2(b));
INSERT INTO t1 VALUES (1, 'aaaa', 0.1), (2, 'bbbb', 0.2);
SET DEBUG_SYNC= 'xengine.inplace_copy_ddl_scan_base_begin SIGNAL start_dml WAIT_FOR dml_done';
ALTER TABLE t1 ADD COLUMN c CHAR(10) DEFAULT NULL AFTER b, ALGORITHM=INPLACE;
# Switch to dml connection
SET DEBUG_SYNC= 'now WAIT_FOR start_dml';
INSERT INTO t1 VALUES(3, 'cccc', 0.3);
INSERT INTO t1 VALUES(4, 'bbbb', 0.4);
ERROR 23000: Duplicate entry 'bbbb' for key 'uk1_2'
UPDATE t1 SET b='bbbbcccc' WHERE a=3;
SELECT * FROM t1;
a	b	d
1	aaaa	0.1
2	bbbb	0.2
3	bbbbcccc	0.3
SET DEBUG_SYNC= 'now SIGNAL dml_done';
CHECK TABLE t1;
Table	Op	Msg_type	Msg_text
test.t1	check	status	OK
include/rpl_sync.inc
show create table t1;
Table	Create Table
t1	CREATE TABLE `t1` (
  `a` int(11) NOT NULL,
  `b` varchar(100) COLLATE utf8mb4_general_ci DEFAULT NULL,
  `c` char(10) COLLATE utf8mb4_general_ci DEFAULT NULL,
  `d` float DEFAULT NULL,
  PRIMARY KEY (`a`),
  UNIQUE KEY `uk1_2` (`b`)
) ENGINE=XENGINE DEFAULT CHARSET=utf8mb4 COLLATE=utf8mb4_general_ci
show create table t1;
Table	Create Table
t1	CREATE TABLE `t1` (
  `a` int(11) NOT NULL,
  `b` varchar(100) DEFAULT NULL,
  `c` char(10) DEFAULT NULL,
  `d` float DEFAULT NULL,
  PRIMARY KEY (`a`),
  UNIQUE KEY `uk1_2` (`b`)
) ENGINE=InnoDB DEFAULT CHARSET=utf8mb4 COLLATE=utf8mb4_0900_ai_ci
include/assert.inc [master-slave t1 is same]
INSERT INTO t1 VALUES(3, 'cccc', 'c', 0.3);
ERROR 23000: Duplicate entry '3' for key 'PRIMARY'
INSERT INTO t1 VALUES(4, 'dddd', 'd', 0.4);
SELECT * FROM t1;
a	b	c	d
1	aaaa	NULL	0.1
2	bbbb	NULL	0.2
3	bbbbcccc	NULL	0.3
4	dddd	d	0.4
DROP TABLE t1;
###################################################################
case 1.3 new table copies hidden pk and unique sk from old table, DML will add duplicate key with update
###################################################################
CREATE TABLE t1(a INT, b VARCHAR(100), d FLOAT, UNIQUE KEY uk1_3(b));
INSERT INTO t1 VALUES (1, 'aaaa', 0.1), (2, 'bbbb', 0.2);
SET DEBUG_SYNC= 'xengine.inplace_copy_ddl_scan_base_begin SIGNAL start_dml WAIT_FOR dml_done';
ALTER TABLE t1 ADD COLUMN c CHAR(10) DEFAULT NULL AFTER b, ALGORITHM=INPLACE;
# Switch to dml connection
SET DEBUG_SYNC= 'now WAIT_FOR start_dml';
INSERT INTO t1 VALUES(3, 'cccc', 0.3);
UPDATE t1 SET b='bbbb' WHERE a=1;
ERROR 23000: Duplicate entry 'bbbb' for key 'uk1_3'
UPDATE t1 SET b='bbbbcccc' WHERE a=3;
SELECT * FROM t1;
a	b	d
1	aaaa	0.1
2	bbbb	0.2
3	bbbbcccc	0.3
SET DEBUG_SYNC= 'now SIGNAL dml_done';
CHECK TABLE t1;
Table	Op	Msg_type	Msg_text
test.t1	check	status	OK
include/rpl_sync.inc
show create table t1;
Table	Create Table
t1	CREATE TABLE `t1` (
  `a` int(11) DEFAULT NULL,
  `b` varchar(100) COLLATE utf8mb4_general_ci DEFAULT NULL,
  `c` char(10) COLLATE utf8mb4_general_ci DEFAULT NULL,
  `d` float DEFAULT NULL,
  UNIQUE KEY `uk1_3` (`b`)
) ENGINE=XENGINE DEFAULT CHARSET=utf8mb4 COLLATE=utf8mb4_general_ci
show create table t1;
Table	Create Table
t1	CREATE TABLE `t1` (
  `a` int(11) DEFAULT NULL,
  `b` varchar(100) DEFAULT NULL,
  `c` char(10) DEFAULT NULL,
  `d` float DEFAULT NULL,
  UNIQUE KEY `uk1_3` (`b`)
) ENGINE=InnoDB DEFAULT CHARSET=utf8mb4 COLLATE=utf8mb4_0900_ai_ci
include/assert.inc [master-slave t1 is same]
SELECT * FROM t1;
a	b	c	d
1	aaaa	NULL	0.1
2	bbbb	NULL	0.2
3	bbbbcccc	NULL	0.3
DROP TABLE t1;
###################################################################
case 1.4 new table copies user defined pk and unique sk from old table, DML will add duplicate key with update
###################################################################
CREATE TABLE t1(a INT PRIMARY KEY, b VARCHAR(100), d FLOAT, UNIQUE KEY uk1_4(b));
INSERT INTO t1 VALUES (1, 'aaaa', 0.1), (2, 'bbbb', 0.2);
SET DEBUG_SYNC= 'xengine.inplace_copy_ddl_scan_base_begin SIGNAL start_dml WAIT_FOR dml_done';
ALTER TABLE t1 ADD COLUMN c CHAR(10) DEFAULT NULL AFTER b, ALGORITHM=INPLACE;
# Switch to dml connection
SET DEBUG_SYNC= 'now WAIT_FOR start_dml';
INSERT INTO t1 VALUES(3, 'cccc', 0.3);
UPDATE t1 SET b='bbbb' WHERE a=3;
ERROR 23000: Duplicate entry 'bbbb' for key 'uk1_4'
UPDATE t1 SET b='bbbbcccc' WHERE a=3;
SELECT * FROM t1;
a	b	d
1	aaaa	0.1
2	bbbb	0.2
3	bbbbcccc	0.3
SET DEBUG_SYNC= 'now SIGNAL dml_done';
CHECK TABLE t1;
Table	Op	Msg_type	Msg_text
test.t1	check	status	OK
include/rpl_sync.inc
show create table t1;
Table	Create Table
t1	CREATE TABLE `t1` (
  `a` int(11) NOT NULL,
  `b` varchar(100) COLLATE utf8mb4_general_ci DEFAULT NULL,
  `c` char(10) COLLATE utf8mb4_general_ci DEFAULT NULL,
  `d` float DEFAULT NULL,
  PRIMARY KEY (`a`),
  UNIQUE KEY `uk1_4` (`b`)
) ENGINE=XENGINE DEFAULT CHARSET=utf8mb4 COLLATE=utf8mb4_general_ci
show create table t1;
Table	Create Table
t1	CREATE TABLE `t1` (
  `a` int(11) NOT NULL,
  `b` varchar(100) DEFAULT NULL,
  `c` char(10) DEFAULT NULL,
  `d` float DEFAULT NULL,
  PRIMARY KEY (`a`),
  UNIQUE KEY `uk1_4` (`b`)
) ENGINE=InnoDB DEFAULT CHARSET=utf8mb4 COLLATE=utf8mb4_0900_ai_ci
include/assert.inc [master-slave t1 is same]
INSERT INTO t1 VALUES(5, 'bbbb', 'c', 0.5);
ERROR 23000: Duplicate entry 'bbbb' for key 'uk1_4'
INSERT INTO t1 VALUES(4, 'dddd', 'd', 0.4);
SELECT * FROM t1;
a	b	c	d
1	aaaa	NULL	0.1
2	bbbb	NULL	0.2
3	bbbbcccc	NULL	0.3
4	dddd	d	0.4
DROP TABLE t1;
###################################################################
case 1.5 Skip unique check when DDL do index renaming with other rebuild DDL operation
###################################################################
CREATE TABLE t1(a INT PRIMARY KEY, b VARCHAR(100), d INT, UNIQUE KEY ukb(b(4)), KEY sk(d));
INSERT INTO t1 VALUES (1, 'aaaa', 1), (2, 'bbbbbbbb', 2);
SET DEBUG_SYNC= 'xengine.inplace_copy_ddl_scan_base_begin SIGNAL start_dml WAIT_FOR dml_done';
ALTER TABLE t1 ADD COLUMN c CHAR(10) AFTER b, RENAME KEY ukb to uk1_5, RENAME KEY sk TO sk1_5, ALGORITHM=INPLACE;
# Switch to dml connection
SET DEBUG_SYNC= 'now WAIT_FOR start_dml';
INSERT INTO t1 VALUES(3, 'ccccccccc', 2);
UPDATE t1 SET b='bbbbccccc' WHERE a=3;
ERROR 23000: Duplicate entry 'bbbb' for key 'ukb'
UPDATE t1 SET b='bbbcccc' WHERE a=3;
SELECT * FROM t1;
a	b	d
1	aaaa	1
2	bbbbbbbb	2
3	bbbcccc	2
SET DEBUG_SYNC= 'now SIGNAL dml_done';
CHECK TABLE t1;
Table	Op	Msg_type	Msg_text
test.t1	check	status	OK
include/rpl_sync.inc
show create table t1;
Table	Create Table
t1	CREATE TABLE `t1` (
  `a` int(11) NOT NULL,
  `b` varchar(100) COLLATE utf8mb4_general_ci DEFAULT NULL,
  `c` char(10) COLLATE utf8mb4_general_ci DEFAULT NULL,
  `d` int(11) DEFAULT NULL,
  PRIMARY KEY (`a`),
  UNIQUE KEY `uk1_5` (`b`(4)),
  KEY `sk1_5` (`d`)
) ENGINE=XENGINE DEFAULT CHARSET=utf8mb4 COLLATE=utf8mb4_general_ci
show create table t1;
Table	Create Table
t1	CREATE TABLE `t1` (
  `a` int(11) NOT NULL,
  `b` varchar(100) DEFAULT NULL,
  `c` char(10) DEFAULT NULL,
  `d` int(11) DEFAULT NULL,
  PRIMARY KEY (`a`),
  UNIQUE KEY `uk1_5` (`b`(4)),
  KEY `sk1_5` (`d`)
) ENGINE=InnoDB DEFAULT CHARSET=utf8mb4 COLLATE=utf8mb4_0900_ai_ci
include/assert.inc [master-slave t1 is same]
INSERT INTO t1 VALUES(4, 'bbbcccc', 'ddddd', 0.3);
ERROR 23000: Duplicate entry 'bbbc' for key 'uk1_5'
SELECT * FROM t1;
a	b	c	d
1	aaaa	NULL	1
2	bbbbbbbb	NULL	2
3	bbbcccc	NULL	2
DROP TABLE t1;
###################################################################
case 1.6 Skip unique check when DDL alter visibility of index
###################################################################
CREATE TABLE t1(a INT PRIMARY KEY, b VARCHAR(100), d INT, UNIQUE KEY uk1_6(b(4)), KEY sk1_6(d));
INSERT INTO t1 VALUES (1, 'aaaa', 1), (2, 'bbbbbbbb', 2);
inplace ddl without rebuild
ALTER TABLE t1 ALTER INDEX uk1_6 INVISIBLE, ALTER INDEX sk1_6 INVISIBLE, ALGORITHM=INPLACE;
INSERT INTO t1 VALUES (3, 'aaaa', 1);
ERROR 23000: Duplicate entry 'aaaa' for key 'uk1_6'
include/rpl_sync.inc
show create table t1;
Table	Create Table
t1	CREATE TABLE `t1` (
  `a` int(11) NOT NULL,
  `b` varchar(100) COLLATE utf8mb4_general_ci DEFAULT NULL,
  `d` int(11) DEFAULT NULL,
  PRIMARY KEY (`a`),
  UNIQUE KEY `uk1_6` (`b`(4)) /*!80000 INVISIBLE */,
  KEY `sk1_6` (`d`) /*!80000 INVISIBLE */
) ENGINE=XENGINE DEFAULT CHARSET=utf8mb4 COLLATE=utf8mb4_general_ci
show create table t1;
Table	Create Table
t1	CREATE TABLE `t1` (
  `a` int(11) NOT NULL,
  `b` varchar(100) DEFAULT NULL,
  `d` int(11) DEFAULT NULL,
  PRIMARY KEY (`a`),
  UNIQUE KEY `uk1_6` (`b`(4)) /*!80000 INVISIBLE */,
  KEY `sk1_6` (`d`) /*!80000 INVISIBLE */
) ENGINE=InnoDB DEFAULT CHARSET=utf8mb4 COLLATE=utf8mb4_0900_ai_ci
include/assert.inc [master-slave t1 is same]
inplace ddl with rebuild
SET DEBUG_SYNC= 'xengine.inplace_copy_ddl_scan_base_begin SIGNAL start_dml WAIT_FOR dml_done';
ALTER TABLE t1 ALTER INDEX uk1_6 VISIBLE, ALTER INDEX sk1_6 VISIBLE, ADD COLUMN c CHAR(10) DEFAULT NULL AFTER b, ALGORITHM=INPLACE;
# Switch to dml connection
SET DEBUG_SYNC= 'now WAIT_FOR start_dml';
INSERT INTO t1 VALUES(3, 'ccccccccc', 2);
UPDATE t1 SET b='bbbbccccc' WHERE a=3;
ERROR 23000: Duplicate entry 'bbbb' for key 'uk1_6'
UPDATE t1 SET b='bbbccccc' WHERE a=3;
SELECT * FROM t1;
a	b	d
1	aaaa	1
2	bbbbbbbb	2
3	bbbccccc	2
SET DEBUG_SYNC= 'now SIGNAL dml_done';
CHECK TABLE t1;
Table	Op	Msg_type	Msg_text
test.t1	check	status	OK
INSERT INTO t1 VALUES (3, 'aaaa', 'c', 1);
ERROR 23000: Duplicate entry '3' for key 'PRIMARY'
SELECT * FROM t1;
a	b	c	d
1	aaaa	NULL	1
2	bbbbbbbb	NULL	2
3	bbbccccc	NULL	2
DROP TABLE t1;
###################################################################
case 2 Don't skip unique check with online DML
###################################################################
case 2.1 new table copies hidden pk and change unique sk, DML will insert duplicate key
###################################################################
CREATE TABLE t1(a INT, b VARCHAR(100), d FLOAT, UNIQUE KEY uk2_1(b(10)));
INSERT INTO t1 VALUES (1, 'aaaa', 0.1), (2, 'bbbbbbbb', 0.2);
SET DEBUG_SYNC= 'xengine.inplace_copy_ddl_scan_base_begin SIGNAL start_dml WAIT_FOR dml_done';
ALTER TABLE t1 DROP KEY uk2_1, ADD UNIQUE KEY uk2_1(a, b(4)), ADD COLUMN c CHAR(10) DEFAULT NULL AFTER b, ALGORITHM=INPLACE;
# Switch to dml connection
SET DEBUG_SYNC= 'now WAIT_FOR start_dml';
INSERT INTO t1 VALUES(3, 'cccc', 0.3);
INSERT INTO t1 VALUES(2, 'bbbb', 0.4);
SELECT * FROM t1;
a	b	d
1	aaaa	0.1
2	bbbbbbbb	0.2
3	cccc	0.3
2	bbbb	0.4
SET DEBUG_SYNC= 'now SIGNAL dml_done';
ERROR 23000: Duplicate entry '2-bbbb' for key 'uk2_1'
CHECK TABLE t1;
Table	Op	Msg_type	Msg_text
test.t1	check	status	OK
include/rpl_sync.inc
show create table t1;
Table	Create Table
t1	CREATE TABLE `t1` (
  `a` int(11) DEFAULT NULL,
  `b` varchar(100) COLLATE utf8mb4_general_ci DEFAULT NULL,
  `d` float DEFAULT NULL,
  UNIQUE KEY `uk2_1` (`b`(10))
) ENGINE=XENGINE DEFAULT CHARSET=utf8mb4 COLLATE=utf8mb4_general_ci
show create table t1;
Table	Create Table
t1	CREATE TABLE `t1` (
  `a` int(11) DEFAULT NULL,
  `b` varchar(100) DEFAULT NULL,
  `d` float DEFAULT NULL,
  UNIQUE KEY `uk2_1` (`b`(10))
) ENGINE=InnoDB DEFAULT CHARSET=utf8mb4 COLLATE=utf8mb4_0900_ai_ci
include/assert.inc [master-slave t1 is same]
SELECT * FROM t1;
a	b	d
1	aaaa	0.1
2	bbbbbbbb	0.2
3	cccc	0.3
2	bbbb	0.4
DROP TABLE t1;
###################################################################
case 2.2 new table copies user defined pk and change unique sk, DML will insert duplicate key
###################################################################
CREATE TABLE t1(a INT PRIMARY KEY, b VARCHAR(100), d INT, UNIQUE KEY uk2_2(b));
INSERT INTO t1 VALUES (1, 'aaaa', 1), (2, 'bbbbbbbb', 2);
SET DEBUG_SYNC= 'xengine.inplace_create_sk_scan_base_begin SIGNAL start_dml WAIT_FOR dml_done';
ALTER TABLE t1 DROP KEY uk2_2, ADD UNIQUE KEY uk2_2(b(4), d), ADD COLUMN c CHAR(10) DEFAULT NULL AFTER b, ALGORITHM=INPLACE;
# Switch to dml connection
SET DEBUG_SYNC= 'now WAIT_FOR start_dml';
INSERT INTO t1 VALUES(3, 'cccc', 3);
INSERT INTO t1 VALUES(4, 'bbbb', 2);
SELECT * FROM t1;
a	b	d
1	aaaa	1
2	bbbbbbbb	2
3	cccc	3
4	bbbb	2
SET DEBUG_SYNC= 'now SIGNAL dml_done';
ERROR 23000: Duplicate entry 'bbbb-2' for key 'uk2_2'
CHECK TABLE t1;
Table	Op	Msg_type	Msg_text
test.t1	check	status	OK
include/rpl_sync.inc
show create table t1;
Table	Create Table
t1	CREATE TABLE `t1` (
  `a` int(11) NOT NULL,
  `b` varchar(100) COLLATE utf8mb4_general_ci DEFAULT NULL,
  `d` int(11) DEFAULT NULL,
  PRIMARY KEY (`a`),
  UNIQUE KEY `uk2_2` (`b`)
) ENGINE=XENGINE DEFAULT CHARSET=utf8mb4 COLLATE=utf8mb4_general_ci
show create table t1;
Table	Create Table
t1	CREATE TABLE `t1` (
  `a` int(11) NOT NULL,
  `b` varchar(100) DEFAULT NULL,
  `d` int(11) DEFAULT NULL,
  PRIMARY KEY (`a`),
  UNIQUE KEY `uk2_2` (`b`)
) ENGINE=InnoDB DEFAULT CHARSET=utf8mb4 COLLATE=utf8mb4_0900_ai_ci
include/assert.inc [master-slave t1 is same]
INSERT INTO t1 VALUES(3, 'cccc', 3);
ERROR 23000: Duplicate entry '3' for key 'PRIMARY'
SELECT * FROM t1;
a	b	d
1	aaaa	1
2	bbbbbbbb	2
3	cccc	3
4	bbbb	2
DROP TABLE t1;
###################################################################
case 2.3 new table copies hidden pk and change unique sk, DML will add duplicate key with update
###################################################################
CREATE TABLE t1(a INT, b VARCHAR(100), d FLOAT, UNIQUE KEY uk2_3(b(10)));
INSERT INTO t1 VALUES (1, 'aaaa', 0.1), (2, 'bbbbbbbb', 0.2);
SET DEBUG_SYNC= 'xengine.inplace_create_sk_scan_base_begin SIGNAL start_dml WAIT_FOR dml_done';
ALTER TABLE t1 DROP KEY uk2_3, ADD UNIQUE KEY uk2_3(a, b(4)), ADD COLUMN c CHAR(10) DEFAULT NULL AFTER b, ALGORITHM=INPLACE;
# Switch to dml connection
SET DEBUG_SYNC= 'now WAIT_FOR start_dml';
INSERT INTO t1 VALUES(3, 'cccc', 0.3);
UPDATE t1 SET a=2, b='bbbbcc' WHERE a=3;
SELECT * FROM t1;
a	b	d
1	aaaa	0.1
2	bbbbbbbb	0.2
2	bbbbcc	0.3
SET DEBUG_SYNC= 'now SIGNAL dml_done';
ERROR 23000: Duplicate entry '2-bbbb' for key 'uk2_3'
CHECK TABLE t1;
Table	Op	Msg_type	Msg_text
test.t1	check	status	OK
include/rpl_sync.inc
show create table t1;
Table	Create Table
t1	CREATE TABLE `t1` (
  `a` int(11) DEFAULT NULL,
  `b` varchar(100) COLLATE utf8mb4_general_ci DEFAULT NULL,
  `d` float DEFAULT NULL,
  UNIQUE KEY `uk2_3` (`b`(10))
) ENGINE=XENGINE DEFAULT CHARSET=utf8mb4 COLLATE=utf8mb4_general_ci
show create table t1;
Table	Create Table
t1	CREATE TABLE `t1` (
  `a` int(11) DEFAULT NULL,
  `b` varchar(100) DEFAULT NULL,
  `d` float DEFAULT NULL,
  UNIQUE KEY `uk2_3` (`b`(10))
) ENGINE=InnoDB DEFAULT CHARSET=utf8mb4 COLLATE=utf8mb4_0900_ai_ci
include/assert.inc [master-slave t1 is same]
SELECT * FROM t1;
a	b	d
1	aaaa	0.1
2	bbbbbbbb	0.2
2	bbbbcc	0.3
DROP TABLE t1;
###################################################################
case 2.4 new table copies user defined pk and change unique sk, DML will add duplicate key with update
###################################################################
CREATE TABLE t1(a INT PRIMARY KEY, b VARCHAR(100), d INT, UNIQUE KEY uk2_4(b(10)));
INSERT INTO t1 VALUES (1, 'aaaa', 1), (2, 'bbbbbbbb', 2);
SET DEBUG_SYNC= 'xengine.inplace_create_sk_scan_base_begin SIGNAL start_dml WAIT_FOR dml_done';
ALTER TABLE t1 DROP KEY uk2_4, ADD UNIQUE KEY uk2_4(b(4), d), ADD COLUMN c CHAR(10) DEFAULT NULL AFTER b, ALGORITHM=INPLACE;
# Switch to dml connection
SET DEBUG_SYNC= 'now WAIT_FOR start_dml';
INSERT INTO t1 VALUES(3, 'cccc', 2);
UPDATE t1 SET b='bbbb' WHERE a=3;
SELECT * FROM t1;
a	b	d
1	aaaa	1
2	bbbbbbbb	2
3	bbbb	2
SET DEBUG_SYNC= 'now SIGNAL dml_done';
ERROR 23000: Duplicate entry 'bbbb-2' for key 'uk2_4'
CHECK TABLE t1;
Table	Op	Msg_type	Msg_text
test.t1	check	status	OK
include/rpl_sync.inc
show create table t1;
Table	Create Table
t1	CREATE TABLE `t1` (
  `a` int(11) NOT NULL,
  `b` varchar(100) COLLATE utf8mb4_general_ci DEFAULT NULL,
  `d` int(11) DEFAULT NULL,
  PRIMARY KEY (`a`),
  UNIQUE KEY `uk2_4` (`b`(10))
) ENGINE=XENGINE DEFAULT CHARSET=utf8mb4 COLLATE=utf8mb4_general_ci
show create table t1;
Table	Create Table
t1	CREATE TABLE `t1` (
  `a` int(11) NOT NULL,
  `b` varchar(100) DEFAULT NULL,
  `d` int(11) DEFAULT NULL,
  PRIMARY KEY (`a`),
  UNIQUE KEY `uk2_4` (`b`(10))
) ENGINE=InnoDB DEFAULT CHARSET=utf8mb4 COLLATE=utf8mb4_0900_ai_ci
include/assert.inc [master-slave t1 is same]
INSERT INTO t1 VALUES(3, 'cccc', 3);
ERROR 23000: Duplicate entry '3' for key 'PRIMARY'
SELECT * FROM t1;
a	b	d
1	aaaa	1
2	bbbbbbbb	2
3	bbbb	2
DROP TABLE t1;
###################################################################
case 2.5 Don't skip unique check when DDL change index definition and do index renaming
###################################################################
CREATE TABLE t1(a INT PRIMARY KEY, b VARCHAR(100), c CHAR(10), d INT, UNIQUE KEY ukb(b(4), c(6)), KEY sk(d));
INSERT INTO t1 VALUES (1, 'aaaa1111', 'c111111', 1), (2, 'bbbb', 'cccccc', 2);
SET DEBUG_SYNC= 'xengine.inplace_create_sk_scan_base_begin SIGNAL start_dml WAIT_FOR dml_done';
ALTER TABLE t1 DROP COLUMN c, RENAME KEY ukb to uk2_5, RENAME KEY sk TO sk2_5, ALGORITHM=INPLACE;
# Switch to dml connection
SET DEBUG_SYNC= 'now WAIT_FOR start_dml';
INSERT INTO t1 VALUES(3, 'aaaa333333', 'ccccccccc', 2);
SELECT * FROM t1;
a	b	c	d
1	aaaa1111	c111111	1
2	bbbb	cccccc	2
3	aaaa333333	ccccccccc	2
SET DEBUG_SYNC= 'now SIGNAL dml_done';
ERROR 23000: Duplicate entry 'aaaa' for key 'uk2_5'
CHECK TABLE t1;
Table	Op	Msg_type	Msg_text
test.t1	check	status	OK
include/rpl_sync.inc
show create table t1;
Table	Create Table
t1	CREATE TABLE `t1` (
  `a` int(11) NOT NULL,
  `b` varchar(100) COLLATE utf8mb4_general_ci DEFAULT NULL,
  `c` char(10) COLLATE utf8mb4_general_ci DEFAULT NULL,
  `d` int(11) DEFAULT NULL,
  PRIMARY KEY (`a`),
  UNIQUE KEY `ukb` (`b`(4),`c`(6)),
  KEY `sk` (`d`)
) ENGINE=XENGINE DEFAULT CHARSET=utf8mb4 COLLATE=utf8mb4_general_ci
show create table t1;
Table	Create Table
t1	CREATE TABLE `t1` (
  `a` int(11) NOT NULL,
  `b` varchar(100) DEFAULT NULL,
  `c` char(10) DEFAULT NULL,
  `d` int(11) DEFAULT NULL,
  PRIMARY KEY (`a`),
  UNIQUE KEY `ukb` (`b`(4),`c`(6)),
  KEY `sk` (`d`)
) ENGINE=InnoDB DEFAULT CHARSET=utf8mb4 COLLATE=utf8mb4_0900_ai_ci
include/assert.inc [master-slave t1 is same]
INSERT INTO t1 VALUES(3, 'ccccccc', 'ddddd', 3);
ERROR 23000: Duplicate entry '3' for key 'PRIMARY'
SELECT * FROM t1;
a	b	c	d
1	aaaa1111	c111111	1
2	bbbb	cccccc	2
3	aaaa333333	ccccccccc	2
DROP TABLE t1;
###################################################################
case 2.6 new table redefines primary key and copies unique key
###################################################################
CREATE TABLE t1(a INT PRIMARY KEY, b VARCHAR(100), c CHAR(10), d INT NOT NULL, UNIQUE KEY ukb(b(4), c(6)));
INSERT INTO t1 VALUES (1, 'aaaa1111', 'c111111', 1), (2, 'bbbb', 'cccccc', 2);
SET DEBUG_SYNC= 'xengine.inplace_copy_ddl_scan_base_begin SIGNAL start_dml WAIT_FOR dml_done';
ALTER TABLE t1 DROP COLUMN a, ADD PRIMARY KEY(d), RENAME KEY ukb to uk2_6, ALGORITHM=INPLACE;
# Switch to dml connection
SET DEBUG_SYNC= 'now WAIT_FOR start_dml';
INSERT INTO t1 VALUES(3, 'aaaa333333', 'ccccccccc', 3);
SELECT * FROM t1;
a	b	c	d
1	aaaa1111	c111111	1
2	bbbb	cccccc	2
3	aaaa333333	ccccccccc	3
SET DEBUG_SYNC= 'now SIGNAL dml_done';
CHECK TABLE t1;
Table	Op	Msg_type	Msg_text
test.t1	check	status	OK
include/rpl_sync.inc
show create table t1;
Table	Create Table
t1	CREATE TABLE `t1` (
  `b` varchar(100) COLLATE utf8mb4_general_ci DEFAULT NULL,
  `c` char(10) COLLATE utf8mb4_general_ci DEFAULT NULL,
  `d` int(11) NOT NULL,
  PRIMARY KEY (`d`),
  UNIQUE KEY `uk2_6` (`b`(4),`c`(6))
) ENGINE=XENGINE DEFAULT CHARSET=utf8mb4 COLLATE=utf8mb4_general_ci
show create table t1;
Table	Create Table
t1	CREATE TABLE `t1` (
  `b` varchar(100) DEFAULT NULL,
  `c` char(10) DEFAULT NULL,
  `d` int(11) NOT NULL,
  PRIMARY KEY (`d`),
  UNIQUE KEY `uk2_6` (`b`(4),`c`(6))
) ENGINE=InnoDB DEFAULT CHARSET=utf8mb4 COLLATE=utf8mb4_0900_ai_ci
include/assert.inc [master-slave t1 is same]
INSERT INTO t1 VALUES('ccccccc', 'ddddd', 3);
ERROR 23000: Duplicate entry '3' for key 'PRIMARY'
SELECT * FROM t1;
b	c	d
aaaa1111	c111111	1
bbbb	cccccc	2
aaaa333333	ccccccccc	3
DROP TABLE t1;
include/rpl_sync.inc
include/rpl_end.inc
