include/master-slave.inc
Warnings:
Note	####	Sending passwords in plain text without SSL/TLS is extremely insecure.
Note	####	Storing MySQL user name or password information in the master info repository is not secure and is therefore not recommended. Please consider using the USER and PASSWORD connection options for START SLAVE; see the 'START SLAVE Syntax' in the MySQL Manual for more information.
[connection master]
Test adding unique index inplace(rebuild) in a table with primary key
###################################################################
# ref https://yuque.antfin-inc.com/db_core_team/internal_docs/wywa0h#f68c70b7
# t0: create table time
# t1: build-sk start time
# t2: build-base sk finish, and uk check start
# t3: uk-check finish
# d1: data in [t0-t1]
# d2: data in [t1-t2]
# d3: data in [t2-t3]
# d4: data in [t3-]
###################################################################
###################################################################
# case 1: key1 in d1 duplicates with key2 in d1
###################################################################
CREATE TABLE t1 (a INT primary key, b INT);
INSERT INTO t1 values(1, 1);
INSERT INTO t1 values(2, 1);
alter table t1 add index t1_b(b), ALGORITHM=INPLACE, LOCK=DEFAULT;
alter table t1 add column c int default 1, add unique index t1_ub(b), ALGORITHM=INPLACE, LOCK=DEFAULT;
ERROR 23000: Duplicate entry '1' for key 't1_ub'
select * from t1;
a	b
1	1
2	1
include/rpl_sync.inc
show create table t1;
Table	Create Table
t1	CREATE TABLE `t1` (
  `a` int(11) NOT NULL,
  `b` int(11) DEFAULT NULL,
  PRIMARY KEY (`a`),
  KEY `t1_b` (`b`)
) ENGINE=XENGINE DEFAULT CHARSET=utf8mb4 COLLATE=utf8mb4_general_ci
show create table t1;
Table	Create Table
t1	CREATE TABLE `t1` (
  `a` int(11) NOT NULL,
  `b` int(11) DEFAULT NULL,
  PRIMARY KEY (`a`),
  KEY `t1_b` (`b`)
) ENGINE=InnoDB DEFAULT CHARSET=utf8mb4 COLLATE=utf8mb4_0900_ai_ci
include/assert.inc [master-slave t1 is same]
drop table t1;
###################################################################
# case 1.2: key1 in d1 duplicates with key2 in d1, but with a deletion
###################################################################
CREATE TABLE t1 (a INT primary key, b INT);
INSERT INTO t1 values(1, 1);
DELETE FROM t1 WHERE b=1;
INSERT INTO t1 values(2, 1);
alter table t1 add index t1_b(b), ALGORITHM=INPLACE, LOCK=DEFAULT;
alter table t1 add column c int default 1, add unique index t1_ub(b), ALGORITHM=INPLACE, LOCK=DEFAULT;
Add unique index successfully
select * from t1;
a	b	c
2	1	1
include/rpl_sync.inc
show create table t1;
Table	Create Table
t1	CREATE TABLE `t1` (
  `a` int(11) NOT NULL,
  `b` int(11) DEFAULT NULL,
  `c` int(11) DEFAULT '1',
  PRIMARY KEY (`a`),
  UNIQUE KEY `t1_ub` (`b`),
  KEY `t1_b` (`b`)
) ENGINE=XENGINE DEFAULT CHARSET=utf8mb4 COLLATE=utf8mb4_general_ci
show create table t1;
Table	Create Table
t1	CREATE TABLE `t1` (
  `a` int(11) NOT NULL,
  `b` int(11) DEFAULT NULL,
  `c` int(11) DEFAULT '1',
  PRIMARY KEY (`a`),
  UNIQUE KEY `t1_ub` (`b`),
  KEY `t1_b` (`b`)
) ENGINE=InnoDB DEFAULT CHARSET=utf8mb4 COLLATE=utf8mb4_0900_ai_ci
include/assert.inc [master-slave t1 is same]
drop table t1;
# Using two connections for following tests, now establish connection con1 (user=root)
###################################################################
# case 2.1: key1 in d1 duplicates with inserted key2 in d2
###################################################################
CREATE TABLE t1 (a INT primary key, b INT);
insert into t1 values(1, 1);
SET DEBUG_SYNC= 'xengine.inplace_create_sk_scan_base_begin SIGNAL start_dml WAIT_FOR dml_done';
alter table t1 add column c int default 1, add unique index t1_ub(b), ALGORITHM=INPLACE, LOCK=DEFAULT;
# Switch to connection con1
SET DEBUG_SYNC= 'now WAIT_FOR start_dml';
insert into t1 values(5, 1);
select * from t1;
a	b
1	1
5	1
SET DEBUG_SYNC= 'now SIGNAL dml_done';
# Switch to connection master
ERROR 23000: Duplicate entry '1' for key 't1_ub'
select * from t1;
a	b
1	1
5	1
failed to add unique index
select * from t1;
a	b
1	1
5	1
include/rpl_sync.inc
show create table t1;
Table	Create Table
t1	CREATE TABLE `t1` (
  `a` int(11) NOT NULL,
  `b` int(11) DEFAULT NULL,
  PRIMARY KEY (`a`)
) ENGINE=XENGINE DEFAULT CHARSET=utf8mb4 COLLATE=utf8mb4_general_ci
show create table t1;
Table	Create Table
t1	CREATE TABLE `t1` (
  `a` int(11) NOT NULL,
  `b` int(11) DEFAULT NULL,
  PRIMARY KEY (`a`)
) ENGINE=InnoDB DEFAULT CHARSET=utf8mb4 COLLATE=utf8mb4_0900_ai_ci
include/assert.inc [master-slave t1 is same]
drop table t1;
###################################################################
# case 2.2: key1 in d1 duplicates with updated key2 in d2
###################################################################
CREATE TABLE t1 (a INT primary key, b INT);
insert into t1 values(1, 1);
insert into t1 values(2, 2);
SET DEBUG_SYNC= 'xengine.inplace_create_sk_scan_base_begin SIGNAL start_dml WAIT_FOR dml_done';
alter table t1 add column c int default 1, add unique index t1_ub(b), ALGORITHM=INPLACE, LOCK=DEFAULT;
# Switch to connection con1
SET DEBUG_SYNC= 'now WAIT_FOR start_dml';
UPDATE t1 SET b=1 WHERE a=2;
select * from t1;
a	b
1	1
2	1
SET DEBUG_SYNC= 'now SIGNAL dml_done';
# Switch to connection master
ERROR 23000: Duplicate entry '1' for key 't1_ub'
select * from t1;
a	b
1	1
2	1
failed to add unique index
select * from t1;
a	b
1	1
2	1
include/rpl_sync.inc
show create table t1;
Table	Create Table
t1	CREATE TABLE `t1` (
  `a` int(11) NOT NULL,
  `b` int(11) DEFAULT NULL,
  PRIMARY KEY (`a`)
) ENGINE=XENGINE DEFAULT CHARSET=utf8mb4 COLLATE=utf8mb4_general_ci
show create table t1;
Table	Create Table
t1	CREATE TABLE `t1` (
  `a` int(11) NOT NULL,
  `b` int(11) DEFAULT NULL,
  PRIMARY KEY (`a`)
) ENGINE=InnoDB DEFAULT CHARSET=utf8mb4 COLLATE=utf8mb4_0900_ai_ci
include/assert.inc [master-slave t1 is same]
drop table t1;
###################################################################
# case 2.3: key1 in d1 duplicates with inserted key2 in d2 but with a deletion before inserting key2
###################################################################
CREATE TABLE t1 (a INT primary key, b INT);
insert into t1 values(1, 1);
SET DEBUG_SYNC= 'xengine.inplace_create_sk_scan_base_begin SIGNAL start_dml WAIT_FOR dml_done';
alter table t1 add column c int default 1, add unique index t1_ub(b), ALGORITHM=INPLACE, LOCK=DEFAULT;
# Switch to connection con1
SET DEBUG_SYNC= 'now WAIT_FOR start_dml';
delete from t1 where b=1;
insert into t1 values(5, 1);
select * from t1;
a	b
5	1
SET DEBUG_SYNC= 'now SIGNAL dml_done';
# Switch to connection master
select * from t1;
a	b	c
5	1	1
add unique index successfully
select * from t1;
a	b	c
5	1	1
include/rpl_sync.inc
show create table t1;
Table	Create Table
t1	CREATE TABLE `t1` (
  `a` int(11) NOT NULL,
  `b` int(11) DEFAULT NULL,
  `c` int(11) DEFAULT '1',
  PRIMARY KEY (`a`),
  UNIQUE KEY `t1_ub` (`b`)
) ENGINE=XENGINE DEFAULT CHARSET=utf8mb4 COLLATE=utf8mb4_general_ci
show create table t1;
Table	Create Table
t1	CREATE TABLE `t1` (
  `a` int(11) NOT NULL,
  `b` int(11) DEFAULT NULL,
  `c` int(11) DEFAULT '1',
  PRIMARY KEY (`a`),
  UNIQUE KEY `t1_ub` (`b`)
) ENGINE=InnoDB DEFAULT CHARSET=utf8mb4 COLLATE=utf8mb4_0900_ai_ci
include/assert.inc [master-slave t1 is same]
drop table t1;
###################################################################
# case 2.4: key1 in d1 duplicates with inserted key2 in d2 but with a deletion after inserting key2
###################################################################
CREATE TABLE t1 (a INT primary key, b INT);
insert into t1 values(1, 1);
SET DEBUG_SYNC= 'xengine.inplace_create_sk_scan_base_begin SIGNAL start_dml WAIT_FOR dml_done';
alter table t1 add column c int default 1, add unique index t1_ub(b), ALGORITHM=INPLACE, LOCK=DEFAULT;
# Switch to connection con1
SET DEBUG_SYNC= 'now WAIT_FOR start_dml';
insert into t1 values(5, 1);
delete from t1 where b=1;
select * from t1;
a	b
SET DEBUG_SYNC= 'now SIGNAL dml_done';
# Switch to connection master
ERROR 23000: Duplicate entry '1' for key 't1_ub'
select * from t1;
a	b
failed to add unique index
select * from t1;
a	b
include/rpl_sync.inc
show create table t1;
Table	Create Table
t1	CREATE TABLE `t1` (
  `a` int(11) NOT NULL,
  `b` int(11) DEFAULT NULL,
  PRIMARY KEY (`a`)
) ENGINE=XENGINE DEFAULT CHARSET=utf8mb4 COLLATE=utf8mb4_general_ci
show create table t1;
Table	Create Table
t1	CREATE TABLE `t1` (
  `a` int(11) NOT NULL,
  `b` int(11) DEFAULT NULL,
  PRIMARY KEY (`a`)
) ENGINE=InnoDB DEFAULT CHARSET=utf8mb4 COLLATE=utf8mb4_0900_ai_ci
include/assert.inc [master-slave t1 is same]
drop table t1;
###################################################################
# case 2.5: key1 in d1 duplicates with multiple delete-insert on key2 in d2
###################################################################
CREATE TABLE t1 (a INT primary key, b INT);
insert into t1 values(1, 1);
SET DEBUG_SYNC= 'xengine.inplace_create_sk_scan_base_begin SIGNAL start_dml WAIT_FOR dml_done';
alter table t1 add column c int default 1, add unique index t1_ub(b), ALGORITHM=INPLACE, LOCK=DEFAULT;
# Switch to connection con1
SET DEBUG_SYNC= 'now WAIT_FOR start_dml';
delete from t1 where b=1;
insert into t1 values(3, 1);
delete from t1 where b=1;
insert into t1 values(5, 1);
select * from t1;
a	b
5	1
SET DEBUG_SYNC= 'now SIGNAL dml_done';
# Switch to connection master
select * from t1;
a	b	c
5	1	1
add unique index successfully
select * from t1;
a	b	c
5	1	1
include/rpl_sync.inc
show create table t1;
Table	Create Table
t1	CREATE TABLE `t1` (
  `a` int(11) NOT NULL,
  `b` int(11) DEFAULT NULL,
  `c` int(11) DEFAULT '1',
  PRIMARY KEY (`a`),
  UNIQUE KEY `t1_ub` (`b`)
) ENGINE=XENGINE DEFAULT CHARSET=utf8mb4 COLLATE=utf8mb4_general_ci
show create table t1;
Table	Create Table
t1	CREATE TABLE `t1` (
  `a` int(11) NOT NULL,
  `b` int(11) DEFAULT NULL,
  `c` int(11) DEFAULT '1',
  PRIMARY KEY (`a`),
  UNIQUE KEY `t1_ub` (`b`)
) ENGINE=InnoDB DEFAULT CHARSET=utf8mb4 COLLATE=utf8mb4_0900_ai_ci
include/assert.inc [master-slave t1 is same]
drop table t1;
###################################################################
# case 3.1: key1 in d1 duplicates with inserted key2 in d3
###################################################################
CREATE TABLE t1 (a INT primary key, b INT);
insert into t1 values(1, 1);
SET DEBUG_SYNC= 'xengine.inplace_create_sk_check_constraint_begin SIGNAL start_dml WAIT_FOR dml_done';
alter table t1 add column c int default 1, add unique index t1_ub(b), ALGORITHM=INPLACE, LOCK=DEFAULT;
# Switch to connection con1
SET DEBUG_SYNC= 'now WAIT_FOR start_dml';
insert into t1 values(5, 1);
select * from t1;
a	b
1	1
5	1
SET DEBUG_SYNC= 'now SIGNAL dml_done';
# Switch to connection master
ERROR 23000: Duplicate entry '1' for key 't1_ub'
select * from t1;
a	b
1	1
5	1
failed to add unique index
select * from t1;
a	b
1	1
5	1
include/rpl_sync.inc
show create table t1;
Table	Create Table
t1	CREATE TABLE `t1` (
  `a` int(11) NOT NULL,
  `b` int(11) DEFAULT NULL,
  PRIMARY KEY (`a`)
) ENGINE=XENGINE DEFAULT CHARSET=utf8mb4 COLLATE=utf8mb4_general_ci
show create table t1;
Table	Create Table
t1	CREATE TABLE `t1` (
  `a` int(11) NOT NULL,
  `b` int(11) DEFAULT NULL,
  PRIMARY KEY (`a`)
) ENGINE=InnoDB DEFAULT CHARSET=utf8mb4 COLLATE=utf8mb4_0900_ai_ci
include/assert.inc [master-slave t1 is same]
drop table t1;
###################################################################
# case 3.2: key1 in d1 duplicates with updated key2 in d3
###################################################################
CREATE TABLE t1 (a INT primary key, b INT);
insert into t1 values(1, 1);
insert into t1 values(2, 2);
SET DEBUG_SYNC= 'xengine.inplace_create_sk_check_constraint_begin SIGNAL start_dml WAIT_FOR dml_done';
alter table t1 add column c int default 1, add unique index t1_ub(b), ALGORITHM=INPLACE, LOCK=DEFAULT;
# Switch to connection con1
SET DEBUG_SYNC= 'now WAIT_FOR start_dml';
UPDATE t1 SET b=1 WHERE a=2;
select * from t1;
a	b
1	1
2	1
SET DEBUG_SYNC= 'now SIGNAL dml_done';
# Switch to connection master
ERROR 23000: Duplicate entry '1' for key 't1_ub'
select * from t1;
a	b
1	1
2	1
failed to add unique index
select * from t1;
a	b
1	1
2	1
include/rpl_sync.inc
show create table t1;
Table	Create Table
t1	CREATE TABLE `t1` (
  `a` int(11) NOT NULL,
  `b` int(11) DEFAULT NULL,
  PRIMARY KEY (`a`)
) ENGINE=XENGINE DEFAULT CHARSET=utf8mb4 COLLATE=utf8mb4_general_ci
show create table t1;
Table	Create Table
t1	CREATE TABLE `t1` (
  `a` int(11) NOT NULL,
  `b` int(11) DEFAULT NULL,
  PRIMARY KEY (`a`)
) ENGINE=InnoDB DEFAULT CHARSET=utf8mb4 COLLATE=utf8mb4_0900_ai_ci
include/assert.inc [master-slave t1 is same]
drop table t1;
###################################################################
# case 3.3: key1 in d1 duplicates with inserted key2 in d3 but with a deletion before inserting key2
###################################################################
CREATE TABLE t1 (a INT primary key, b INT);
insert into t1 values(1, 1);
SET DEBUG_SYNC= 'xengine.inplace_create_sk_check_constraint_begin SIGNAL start_dml WAIT_FOR dml_done';
alter table t1 add column c int default 1, add unique index t1_ub(b), ALGORITHM=INPLACE, LOCK=DEFAULT;
# Switch to connection con1
SET DEBUG_SYNC= 'now WAIT_FOR start_dml';
delete from t1 where b=1;
insert into t1 values(5, 1);
select * from t1;
a	b
5	1
SET DEBUG_SYNC= 'now SIGNAL dml_done';
# Switch to connection master
select * from t1;
a	b	c
5	1	1
add unique index successfully
select * from t1;
a	b	c
5	1	1
include/rpl_sync.inc
show create table t1;
Table	Create Table
t1	CREATE TABLE `t1` (
  `a` int(11) NOT NULL,
  `b` int(11) DEFAULT NULL,
  `c` int(11) DEFAULT '1',
  PRIMARY KEY (`a`),
  UNIQUE KEY `t1_ub` (`b`)
) ENGINE=XENGINE DEFAULT CHARSET=utf8mb4 COLLATE=utf8mb4_general_ci
show create table t1;
Table	Create Table
t1	CREATE TABLE `t1` (
  `a` int(11) NOT NULL,
  `b` int(11) DEFAULT NULL,
  `c` int(11) DEFAULT '1',
  PRIMARY KEY (`a`),
  UNIQUE KEY `t1_ub` (`b`)
) ENGINE=InnoDB DEFAULT CHARSET=utf8mb4 COLLATE=utf8mb4_0900_ai_ci
include/assert.inc [master-slave t1 is same]
drop table t1;
###################################################################
# case 3.4: key1 in d1 duplicates with inserted key2 in d3 but with a deletion after inserting key2
###################################################################
CREATE TABLE t1 (a INT primary key, b INT);
insert into t1 values(1, 1);
SET DEBUG_SYNC= 'xengine.inplace_create_sk_check_constraint_begin SIGNAL start_dml WAIT_FOR dml_done';
alter table t1 add column c int default 1, add unique index t1_ub(b), ALGORITHM=INPLACE, LOCK=DEFAULT;
# Switch to connection con1
SET DEBUG_SYNC= 'now WAIT_FOR start_dml';
insert into t1 values(5, 1);
delete from t1 where b=1;
select * from t1;
a	b
SET DEBUG_SYNC= 'now SIGNAL dml_done';
# Switch to connection master
ERROR 23000: Duplicate entry '1' for key 't1_ub'
select * from t1;
a	b
failed to add unique index
select * from t1;
a	b
include/rpl_sync.inc
show create table t1;
Table	Create Table
t1	CREATE TABLE `t1` (
  `a` int(11) NOT NULL,
  `b` int(11) DEFAULT NULL,
  PRIMARY KEY (`a`)
) ENGINE=XENGINE DEFAULT CHARSET=utf8mb4 COLLATE=utf8mb4_general_ci
show create table t1;
Table	Create Table
t1	CREATE TABLE `t1` (
  `a` int(11) NOT NULL,
  `b` int(11) DEFAULT NULL,
  PRIMARY KEY (`a`)
) ENGINE=InnoDB DEFAULT CHARSET=utf8mb4 COLLATE=utf8mb4_0900_ai_ci
include/assert.inc [master-slave t1 is same]
drop table t1;
###################################################################
# case 4.1: key1 in d1 duplicates with inserted key2 in d4
###################################################################
CREATE TABLE t1 (a INT primary key, b INT);
insert into t1 values(1, 1);
SET DEBUG_SYNC= 'xengine.inplace_create_sk_check_constraint_done SIGNAL start_dml WAIT_FOR dml_done';
alter table t1 add column c int default 1, add unique index t1_ub(b), ALGORITHM=INPLACE, LOCK=DEFAULT;
# Switch to connection con1
SET DEBUG_SYNC= 'now WAIT_FOR start_dml';
insert into t1 values(5, 1);
select * from t1;
a	b
1	1
5	1
SET DEBUG_SYNC= 'now SIGNAL dml_done';
# Switch to connection master
ERROR 23000: Duplicate entry '1' for key 't1_ub'
select * from t1;
a	b
1	1
5	1
failed to add unique index
select * from t1;
a	b
1	1
5	1
include/rpl_sync.inc
show create table t1;
Table	Create Table
t1	CREATE TABLE `t1` (
  `a` int(11) NOT NULL,
  `b` int(11) DEFAULT NULL,
  PRIMARY KEY (`a`)
) ENGINE=XENGINE DEFAULT CHARSET=utf8mb4 COLLATE=utf8mb4_general_ci
show create table t1;
Table	Create Table
t1	CREATE TABLE `t1` (
  `a` int(11) NOT NULL,
  `b` int(11) DEFAULT NULL,
  PRIMARY KEY (`a`)
) ENGINE=InnoDB DEFAULT CHARSET=utf8mb4 COLLATE=utf8mb4_0900_ai_ci
include/assert.inc [master-slave t1 is same]
drop table t1;
###################################################################
# case 4.2: key1 in d1 duplicates with updated key2 in d4
###################################################################
CREATE TABLE t1 (a INT primary key, b INT);
insert into t1 values(1, 1);
insert into t1 values(2, 2);
SET DEBUG_SYNC= 'xengine.inplace_create_sk_check_constraint_done SIGNAL start_dml WAIT_FOR dml_done';
alter table t1 add column c int default 1, add unique index t1_ub(b), ALGORITHM=INPLACE, LOCK=DEFAULT;
# Switch to connection con1
SET DEBUG_SYNC= 'now WAIT_FOR start_dml';
UPDATE t1 SET b=1 WHERE a=2;
select * from t1;
a	b
1	1
2	1
SET DEBUG_SYNC= 'now SIGNAL dml_done';
# Switch to connection master
ERROR 23000: Duplicate entry '1' for key 't1_ub'
select * from t1;
a	b
1	1
2	1
failed to add unique index
select * from t1;
a	b
1	1
2	1
include/rpl_sync.inc
show create table t1;
Table	Create Table
t1	CREATE TABLE `t1` (
  `a` int(11) NOT NULL,
  `b` int(11) DEFAULT NULL,
  PRIMARY KEY (`a`)
) ENGINE=XENGINE DEFAULT CHARSET=utf8mb4 COLLATE=utf8mb4_general_ci
show create table t1;
Table	Create Table
t1	CREATE TABLE `t1` (
  `a` int(11) NOT NULL,
  `b` int(11) DEFAULT NULL,
  PRIMARY KEY (`a`)
) ENGINE=InnoDB DEFAULT CHARSET=utf8mb4 COLLATE=utf8mb4_0900_ai_ci
include/assert.inc [master-slave t1 is same]
drop table t1;
###################################################################
# case 4.3: key1 in d1 duplicates with inserted key2 in d4 but with a deletion before inserting key2
###################################################################
CREATE TABLE t1 (a INT primary key, b INT);
insert into t1 values(1, 1);
SET DEBUG_SYNC= 'xengine.inplace_create_sk_check_constraint_done SIGNAL start_dml WAIT_FOR dml_done';
alter table t1 add column c int default 1, add unique index t1_ub(b), ALGORITHM=INPLACE, LOCK=DEFAULT;
# Switch to connection con1
SET DEBUG_SYNC= 'now WAIT_FOR start_dml';
delete from t1 where b=1;
insert into t1 values(5, 1);
select * from t1;
a	b
5	1
SET DEBUG_SYNC= 'now SIGNAL dml_done';
# Switch to connection master
select * from t1;
a	b	c
5	1	1
add unique index successfully
select * from t1;
a	b	c
5	1	1
include/rpl_sync.inc
show create table t1;
Table	Create Table
t1	CREATE TABLE `t1` (
  `a` int(11) NOT NULL,
  `b` int(11) DEFAULT NULL,
  `c` int(11) DEFAULT '1',
  PRIMARY KEY (`a`),
  UNIQUE KEY `t1_ub` (`b`)
) ENGINE=XENGINE DEFAULT CHARSET=utf8mb4 COLLATE=utf8mb4_general_ci
show create table t1;
Table	Create Table
t1	CREATE TABLE `t1` (
  `a` int(11) NOT NULL,
  `b` int(11) DEFAULT NULL,
  `c` int(11) DEFAULT '1',
  PRIMARY KEY (`a`),
  UNIQUE KEY `t1_ub` (`b`)
) ENGINE=InnoDB DEFAULT CHARSET=utf8mb4 COLLATE=utf8mb4_0900_ai_ci
include/assert.inc [master-slave t1 is same]
drop table t1;
###################################################################
# case 4.4: key1 in d1 duplicates with inserted key2 in d4 but with a deletion after inserting key2
###################################################################
CREATE TABLE t1 (a INT primary key, b INT);
insert into t1 values(1, 1);
SET DEBUG_SYNC= 'xengine.inplace_create_sk_check_constraint_done SIGNAL start_dml WAIT_FOR dml_done';
alter table t1 add column c int default 1, add unique index t1_ub(b), ALGORITHM=INPLACE, LOCK=DEFAULT;
# Switch to connection con1
SET DEBUG_SYNC= 'now WAIT_FOR start_dml';
insert into t1 values(5, 1);
delete from t1 where b=1;
select * from t1;
a	b
SET DEBUG_SYNC= 'now SIGNAL dml_done';
# Switch to connection master
ERROR 23000: Duplicate entry '1' for key 't1_ub'
select * from t1;
a	b
failed to add unique index
select * from t1;
a	b
include/rpl_sync.inc
show create table t1;
Table	Create Table
t1	CREATE TABLE `t1` (
  `a` int(11) NOT NULL,
  `b` int(11) DEFAULT NULL,
  PRIMARY KEY (`a`)
) ENGINE=XENGINE DEFAULT CHARSET=utf8mb4 COLLATE=utf8mb4_general_ci
show create table t1;
Table	Create Table
t1	CREATE TABLE `t1` (
  `a` int(11) NOT NULL,
  `b` int(11) DEFAULT NULL,
  PRIMARY KEY (`a`)
) ENGINE=InnoDB DEFAULT CHARSET=utf8mb4 COLLATE=utf8mb4_0900_ai_ci
include/assert.inc [master-slave t1 is same]
drop table t1;
###################################################################
# case 5.1: key1 in d2 duplicates with inserted key2 in d2
###################################################################
CREATE TABLE t1 (a INT primary key, b INT);
insert into t1 values(1, 1);
SET DEBUG_SYNC= 'xengine.inplace_create_sk_scan_base_begin SIGNAL start_dml WAIT_FOR dml_done';
alter table t1 add column c int default 1, add unique index t1_ub(b), ALGORITHM=INPLACE, LOCK=DEFAULT;
# Switch to connection con1
SET DEBUG_SYNC= 'now WAIT_FOR start_dml';
insert into t1 values(4, 2);
insert into t1 values(5, 2);
select * from t1;
a	b
1	1
4	2
5	2
SET DEBUG_SYNC= 'now SIGNAL dml_done';
# Switch to connection master
ERROR 23000: Duplicate entry '2' for key 't1_ub'
select * from t1;
a	b
1	1
4	2
5	2
failed to add unique index
select * from t1;
a	b
1	1
4	2
5	2
include/rpl_sync.inc
show create table t1;
Table	Create Table
t1	CREATE TABLE `t1` (
  `a` int(11) NOT NULL,
  `b` int(11) DEFAULT NULL,
  PRIMARY KEY (`a`)
) ENGINE=XENGINE DEFAULT CHARSET=utf8mb4 COLLATE=utf8mb4_general_ci
show create table t1;
Table	Create Table
t1	CREATE TABLE `t1` (
  `a` int(11) NOT NULL,
  `b` int(11) DEFAULT NULL,
  PRIMARY KEY (`a`)
) ENGINE=InnoDB DEFAULT CHARSET=utf8mb4 COLLATE=utf8mb4_0900_ai_ci
include/assert.inc [master-slave t1 is same]
drop table t1;
###################################################################
# case 5.2: key1 in d2 duplicates with updated key2 in d2
###################################################################
CREATE TABLE t1 (a INT primary key, b INT);
insert into t1 values(1, 1);
SET DEBUG_SYNC= 'xengine.inplace_create_sk_scan_base_begin SIGNAL start_dml WAIT_FOR dml_done';
alter table t1 add column c int default 1, add unique index t1_ub(b), ALGORITHM=INPLACE, LOCK=DEFAULT;
# Switch to connection con1
SET DEBUG_SYNC= 'now WAIT_FOR start_dml';
insert into t1 values(5, 2);
UPDATE t1 SET b=2 WHERE a=1;
select * from t1;
a	b
1	2
5	2
SET DEBUG_SYNC= 'now SIGNAL dml_done';
# Switch to connection master
ERROR 23000: Duplicate entry '2' for key 't1_ub'
select * from t1;
a	b
1	2
5	2
failed to add unique index
select * from t1;
a	b
1	2
5	2
include/rpl_sync.inc
show create table t1;
Table	Create Table
t1	CREATE TABLE `t1` (
  `a` int(11) NOT NULL,
  `b` int(11) DEFAULT NULL,
  PRIMARY KEY (`a`)
) ENGINE=XENGINE DEFAULT CHARSET=utf8mb4 COLLATE=utf8mb4_general_ci
show create table t1;
Table	Create Table
t1	CREATE TABLE `t1` (
  `a` int(11) NOT NULL,
  `b` int(11) DEFAULT NULL,
  PRIMARY KEY (`a`)
) ENGINE=InnoDB DEFAULT CHARSET=utf8mb4 COLLATE=utf8mb4_0900_ai_ci
include/assert.inc [master-slave t1 is same]
drop table t1;
###################################################################
# case 5.3: key1 in d2 duplicates with inserted key2 in d2 but with a deletion before inserting key2
###################################################################
CREATE TABLE t1 (a INT primary key, b INT);
insert into t1 values(1, 1);
SET DEBUG_SYNC= 'xengine.inplace_create_sk_scan_base_begin SIGNAL start_dml WAIT_FOR dml_done';
alter table t1 add column c int default 1, add unique index t1_ub(b), ALGORITHM=INPLACE, LOCK=DEFAULT;
# Switch to connection con1
SET DEBUG_SYNC= 'now WAIT_FOR start_dml';
insert into t1 values(4, 2);
delete from t1 where b=2;
insert into t1 values(5, 2);
select * from t1;
a	b
1	1
5	2
SET DEBUG_SYNC= 'now SIGNAL dml_done';
# Switch to connection master
select * from t1;
a	b	c
1	1	1
5	2	1
add unique index successfully
select * from t1;
a	b	c
1	1	1
5	2	1
include/rpl_sync.inc
show create table t1;
Table	Create Table
t1	CREATE TABLE `t1` (
  `a` int(11) NOT NULL,
  `b` int(11) DEFAULT NULL,
  `c` int(11) DEFAULT '1',
  PRIMARY KEY (`a`),
  UNIQUE KEY `t1_ub` (`b`)
) ENGINE=XENGINE DEFAULT CHARSET=utf8mb4 COLLATE=utf8mb4_general_ci
show create table t1;
Table	Create Table
t1	CREATE TABLE `t1` (
  `a` int(11) NOT NULL,
  `b` int(11) DEFAULT NULL,
  `c` int(11) DEFAULT '1',
  PRIMARY KEY (`a`),
  UNIQUE KEY `t1_ub` (`b`)
) ENGINE=InnoDB DEFAULT CHARSET=utf8mb4 COLLATE=utf8mb4_0900_ai_ci
include/assert.inc [master-slave t1 is same]
drop table t1;
###################################################################
# case 5.4: key1 in d2 duplicates with inserted key2 in d2 but with a deletion after inserting key2
###################################################################
CREATE TABLE t1 (a INT primary key, b INT);
insert into t1 values(1, 1);
SET DEBUG_SYNC= 'xengine.inplace_create_sk_scan_base_begin SIGNAL start_dml WAIT_FOR dml_done';
alter table t1 add column c int default 1, add unique index t1_ub(b), ALGORITHM=INPLACE, LOCK=DEFAULT;
# Switch to connection con1
SET DEBUG_SYNC= 'now WAIT_FOR start_dml';
insert into t1 values(4, 2);
insert into t1 values(5, 2);
delete from t1 where b=2;
select * from t1;
a	b
1	1
SET DEBUG_SYNC= 'now SIGNAL dml_done';
# Switch to connection master
ERROR 23000: Duplicate entry '2' for key 't1_ub'
select * from t1;
a	b
1	1
failed to add unique index
select * from t1;
a	b
1	1
include/rpl_sync.inc
show create table t1;
Table	Create Table
t1	CREATE TABLE `t1` (
  `a` int(11) NOT NULL,
  `b` int(11) DEFAULT NULL,
  PRIMARY KEY (`a`)
) ENGINE=XENGINE DEFAULT CHARSET=utf8mb4 COLLATE=utf8mb4_general_ci
show create table t1;
Table	Create Table
t1	CREATE TABLE `t1` (
  `a` int(11) NOT NULL,
  `b` int(11) DEFAULT NULL,
  PRIMARY KEY (`a`)
) ENGINE=InnoDB DEFAULT CHARSET=utf8mb4 COLLATE=utf8mb4_0900_ai_ci
include/assert.inc [master-slave t1 is same]
drop table t1;
###################################################################
# case 6.1: key1 in d2 duplicates with inserted key2 in d3
###################################################################
CREATE TABLE t1 (a INT primary key, b INT);
insert into t1 values(1, 1);
SET DEBUG_SYNC= 'xengine.inplace_create_sk_scan_base_begin        SIGNAL dml1 WAIT_FOR dml1_end';
SET DEBUG_SYNC= 'xengine.inplace_create_sk_check_constraint_begin SIGNAL dml2 WAIT_FOR dml2_end';
alter table t1 add column c int default 1, add unique index t1_ub(b), ALGORITHM=INPLACE, LOCK=DEFAULT;
# Switch to connection con1
SET DEBUG_SYNC= 'now WAIT_FOR dml1';
insert into t1 values(2, 2);
SET DEBUG_SYNC= 'now SIGNAL dml1_end';
SET DEBUG_SYNC= 'now WAIT_FOR dml2';
insert into t1 values(3, 2);
select * from t1;
a	b
1	1
2	2
3	2
SET DEBUG_SYNC= 'now SIGNAL dml2_end';
# Switch to connection master
ERROR 23000: Duplicate entry '2' for key 't1_ub'
select * from t1;
a	b
1	1
2	2
3	2
failed to add unique index
select * from t1;
a	b
1	1
2	2
3	2
include/rpl_sync.inc
show create table t1;
Table	Create Table
t1	CREATE TABLE `t1` (
  `a` int(11) NOT NULL,
  `b` int(11) DEFAULT NULL,
  PRIMARY KEY (`a`)
) ENGINE=XENGINE DEFAULT CHARSET=utf8mb4 COLLATE=utf8mb4_general_ci
show create table t1;
Table	Create Table
t1	CREATE TABLE `t1` (
  `a` int(11) NOT NULL,
  `b` int(11) DEFAULT NULL,
  PRIMARY KEY (`a`)
) ENGINE=InnoDB DEFAULT CHARSET=utf8mb4 COLLATE=utf8mb4_0900_ai_ci
include/assert.inc [master-slave t1 is same]
drop table t1;
###################################################################
# case 6.2: key1 in d2 duplicates with updated key2 in d3
###################################################################
CREATE TABLE t1 (a INT primary key, b INT);
insert into t1 values(1, 1);
SET DEBUG_SYNC= 'xengine.inplace_create_sk_scan_base_begin        SIGNAL dml1 WAIT_FOR dml1_end';
SET DEBUG_SYNC= 'xengine.inplace_create_sk_check_constraint_begin SIGNAL dml2 WAIT_FOR dml2_end';
alter table t1 add column c int default 1, add unique index t1_ub(b), ALGORITHM=INPLACE, LOCK=DEFAULT;
# Switch to connection con1
SET DEBUG_SYNC= 'now WAIT_FOR dml1';
insert into t1 values(2, 2);
SET DEBUG_SYNC= 'now SIGNAL dml1_end';
SET DEBUG_SYNC= 'now WAIT_FOR dml2';
update t1 set b=2 where a=1;
select * from t1;
a	b
1	2
2	2
SET DEBUG_SYNC= 'now SIGNAL dml2_end';
# Switch to connection master
ERROR 23000: Duplicate entry '2' for key 't1_ub'
select * from t1;
a	b
1	2
2	2
failed to add unique index
select * from t1;
a	b
1	2
2	2
include/rpl_sync.inc
show create table t1;
Table	Create Table
t1	CREATE TABLE `t1` (
  `a` int(11) NOT NULL,
  `b` int(11) DEFAULT NULL,
  PRIMARY KEY (`a`)
) ENGINE=XENGINE DEFAULT CHARSET=utf8mb4 COLLATE=utf8mb4_general_ci
show create table t1;
Table	Create Table
t1	CREATE TABLE `t1` (
  `a` int(11) NOT NULL,
  `b` int(11) DEFAULT NULL,
  PRIMARY KEY (`a`)
) ENGINE=InnoDB DEFAULT CHARSET=utf8mb4 COLLATE=utf8mb4_0900_ai_ci
include/assert.inc [master-slave t1 is same]
drop table t1;
###################################################################
# case 6.3: key1 in d2 duplicates with inserted key2 in d3 but with a deletion before inserting key2
###################################################################
CREATE TABLE t1 (a INT primary key, b INT);
insert into t1 values(1, 1);
SET DEBUG_SYNC= 'xengine.inplace_create_sk_scan_base_begin        SIGNAL dml1 WAIT_FOR dml1_end';
SET DEBUG_SYNC= 'xengine.inplace_create_sk_check_constraint_begin SIGNAL dml2 WAIT_FOR dml2_end';
alter table t1 add column c int default 1, add unique index t1_ub(b), ALGORITHM=INPLACE, LOCK=DEFAULT;
# Switch to connection con1
SET DEBUG_SYNC= 'now WAIT_FOR dml1';
insert into t1 values(2, 2);
SET DEBUG_SYNC= 'now SIGNAL dml1_end';
SET DEBUG_SYNC= 'now WAIT_FOR dml2';
delete from t1 where b=2;
insert into t1 values(3, 2);
select * from t1;
a	b
1	1
3	2
SET DEBUG_SYNC= 'now SIGNAL dml2_end';
# Switch to connection master
select * from t1;
a	b	c
1	1	1
3	2	1
add unique index successfully
select * from t1;
a	b	c
1	1	1
3	2	1
include/rpl_sync.inc
show create table t1;
Table	Create Table
t1	CREATE TABLE `t1` (
  `a` int(11) NOT NULL,
  `b` int(11) DEFAULT NULL,
  `c` int(11) DEFAULT '1',
  PRIMARY KEY (`a`),
  UNIQUE KEY `t1_ub` (`b`)
) ENGINE=XENGINE DEFAULT CHARSET=utf8mb4 COLLATE=utf8mb4_general_ci
show create table t1;
Table	Create Table
t1	CREATE TABLE `t1` (
  `a` int(11) NOT NULL,
  `b` int(11) DEFAULT NULL,
  `c` int(11) DEFAULT '1',
  PRIMARY KEY (`a`),
  UNIQUE KEY `t1_ub` (`b`)
) ENGINE=InnoDB DEFAULT CHARSET=utf8mb4 COLLATE=utf8mb4_0900_ai_ci
include/assert.inc [master-slave t1 is same]
drop table t1;
###################################################################
# case 6.4: key1 in d2 duplicates with inserted key2 in d3 but with a deletion after inserting key2
###################################################################
CREATE TABLE t1 (a INT primary key, b INT);
insert into t1 values(1, 1);
SET DEBUG_SYNC= 'xengine.inplace_create_sk_scan_base_begin        SIGNAL dml1 WAIT_FOR dml1_end';
SET DEBUG_SYNC= 'xengine.inplace_create_sk_check_constraint_begin SIGNAL dml2 WAIT_FOR dml2_end';
alter table t1 add column c int default 1, add unique index t1_ub(b), ALGORITHM=INPLACE, LOCK=DEFAULT;
# Switch to connection con1
SET DEBUG_SYNC= 'now WAIT_FOR dml1';
insert into t1 values(2, 2);
SET DEBUG_SYNC= 'now SIGNAL dml1_end';
SET DEBUG_SYNC= 'now WAIT_FOR dml2';
insert into t1 values(3, 2);
delete from t1 where b=2;
select * from t1;
a	b
1	1
SET DEBUG_SYNC= 'now SIGNAL dml2_end';
# Switch to connection master
ERROR 23000: Duplicate entry '2' for key 't1_ub'
select * from t1;
a	b
1	1
failed to add unique index
select * from t1;
a	b
1	1
include/rpl_sync.inc
show create table t1;
Table	Create Table
t1	CREATE TABLE `t1` (
  `a` int(11) NOT NULL,
  `b` int(11) DEFAULT NULL,
  PRIMARY KEY (`a`)
) ENGINE=XENGINE DEFAULT CHARSET=utf8mb4 COLLATE=utf8mb4_general_ci
show create table t1;
Table	Create Table
t1	CREATE TABLE `t1` (
  `a` int(11) NOT NULL,
  `b` int(11) DEFAULT NULL,
  PRIMARY KEY (`a`)
) ENGINE=InnoDB DEFAULT CHARSET=utf8mb4 COLLATE=utf8mb4_0900_ai_ci
include/assert.inc [master-slave t1 is same]
drop table t1;
###################################################################
# case 7.1: key1 in d2 duplicates with inserted key2 in d4
###################################################################
CREATE TABLE t1 (a INT primary key, b INT);
insert into t1 values(1, 1);
SET DEBUG_SYNC= 'xengine.inplace_create_sk_scan_base_begin        SIGNAL dml1 WAIT_FOR dml1_end';
SET DEBUG_SYNC= 'xengine.inplace_create_sk_check_constraint_done  SIGNAL dml2 WAIT_FOR dml2_end';
alter table t1 add column c int default 1, add unique index t1_ub(b), ALGORITHM=INPLACE, LOCK=DEFAULT;
# Switch to connection con1
SET DEBUG_SYNC= 'now WAIT_FOR dml1';
insert into t1 values(2, 2);
SET DEBUG_SYNC= 'now SIGNAL dml1_end';
SET DEBUG_SYNC= 'now WAIT_FOR dml2';
insert into t1 values(3, 2);
select * from t1;
a	b
1	1
2	2
3	2
SET DEBUG_SYNC= 'now SIGNAL dml2_end';
# Switch to connection master
ERROR 23000: Duplicate entry '2' for key 't1_ub'
select * from t1;
a	b
1	1
2	2
3	2
failed to add unique index
select * from t1;
a	b
1	1
2	2
3	2
include/rpl_sync.inc
show create table t1;
Table	Create Table
t1	CREATE TABLE `t1` (
  `a` int(11) NOT NULL,
  `b` int(11) DEFAULT NULL,
  PRIMARY KEY (`a`)
) ENGINE=XENGINE DEFAULT CHARSET=utf8mb4 COLLATE=utf8mb4_general_ci
show create table t1;
Table	Create Table
t1	CREATE TABLE `t1` (
  `a` int(11) NOT NULL,
  `b` int(11) DEFAULT NULL,
  PRIMARY KEY (`a`)
) ENGINE=InnoDB DEFAULT CHARSET=utf8mb4 COLLATE=utf8mb4_0900_ai_ci
include/assert.inc [master-slave t1 is same]
drop table t1;
###################################################################
# case 7.2: key1 in d2 duplicates with updated key2 in d4
###################################################################
CREATE TABLE t1 (a INT primary key, b INT);
insert into t1 values(1, 1);
SET DEBUG_SYNC= 'xengine.inplace_create_sk_scan_base_begin        SIGNAL dml1 WAIT_FOR dml1_end';
SET DEBUG_SYNC= 'xengine.inplace_create_sk_check_constraint_done  SIGNAL dml2 WAIT_FOR dml2_end';
alter table t1 add column c int default 1, add unique index t1_ub(b), ALGORITHM=INPLACE, LOCK=DEFAULT;
# Switch to connection con1
SET DEBUG_SYNC= 'now WAIT_FOR dml1';
insert into t1 values(2, 2);
SET DEBUG_SYNC= 'now SIGNAL dml1_end';
SET DEBUG_SYNC= 'now WAIT_FOR dml2';
update t1 set b=2 where a=1;
select * from t1;
a	b
1	2
2	2
SET DEBUG_SYNC= 'now SIGNAL dml2_end';
# Switch to connection master
ERROR 23000: Duplicate entry '2' for key 't1_ub'
select * from t1;
a	b
1	2
2	2
failed to add unique index
select * from t1;
a	b
1	2
2	2
include/rpl_sync.inc
show create table t1;
Table	Create Table
t1	CREATE TABLE `t1` (
  `a` int(11) NOT NULL,
  `b` int(11) DEFAULT NULL,
  PRIMARY KEY (`a`)
) ENGINE=XENGINE DEFAULT CHARSET=utf8mb4 COLLATE=utf8mb4_general_ci
show create table t1;
Table	Create Table
t1	CREATE TABLE `t1` (
  `a` int(11) NOT NULL,
  `b` int(11) DEFAULT NULL,
  PRIMARY KEY (`a`)
) ENGINE=InnoDB DEFAULT CHARSET=utf8mb4 COLLATE=utf8mb4_0900_ai_ci
include/assert.inc [master-slave t1 is same]
drop table t1;
###################################################################
# case 7.3: key1 in d2 duplicates with inserted key2 in d4 but with a deletion before inserting key2
###################################################################
CREATE TABLE t1 (a INT primary key, b INT);
insert into t1 values(1, 1);
SET DEBUG_SYNC= 'xengine.inplace_create_sk_scan_base_begin        SIGNAL dml1 WAIT_FOR dml1_end';
SET DEBUG_SYNC= 'xengine.inplace_create_sk_check_constraint_done  SIGNAL dml2 WAIT_FOR dml2_end';
alter table t1 add column c int default 1, add unique index t1_ub(b), ALGORITHM=INPLACE, LOCK=DEFAULT;
# Switch to connection con1
SET DEBUG_SYNC= 'now WAIT_FOR dml1';
insert into t1 values(2, 2);
SET DEBUG_SYNC= 'now SIGNAL dml1_end';
SET DEBUG_SYNC= 'now WAIT_FOR dml2';
delete from t1 where b=2;
insert into t1 values(3, 2);
select * from t1;
a	b
1	1
3	2
SET DEBUG_SYNC= 'now SIGNAL dml2_end';
# Switch to connection master
select * from t1;
a	b	c
1	1	1
3	2	1
add unique index successfully
select * from t1;
a	b	c
1	1	1
3	2	1
include/rpl_sync.inc
show create table t1;
Table	Create Table
t1	CREATE TABLE `t1` (
  `a` int(11) NOT NULL,
  `b` int(11) DEFAULT NULL,
  `c` int(11) DEFAULT '1',
  PRIMARY KEY (`a`),
  UNIQUE KEY `t1_ub` (`b`)
) ENGINE=XENGINE DEFAULT CHARSET=utf8mb4 COLLATE=utf8mb4_general_ci
show create table t1;
Table	Create Table
t1	CREATE TABLE `t1` (
  `a` int(11) NOT NULL,
  `b` int(11) DEFAULT NULL,
  `c` int(11) DEFAULT '1',
  PRIMARY KEY (`a`),
  UNIQUE KEY `t1_ub` (`b`)
) ENGINE=InnoDB DEFAULT CHARSET=utf8mb4 COLLATE=utf8mb4_0900_ai_ci
include/assert.inc [master-slave t1 is same]
drop table t1;
###################################################################
# case 7.4: key1 in d2 duplicates with inserted key2 in d4 but with a deletion after inserting key2
###################################################################
CREATE TABLE t1 (a INT primary key, b INT);
insert into t1 values(1, 1);
SET DEBUG_SYNC= 'xengine.inplace_create_sk_scan_base_begin        SIGNAL dml1 WAIT_FOR dml1_end';
SET DEBUG_SYNC= 'xengine.inplace_create_sk_check_constraint_done  SIGNAL dml2 WAIT_FOR dml2_end';
alter table t1 add column c int default 1, add unique index t1_ub(b), ALGORITHM=INPLACE, LOCK=DEFAULT;
# Switch to connection con1
SET DEBUG_SYNC= 'now WAIT_FOR dml1';
insert into t1 values(2, 2);
SET DEBUG_SYNC= 'now SIGNAL dml1_end';
SET DEBUG_SYNC= 'now WAIT_FOR dml2';
insert into t1 values(3, 2);
delete from t1 where b=2;
select * from t1;
a	b
1	1
SET DEBUG_SYNC= 'now SIGNAL dml2_end';
# Switch to connection master
ERROR 23000: Duplicate entry '2' for key 't1_ub'
select * from t1;
a	b
1	1
failed to add unique index
select * from t1;
a	b
1	1
include/rpl_sync.inc
show create table t1;
Table	Create Table
t1	CREATE TABLE `t1` (
  `a` int(11) NOT NULL,
  `b` int(11) DEFAULT NULL,
  PRIMARY KEY (`a`)
) ENGINE=XENGINE DEFAULT CHARSET=utf8mb4 COLLATE=utf8mb4_general_ci
show create table t1;
Table	Create Table
t1	CREATE TABLE `t1` (
  `a` int(11) NOT NULL,
  `b` int(11) DEFAULT NULL,
  PRIMARY KEY (`a`)
) ENGINE=InnoDB DEFAULT CHARSET=utf8mb4 COLLATE=utf8mb4_0900_ai_ci
include/assert.inc [master-slave t1 is same]
drop table t1;
###################################################################
# case 8.1: key1 in d3 duplicates with inserted key2 in d4
###################################################################
CREATE TABLE t1 (a INT primary key, b INT);
insert into t1 values(1, 1);
SET DEBUG_SYNC= 'xengine.inplace_create_sk_check_constraint_begin SIGNAL dml1 WAIT_FOR dml1_end';
SET DEBUG_SYNC= 'xengine.inplace_create_sk_check_constraint_done  SIGNAL dml2 WAIT_FOR dml2_end';
alter table t1 add column c int default 1, add unique index t1_ub(b), ALGORITHM=INPLACE, LOCK=DEFAULT;
# Switch to connection con1
SET DEBUG_SYNC= 'now WAIT_FOR dml1';
insert into t1 values(2, 2);
SET DEBUG_SYNC= 'now SIGNAL dml1_end';
SET DEBUG_SYNC= 'now WAIT_FOR dml2';
insert into t1 values(3, 2);
select * from t1;
a	b
1	1
2	2
3	2
SET DEBUG_SYNC= 'now SIGNAL dml2_end';
# Switch to connection master
ERROR 23000: Duplicate entry '2' for key 't1_ub'
select * from t1;
a	b
1	1
2	2
3	2
failed to add unique index
select * from t1;
a	b
1	1
2	2
3	2
include/rpl_sync.inc
show create table t1;
Table	Create Table
t1	CREATE TABLE `t1` (
  `a` int(11) NOT NULL,
  `b` int(11) DEFAULT NULL,
  PRIMARY KEY (`a`)
) ENGINE=XENGINE DEFAULT CHARSET=utf8mb4 COLLATE=utf8mb4_general_ci
show create table t1;
Table	Create Table
t1	CREATE TABLE `t1` (
  `a` int(11) NOT NULL,
  `b` int(11) DEFAULT NULL,
  PRIMARY KEY (`a`)
) ENGINE=InnoDB DEFAULT CHARSET=utf8mb4 COLLATE=utf8mb4_0900_ai_ci
include/assert.inc [master-slave t1 is same]
drop table t1;
###################################################################
# case 8.2: key1 in d3 duplicates with updated key2 in d4
###################################################################
CREATE TABLE t1 (a INT primary key, b INT);
insert into t1 values(1, 1);
SET DEBUG_SYNC= 'xengine.inplace_create_sk_check_constraint_begin SIGNAL dml1 WAIT_FOR dml1_end';
SET DEBUG_SYNC= 'xengine.inplace_create_sk_check_constraint_done  SIGNAL dml2 WAIT_FOR dml2_end';
alter table t1 add column c int default 1, add unique index t1_ub(b), ALGORITHM=INPLACE, LOCK=DEFAULT;
# Switch to connection con1
SET DEBUG_SYNC= 'now WAIT_FOR dml1';
insert into t1 values(2, 2);
SET DEBUG_SYNC= 'now SIGNAL dml1_end';
SET DEBUG_SYNC= 'now WAIT_FOR dml2';
update t1 set b=2 where a=1;
select * from t1;
a	b
1	2
2	2
SET DEBUG_SYNC= 'now SIGNAL dml2_end';
# Switch to connection master
ERROR 23000: Duplicate entry '2' for key 't1_ub'
select * from t1;
a	b
1	2
2	2
failed to add unique index
select * from t1;
a	b
1	2
2	2
include/rpl_sync.inc
show create table t1;
Table	Create Table
t1	CREATE TABLE `t1` (
  `a` int(11) NOT NULL,
  `b` int(11) DEFAULT NULL,
  PRIMARY KEY (`a`)
) ENGINE=XENGINE DEFAULT CHARSET=utf8mb4 COLLATE=utf8mb4_general_ci
show create table t1;
Table	Create Table
t1	CREATE TABLE `t1` (
  `a` int(11) NOT NULL,
  `b` int(11) DEFAULT NULL,
  PRIMARY KEY (`a`)
) ENGINE=InnoDB DEFAULT CHARSET=utf8mb4 COLLATE=utf8mb4_0900_ai_ci
include/assert.inc [master-slave t1 is same]
drop table t1;
###################################################################
# case 8.3: key1 in d3 duplicates with inserted key2 in d4 but with a deletion before inserting key2
###################################################################
CREATE TABLE t1 (a INT primary key, b INT);
insert into t1 values(1, 1);
SET DEBUG_SYNC= 'xengine.inplace_create_sk_check_constraint_begin SIGNAL dml1 WAIT_FOR dml1_end';
SET DEBUG_SYNC= 'xengine.inplace_create_sk_check_constraint_done  SIGNAL dml2 WAIT_FOR dml2_end';
alter table t1 add column c int default 1, add unique index t1_ub(b), ALGORITHM=INPLACE, LOCK=DEFAULT;
# Switch to connection con1
SET DEBUG_SYNC= 'now WAIT_FOR dml1';
insert into t1 values(2, 2);
SET DEBUG_SYNC= 'now SIGNAL dml1_end';
SET DEBUG_SYNC= 'now WAIT_FOR dml2';
delete from t1 where b=2;
insert into t1 values(3, 2);
select * from t1;
a	b
1	1
3	2
SET DEBUG_SYNC= 'now SIGNAL dml2_end';
# Switch to connection master
select * from t1;
a	b	c
1	1	1
3	2	1
add unique index successfully
select * from t1;
a	b	c
1	1	1
3	2	1
include/rpl_sync.inc
show create table t1;
Table	Create Table
t1	CREATE TABLE `t1` (
  `a` int(11) NOT NULL,
  `b` int(11) DEFAULT NULL,
  `c` int(11) DEFAULT '1',
  PRIMARY KEY (`a`),
  UNIQUE KEY `t1_ub` (`b`)
) ENGINE=XENGINE DEFAULT CHARSET=utf8mb4 COLLATE=utf8mb4_general_ci
show create table t1;
Table	Create Table
t1	CREATE TABLE `t1` (
  `a` int(11) NOT NULL,
  `b` int(11) DEFAULT NULL,
  `c` int(11) DEFAULT '1',
  PRIMARY KEY (`a`),
  UNIQUE KEY `t1_ub` (`b`)
) ENGINE=InnoDB DEFAULT CHARSET=utf8mb4 COLLATE=utf8mb4_0900_ai_ci
include/assert.inc [master-slave t1 is same]
drop table t1;
###################################################################
# case 8.4: key1 in d3 duplicates with inserted key2 in d4 but with a deletion after inserting key2
###################################################################
CREATE TABLE t1 (a INT primary key, b INT);
insert into t1 values(1, 1);
SET DEBUG_SYNC= 'xengine.inplace_create_sk_check_constraint_begin SIGNAL dml1 WAIT_FOR dml1_end';
SET DEBUG_SYNC= 'xengine.inplace_create_sk_check_constraint_done  SIGNAL dml2 WAIT_FOR dml2_end';
alter table t1 add column c int default 1, add unique index t1_ub(b), ALGORITHM=INPLACE, LOCK=DEFAULT;
# Switch to connection con1
SET DEBUG_SYNC= 'now WAIT_FOR dml1';
insert into t1 values(2, 2);
SET DEBUG_SYNC= 'now SIGNAL dml1_end';
SET DEBUG_SYNC= 'now WAIT_FOR dml2';
insert into t1 values(3, 2);
delete from t1 where b=2;
select * from t1;
a	b
1	1
SET DEBUG_SYNC= 'now SIGNAL dml2_end';
# Switch to connection master
ERROR 23000: Duplicate entry '2' for key 't1_ub'
select * from t1;
a	b
1	1
failed to add unique index
select * from t1;
a	b
1	1
include/rpl_sync.inc
show create table t1;
Table	Create Table
t1	CREATE TABLE `t1` (
  `a` int(11) NOT NULL,
  `b` int(11) DEFAULT NULL,
  PRIMARY KEY (`a`)
) ENGINE=XENGINE DEFAULT CHARSET=utf8mb4 COLLATE=utf8mb4_general_ci
show create table t1;
Table	Create Table
t1	CREATE TABLE `t1` (
  `a` int(11) NOT NULL,
  `b` int(11) DEFAULT NULL,
  PRIMARY KEY (`a`)
) ENGINE=InnoDB DEFAULT CHARSET=utf8mb4 COLLATE=utf8mb4_0900_ai_ci
include/assert.inc [master-slave t1 is same]
drop table t1;
###################################################################
# case 9.1: key1 in d4 duplicates with inserted key2 in d4
###################################################################
CREATE TABLE t1 (a INT primary key, b INT);
insert into t1 values(1, 1);
SET DEBUG_SYNC= 'xengine.inplace_create_sk_check_constraint_done  SIGNAL dml WAIT_FOR dml_end';
alter table t1 add column c int default 1, add unique index t1_ub(b), ALGORITHM=INPLACE, LOCK=DEFAULT;
# Switch to connection con1
SET DEBUG_SYNC= 'now WAIT_FOR dml';
insert into t1 values(2, 2);
insert into t1 values(3, 2);
select * from t1;
a	b
1	1
2	2
3	2
SET DEBUG_SYNC= 'now SIGNAL dml_end';
# Switch to connection master
ERROR 23000: Duplicate entry '2' for key 't1_ub'
select * from t1;
a	b
1	1
2	2
3	2
failed to add unique index
select * from t1;
a	b
1	1
2	2
3	2
include/rpl_sync.inc
show create table t1;
Table	Create Table
t1	CREATE TABLE `t1` (
  `a` int(11) NOT NULL,
  `b` int(11) DEFAULT NULL,
  PRIMARY KEY (`a`)
) ENGINE=XENGINE DEFAULT CHARSET=utf8mb4 COLLATE=utf8mb4_general_ci
show create table t1;
Table	Create Table
t1	CREATE TABLE `t1` (
  `a` int(11) NOT NULL,
  `b` int(11) DEFAULT NULL,
  PRIMARY KEY (`a`)
) ENGINE=InnoDB DEFAULT CHARSET=utf8mb4 COLLATE=utf8mb4_0900_ai_ci
include/assert.inc [master-slave t1 is same]
drop table t1;
###################################################################
# case 9.2: key1 in d3 duplicates with updated key2 in d4
###################################################################
CREATE TABLE t1 (a INT primary key, b INT);
insert into t1 values(1, 1);
SET DEBUG_SYNC= 'xengine.inplace_create_sk_check_constraint_done  SIGNAL dml WAIT_FOR dml_end';
alter table t1 add column c int default 1, add unique index t1_ub(b), ALGORITHM=INPLACE, LOCK=DEFAULT;
# Switch to connection con1
SET DEBUG_SYNC= 'now WAIT_FOR dml';
insert into t1 values(2, 2);
update t1 set b=2 where a=1;
select * from t1;
a	b
1	2
2	2
SET DEBUG_SYNC= 'now SIGNAL dml_end';
# Switch to connection master
ERROR 23000: Duplicate entry '2' for key 't1_ub'
select * from t1;
a	b
1	2
2	2
failed to add unique index
select * from t1;
a	b
1	2
2	2
include/rpl_sync.inc
show create table t1;
Table	Create Table
t1	CREATE TABLE `t1` (
  `a` int(11) NOT NULL,
  `b` int(11) DEFAULT NULL,
  PRIMARY KEY (`a`)
) ENGINE=XENGINE DEFAULT CHARSET=utf8mb4 COLLATE=utf8mb4_general_ci
show create table t1;
Table	Create Table
t1	CREATE TABLE `t1` (
  `a` int(11) NOT NULL,
  `b` int(11) DEFAULT NULL,
  PRIMARY KEY (`a`)
) ENGINE=InnoDB DEFAULT CHARSET=utf8mb4 COLLATE=utf8mb4_0900_ai_ci
include/assert.inc [master-slave t1 is same]
drop table t1;
###################################################################
# case 9.3: key1 in d4 duplicates with inserted key2 in d4 but with a deletion before inserting key2
###################################################################
CREATE TABLE t1 (a INT primary key, b INT);
insert into t1 values(1, 1);
SET DEBUG_SYNC= 'xengine.inplace_create_sk_check_constraint_done  SIGNAL dml WAIT_FOR dml_end';
alter table t1 add column c int default 1, add unique index t1_ub(b), ALGORITHM=INPLACE, LOCK=DEFAULT;
# Switch to connection con1
SET DEBUG_SYNC= 'now WAIT_FOR dml';
insert into t1 values(2, 2);
delete from t1 where b=2;
insert into t1 values(3, 2);
select * from t1;
a	b
1	1
3	2
SET DEBUG_SYNC= 'now SIGNAL dml_end';
# Switch to connection master
select * from t1;
a	b	c
1	1	1
3	2	1
add unique index successfully
select * from t1;
a	b	c
1	1	1
3	2	1
include/rpl_sync.inc
show create table t1;
Table	Create Table
t1	CREATE TABLE `t1` (
  `a` int(11) NOT NULL,
  `b` int(11) DEFAULT NULL,
  `c` int(11) DEFAULT '1',
  PRIMARY KEY (`a`),
  UNIQUE KEY `t1_ub` (`b`)
) ENGINE=XENGINE DEFAULT CHARSET=utf8mb4 COLLATE=utf8mb4_general_ci
show create table t1;
Table	Create Table
t1	CREATE TABLE `t1` (
  `a` int(11) NOT NULL,
  `b` int(11) DEFAULT NULL,
  `c` int(11) DEFAULT '1',
  PRIMARY KEY (`a`),
  UNIQUE KEY `t1_ub` (`b`)
) ENGINE=InnoDB DEFAULT CHARSET=utf8mb4 COLLATE=utf8mb4_0900_ai_ci
include/assert.inc [master-slave t1 is same]
drop table t1;
###################################################################
# case 9.4: key1 in d4 duplicates with inserted key2 in d4 but with a deletion after inserting key2
###################################################################
CREATE TABLE t1 (a INT primary key, b INT);
insert into t1 values(1, 1);
SET DEBUG_SYNC= 'xengine.inplace_create_sk_check_constraint_done  SIGNAL dml WAIT_FOR dml_end';
alter table t1 add column c int default 1, add unique index t1_ub(b), ALGORITHM=INPLACE, LOCK=DEFAULT;
# Switch to connection con1
SET DEBUG_SYNC= 'now WAIT_FOR dml';
insert into t1 values(2, 2);
insert into t1 values(3, 2);
delete from t1 where b=2;
select * from t1;
a	b
1	1
SET DEBUG_SYNC= 'now SIGNAL dml_end';
# Switch to connection master
ERROR 23000: Duplicate entry '2' for key 't1_ub'
select * from t1;
a	b
1	1
failed to add unique index
select * from t1;
a	b
1	1
include/rpl_sync.inc
show create table t1;
Table	Create Table
t1	CREATE TABLE `t1` (
  `a` int(11) NOT NULL,
  `b` int(11) DEFAULT NULL,
  PRIMARY KEY (`a`)
) ENGINE=XENGINE DEFAULT CHARSET=utf8mb4 COLLATE=utf8mb4_general_ci
show create table t1;
Table	Create Table
t1	CREATE TABLE `t1` (
  `a` int(11) NOT NULL,
  `b` int(11) DEFAULT NULL,
  PRIMARY KEY (`a`)
) ENGINE=InnoDB DEFAULT CHARSET=utf8mb4 COLLATE=utf8mb4_0900_ai_ci
include/assert.inc [master-slave t1 is same]
drop table t1;
include/rpl_sync.inc
include/rpl_end.inc
