set names utf8mb4;
CREATE TABLE T1_COLUMN(C1 VARCHAR(100), C2 VARCHAR(100)) CHARACTER SET UTF8MB4,COLLATE UTF8MB4_0900_AI_CI;
INSERT INTO T1_COLUMN VALUES('A', '123');
INSERT INTO T1_COLUMN VALUES('A ', '123');
INSERT INTO T1_COLUMN VALUES('AB', '123');
INSERT INTO T1_COLUMN VALUES('a', '123');
INSERT INTO T1_COLUMN VALUES('a B', '123');
INSERT INTO T1_COLUMN VALUES('ab', '123');
INSERT INTO T1_COLUMN VALUES('B', '123');
INSERT INTO T1_COLUMN VALUES('b', '123');
INSERT INTO T1_COLUMN VALUES('cde', '123');
INSERT INTO T1_COLUMN VALUES('CDE', '123');
INSERT INTO T1_COLUMN VALUES('CDE', '123');
INSERT INTO T1_COLUMN VALUES('中国', '123');
INSERT INTO T1_COLUMN VALUES('中国人', '123');
INSERT INTO T1_COLUMN VALUES('美国', '123');
INSERT INTO T1_COLUMN VALUES('美国人', '123');
INSERT INTO T1_COLUMN VALUES('一', '123');
INSERT INTO T1_COLUMN VALUES('二', '123');
INSERT INTO T1_COLUMN VALUES('三', '123');
INSERT INTO T1_COLUMN VALUES('一二三','123');
INSERT INTO T1_COLUMN VALUES('一ab三','123');
INSERT INTO T1_COLUMN VALUES('一a二b三c','123');
SELECT * FROM T1_COLUMN WHERE C1='A';
C1	C2
A	123
a	123
SELECT * FROM T1_COLUMN WHERE C1='a';
C1	C2
A	123
a	123
SELECT * FROM T1_COLUMN WHERE C1='AB';
C1	C2
AB	123
ab	123
SELECT * FROM T1_COLUMN WHERE C1='ab';
C1	C2
AB	123
ab	123
SELECT * FROM T1_COLUMN WHERE C1='abc';
C1	C2
SELECT * FROM T1_COLUMN WHERE C1 in ('abc', 'AB');
C1	C2
AB	123
ab	123
SELECT * FROM T1_COLUMN WHERE C1 in ('ABC', 'CDE', 'cde');
C1	C2
cde	123
CDE	123
CDE	123
SELECT * FROM T1_COLUMN WHERE C1>'ab';
C1	C2
B	123
b	123
cde	123
CDE	123
CDE	123
中国	123
中国人	123
美国	123
美国人	123
一	123
二	123
三	123
一二三	123
一ab三	123
一a二b三c	123
SELECT * FROM T1_COLUMN WHERE C1>'AB';
C1	C2
B	123
b	123
cde	123
CDE	123
CDE	123
中国	123
中国人	123
美国	123
美国人	123
一	123
二	123
三	123
一二三	123
一ab三	123
一a二b三c	123
SELECT COUNT(*) FROM T1_COLUMN WHERE C1>'ab';
COUNT(*)
15
SELECT COUNT(*) FROM T1_COLUMN WHERE C1>'AB';
COUNT(*)
15
SELECT * FROM T1_COLUMN WHERE C1>'a';
C1	C2
A 	123
AB	123
a B	123
ab	123
B	123
b	123
cde	123
CDE	123
CDE	123
中国	123
中国人	123
美国	123
美国人	123
一	123
二	123
三	123
一二三	123
一ab三	123
一a二b三c	123
SELECT * FROM T1_COLUMN WHERE C1>='a';
C1	C2
A	123
A 	123
AB	123
a	123
a B	123
ab	123
B	123
b	123
cde	123
CDE	123
CDE	123
中国	123
中国人	123
美国	123
美国人	123
一	123
二	123
三	123
一二三	123
一ab三	123
一a二b三c	123
SELECT * FROM T1_COLUMN WHERE C1>='ab';
C1	C2
AB	123
ab	123
B	123
b	123
cde	123
CDE	123
CDE	123
中国	123
中国人	123
美国	123
美国人	123
一	123
二	123
三	123
一二三	123
一ab三	123
一a二b三c	123
SELECT * FROM T1_COLUMN WHERE C1>='AB';
C1	C2
AB	123
ab	123
B	123
b	123
cde	123
CDE	123
CDE	123
中国	123
中国人	123
美国	123
美国人	123
一	123
二	123
三	123
一二三	123
一ab三	123
一a二b三c	123
SELECT * FROM T1_COLUMN WHERE C1<'ab';
C1	C2
A	123
A 	123
a	123
a B	123
SELECT * FROM T1_COLUMN WHERE C1<='AB';
C1	C2
A	123
A 	123
AB	123
a	123
a B	123
ab	123
SELECT * FROM T1_COLUMN ORDER BY C1 ASC;
C1	C2
a	123
A	123
A 	123
a B	123
AB	123
ab	123
B	123
b	123
CDE	123
CDE	123
cde	123
一	123
一ab三	123
一a二b三c	123
一二三	123
三	123
中国	123
中国人	123
二	123
美国	123
美国人	123
SELECT * FROM T1_COLUMN ORDER BY C1 DESC;
C1	C2
美国人	123
美国	123
二	123
中国人	123
中国	123
三	123
一二三	123
一a二b三c	123
一ab三	123
一	123
CDE	123
CDE	123
cde	123
b	123
B	123
ab	123
AB	123
a B	123
A 	123
A	123
a	123
SELECT * FROM T1_COLUMN WHERE C1>'ab' ORDER BY C1 DESC;
C1	C2
美国人	123
美国	123
二	123
中国人	123
中国	123
三	123
一二三	123
一a二b三c	123
一ab三	123
一	123
cde	123
CDE	123
CDE	123
B	123
b	123
SELECT * FROM T1_COLUMN WHERE C1>'ab' ORDER BY C1 ASC;
C1	C2
B	123
b	123
cde	123
CDE	123
CDE	123
一	123
一ab三	123
一a二b三c	123
一二三	123
三	123
中国	123
中国人	123
二	123
美国	123
美国人	123
SELECT * FROM T1_COLUMN WHERE C1 LIKE 'ab%';
C1	C2
AB	123
ab	123
SELECT * FROM T1_COLUMN WHERE C1 LIKE 'AB%';
C1	C2
AB	123
ab	123
SELECT * FROM T1_COLUMN WHERE C1 LIKE '%c%';
C1	C2
cde	123
CDE	123
CDE	123
一a二b三c	123
SELECT * FROM T1_COLUMN WHERE C1 LIKE '%CD%';
C1	C2
cde	123
CDE	123
CDE	123
SELECT COUNT(*) FROM T1_COLUMN;
COUNT(*)
21
SELECT * FROM T1_COLUMN WHERE C1>'一';
C1	C2
中国	123
中国人	123
美国	123
美国人	123
二	123
三	123
一二三	123
一ab三	123
一a二b三c	123
SELECT * FROM T1_COLUMN WHERE C1='一';
C1	C2
一	123
SELECT * FROM T1_COLUMN WHERE C1<'一';
C1	C2
A	123
A 	123
AB	123
a	123
a B	123
ab	123
B	123
b	123
cde	123
CDE	123
CDE	123
SELECT * FROM T1_COLUMN WHERE C1>'一';
C1	C2
中国	123
中国人	123
美国	123
美国人	123
二	123
三	123
一二三	123
一ab三	123
一a二b三c	123
SELECT * FROM T1_COLUMN WHERE C1='中国';
C1	C2
中国	123
SELECT * FROM T1_COLUMN WHERE C1='中1';
C1	C2
SELECT * FROM T1_COLUMN WHERE C1<='中1国';
C1	C2
A	123
A 	123
AB	123
a	123
a B	123
ab	123
B	123
b	123
cde	123
CDE	123
CDE	123
一	123
三	123
一二三	123
一ab三	123
一a二b三c	123
SELECT * FROM T1_COLUMN WHERE C1>='美国';
C1	C2
美国	123
美国人	123
SELECT * FROM T1_COLUMN WHERE C1 in ('一', '二', '美国', 'AB');
C1	C2
AB	123
ab	123
美国	123
一	123
二	123
SELECT * FROM T1_COLUMN WHERE C1 LIKE '一%';
C1	C2
一	123
一二三	123
一ab三	123
一a二b三c	123
SELECT * FROM T1_COLUMN WHERE C1 LIKE '%一%';
C1	C2
一	123
一二三	123
一ab三	123
一a二b三c	123
SELECT * FROM T1_COLUMN WHERE C1 LIKE '%一';
C1	C2
一	123
SELECT C2,HEX(C1) FROM T1_COLUMN where c1 LIKE '%中国%';
C2	HEX(C1)
123	E4B8ADE59BBD
123	E4B8ADE59BBDE4BABA
SELECT C2,HEX(C1) FROM T1_COLUMN where c1 LIKE '%中a国%';
C2	HEX(C1)
SELECT C2,HEX(C1) FROM T1_COLUMN where c1 LIKE '中国%';
C2	HEX(C1)
123	E4B8ADE59BBD
123	E4B8ADE59BBDE4BABA
UPDATE T1_COLUMN SET C2='KFC' WHERE C1>='中国';
SELECT * FROM T1_COLUMN;
C1	C2
A	123
A 	123
AB	123
a	123
a B	123
ab	123
B	123
b	123
cde	123
CDE	123
CDE	123
中国	KFC
中国人	KFC
美国	KFC
美国人	KFC
一	123
二	KFC
三	123
一二三	123
一ab三	123
一a二b三c	123
UPDATE T1_COLUMN SET C2='KFC' WHERE C1>='AB';
SELECT * FROM T1_COLUMN;
C1	C2
A	123
A 	123
AB	KFC
a	123
a B	123
ab	KFC
B	KFC
b	KFC
cde	KFC
CDE	KFC
CDE	KFC
中国	KFC
中国人	KFC
美国	KFC
美国人	KFC
一	KFC
二	KFC
三	KFC
一二三	KFC
一ab三	KFC
一a二b三c	KFC
DELETE FROM T1_COLUMN WHERE C1>='中国';
SELECT * FROM T1_COLUMN;
C1	C2
A	123
A 	123
AB	KFC
a	123
a B	123
ab	KFC
B	KFC
b	KFC
cde	KFC
CDE	KFC
CDE	KFC
一	KFC
三	KFC
一二三	KFC
一ab三	KFC
一a二b三c	KFC
DELETE FROM T1_COLUMN WHERE C1>='ab';
SELECT * FROM T1_COLUMN;
C1	C2
A	123
A 	123
a	123
a B	123
CREATE TABLE T1_TEXT(C1 TEXT, C2 VARCHAR(100)) CHARACTER SET UTF8MB4,COLLATE UTF8MB4_0900_AI_CI;
INSERT INTO T1_TEXT VALUES('A', '123');
INSERT INTO T1_TEXT VALUES('AB', '123');
INSERT INTO T1_TEXT VALUES('a', '123');
INSERT INTO T1_TEXT VALUES('ab', '123');
INSERT INTO T1_TEXT VALUES('B', '123');
INSERT INTO T1_TEXT VALUES('b', '123');
INSERT INTO T1_TEXT VALUES('cde', '123');
INSERT INTO T1_TEXT VALUES('CDE', '123');
INSERT INTO T1_TEXT VALUES('CDE', '123');
INSERT INTO T1_TEXT VALUES('中国', '123');
INSERT INTO T1_TEXT VALUES('中国人', '123');
INSERT INTO T1_TEXT VALUES('美国', '123');
INSERT INTO T1_TEXT VALUES('美国人', '123');
INSERT INTO T1_TEXT VALUES('一', '123');
INSERT INTO T1_TEXT VALUES('二', '123');
INSERT INTO T1_TEXT VALUES('三', '123');
INSERT INTO T1_TEXT VALUES('一二三','123');
INSERT INTO T1_TEXT VALUES('一ab三','123');
INSERT INTO T1_TEXT VALUES('一a二b三c','123');
SELECT * FROM T1_TEXT WHERE C1='A';
C1	C2
A	123
a	123
SELECT * FROM T1_TEXT WHERE C1='a';
C1	C2
A	123
a	123
SELECT * FROM T1_TEXT WHERE C1='AB';
C1	C2
AB	123
ab	123
SELECT * FROM T1_TEXT WHERE C1='ab';
C1	C2
AB	123
ab	123
SELECT * FROM T1_TEXT WHERE C1='abc';
C1	C2
SELECT * FROM T1_TEXT WHERE C1 in ('abc', 'AB');
C1	C2
AB	123
ab	123
SELECT * FROM T1_TEXT WHERE C1 in ('ABC', 'CDE', 'cde');
C1	C2
cde	123
CDE	123
CDE	123
SELECT * FROM T1_TEXT WHERE C1>'ab';
C1	C2
B	123
b	123
cde	123
CDE	123
CDE	123
中国	123
中国人	123
美国	123
美国人	123
一	123
二	123
三	123
一二三	123
一ab三	123
一a二b三c	123
SELECT * FROM T1_TEXT WHERE C1>'AB';
C1	C2
B	123
b	123
cde	123
CDE	123
CDE	123
中国	123
中国人	123
美国	123
美国人	123
一	123
二	123
三	123
一二三	123
一ab三	123
一a二b三c	123
SELECT COUNT(*) FROM T1_TEXT WHERE C1>'ab';
COUNT(*)
15
SELECT COUNT(*) FROM T1_TEXT WHERE C1>'AB';
COUNT(*)
15
SELECT * FROM T1_TEXT WHERE C1>'a';
C1	C2
AB	123
ab	123
B	123
b	123
cde	123
CDE	123
CDE	123
中国	123
中国人	123
美国	123
美国人	123
一	123
二	123
三	123
一二三	123
一ab三	123
一a二b三c	123
SELECT * FROM T1_TEXT WHERE C1>='a';
C1	C2
A	123
AB	123
a	123
ab	123
B	123
b	123
cde	123
CDE	123
CDE	123
中国	123
中国人	123
美国	123
美国人	123
一	123
二	123
三	123
一二三	123
一ab三	123
一a二b三c	123
SELECT * FROM T1_TEXT WHERE C1>='ab';
C1	C2
AB	123
ab	123
B	123
b	123
cde	123
CDE	123
CDE	123
中国	123
中国人	123
美国	123
美国人	123
一	123
二	123
三	123
一二三	123
一ab三	123
一a二b三c	123
SELECT * FROM T1_TEXT WHERE C1>='AB';
C1	C2
AB	123
ab	123
B	123
b	123
cde	123
CDE	123
CDE	123
中国	123
中国人	123
美国	123
美国人	123
一	123
二	123
三	123
一二三	123
一ab三	123
一a二b三c	123
SELECT * FROM T1_TEXT WHERE C1<'ab';
C1	C2
A	123
a	123
SELECT * FROM T1_TEXT WHERE C1<='AB';
C1	C2
A	123
AB	123
a	123
ab	123
SELECT * FROM T1_TEXT ORDER BY C1 ASC;
C1	C2
a	123
A	123
AB	123
ab	123
B	123
b	123
cde	123
CDE	123
CDE	123
一	123
一ab三	123
一a二b三c	123
一二三	123
三	123
中国	123
中国人	123
二	123
美国	123
美国人	123
SELECT * FROM T1_TEXT ORDER BY C1 DESC;
C1	C2
美国人	123
美国	123
二	123
中国人	123
中国	123
三	123
一二三	123
一a二b三c	123
一ab三	123
一	123
CDE	123
CDE	123
cde	123
b	123
B	123
ab	123
AB	123
a	123
A	123
SELECT * FROM T1_TEXT WHERE C1>'ab' ORDER BY C1 DESC;
C1	C2
美国人	123
美国	123
二	123
中国人	123
中国	123
三	123
一二三	123
一a二b三c	123
一ab三	123
一	123
cde	123
CDE	123
CDE	123
B	123
b	123
SELECT * FROM T1_TEXT WHERE C1>'ab' ORDER BY C1 ASC;
C1	C2
B	123
b	123
cde	123
CDE	123
CDE	123
一	123
一ab三	123
一a二b三c	123
一二三	123
三	123
中国	123
中国人	123
二	123
美国	123
美国人	123
SELECT * FROM T1_TEXT WHERE C1 LIKE 'ab%';
C1	C2
AB	123
ab	123
SELECT * FROM T1_TEXT WHERE C1 LIKE 'AB%';
C1	C2
AB	123
ab	123
SELECT * FROM T1_TEXT WHERE C1 LIKE '%c%';
C1	C2
cde	123
CDE	123
CDE	123
一a二b三c	123
SELECT * FROM T1_TEXT WHERE C1 LIKE '%CD%';
C1	C2
cde	123
CDE	123
CDE	123
SELECT COUNT(*) FROM T1_TEXT;
COUNT(*)
19
SELECT * FROM T1_TEXT WHERE C1>'一';
C1	C2
中国	123
中国人	123
美国	123
美国人	123
二	123
三	123
一二三	123
一ab三	123
一a二b三c	123
SELECT * FROM T1_TEXT WHERE C1='一';
C1	C2
一	123
SELECT * FROM T1_TEXT WHERE C1<'一';
C1	C2
A	123
AB	123
a	123
ab	123
B	123
b	123
cde	123
CDE	123
CDE	123
SELECT * FROM T1_TEXT WHERE C1>'一';
C1	C2
中国	123
中国人	123
美国	123
美国人	123
二	123
三	123
一二三	123
一ab三	123
一a二b三c	123
SELECT * FROM T1_TEXT WHERE C1='中国';
C1	C2
中国	123
SELECT * FROM T1_TEXT WHERE C1='中1';
C1	C2
SELECT * FROM T1_TEXT WHERE C1<='中1国';
C1	C2
A	123
AB	123
a	123
ab	123
B	123
b	123
cde	123
CDE	123
CDE	123
一	123
三	123
一二三	123
一ab三	123
一a二b三c	123
SELECT * FROM T1_TEXT WHERE C1>='美国';
C1	C2
美国	123
美国人	123
SELECT * FROM T1_TEXT WHERE C1 in ('一', '二', '美国', 'AB');
C1	C2
AB	123
ab	123
美国	123
一	123
二	123
SELECT * FROM T1_TEXT WHERE C1 LIKE '一%';
C1	C2
一	123
一二三	123
一ab三	123
一a二b三c	123
SELECT * FROM T1_TEXT WHERE C1 LIKE '%一%';
C1	C2
一	123
一二三	123
一ab三	123
一a二b三c	123
SELECT * FROM T1_TEXT WHERE C1 LIKE '%一';
C1	C2
一	123
SELECT C2,HEX(C1) FROM T1_TEXT where c1 LIKE '%中国%';
C2	HEX(C1)
123	E4B8ADE59BBD
123	E4B8ADE59BBDE4BABA
SELECT C2,HEX(C1) FROM T1_TEXT where c1 LIKE '%中a国%';
C2	HEX(C1)
SELECT C2,HEX(C1) FROM T1_TEXT where c1 LIKE '中国%';
C2	HEX(C1)
123	E4B8ADE59BBD
123	E4B8ADE59BBDE4BABA
UPDATE T1_TEXT SET C2='KFC' WHERE C1>='中国';
SELECT * FROM T1_TEXT;
C1	C2
A	123
AB	123
a	123
ab	123
B	123
b	123
cde	123
CDE	123
CDE	123
中国	KFC
中国人	KFC
美国	KFC
美国人	KFC
一	123
二	KFC
三	123
一二三	123
一ab三	123
一a二b三c	123
UPDATE T1_TEXT SET C2='KFC' WHERE C1>='AB';
SELECT * FROM T1_TEXT;
C1	C2
A	123
AB	KFC
a	123
ab	KFC
B	KFC
b	KFC
cde	KFC
CDE	KFC
CDE	KFC
中国	KFC
中国人	KFC
美国	KFC
美国人	KFC
一	KFC
二	KFC
三	KFC
一二三	KFC
一ab三	KFC
一a二b三c	KFC
DELETE FROM T1_TEXT WHERE C1>='中国';
SELECT * FROM T1_TEXT;
C1	C2
A	123
AB	KFC
a	123
ab	KFC
B	KFC
b	KFC
cde	KFC
CDE	KFC
CDE	KFC
一	KFC
三	KFC
一二三	KFC
一ab三	KFC
一a二b三c	KFC
DELETE FROM T1_TEXT WHERE C1>='ab';
SELECT * FROM T1_TEXT;
C1	C2
A	123
a	123
CREATE TABLE T1_PK(C1 VARCHAR(100), C2 VARCHAR(100), PRIMARY KEY(C1)) CHARACTER SET UTF8MB4,COLLATE UTF8MB4_0900_AI_CI;
INSERT INTO T1_PK VALUES('A', '123');
INSERT INTO T1_PK VALUES('A ', '123');
INSERT INTO T1_PK VALUES('AB', '123');
INSERT INTO T1_PK VALUES('a', '123');
ERROR 23000: Duplicate entry 'a' for key 'PRIMARY'
INSERT INTO T1_PK VALUES('ab', '123');
ERROR 23000: Duplicate entry 'ab' for key 'PRIMARY'
INSERT INTO T1_PK VALUES('b', '123');
INSERT INTO T1_PK VALUES('B', '123');
ERROR 23000: Duplicate entry 'B' for key 'PRIMARY'
INSERT INTO T1_PK VALUES('cde', '123');
INSERT INTO T1_PK VALUES('CDE', '123');
ERROR 23000: Duplicate entry 'CDE' for key 'PRIMARY'
INSERT INTO T1_PK VALUES('CDE', '123');
ERROR 23000: Duplicate entry 'CDE' for key 'PRIMARY'
INSERT INTO T1_PK VALUES('中国', '123');
INSERT INTO T1_PK VALUES('中国人', '123');
INSERT INTO T1_PK VALUES('美国', '123');
INSERT INTO T1_PK VALUES('美国人', '123');
INSERT INTO T1_PK VALUES('一', '123');
INSERT INTO T1_PK VALUES('二', '123');
INSERT INTO T1_PK VALUES('三', '123');
INSERT INTO T1_PK VALUES('一二三','123');
INSERT INTO T1_PK VALUES('一ab三','123');
INSERT INTO T1_PK VALUES('一a二b三c','123');
SELECT * FROM T1_PK WHERE C1='A';
C1	C2
A	123
SELECT * FROM T1_PK WHERE C1='a';
C1	C2
A	123
SELECT * FROM T1_PK WHERE C1='AB';
C1	C2
AB	123
SELECT * FROM T1_PK WHERE C1='ab';
C1	C2
AB	123
SELECT * FROM T1_PK WHERE C1='abc';
C1	C2
SELECT * FROM T1_PK WHERE C1 in ('abc', 'AB');
C1	C2
AB	123
SELECT * FROM T1_PK WHERE C1 in ('ABC', 'CDE', 'cde');
C1	C2
cde	123
SELECT * FROM T1_PK WHERE C1>'ab';
C1	C2
b	123
cde	123
一	123
一ab三	123
一a二b三c	123
一二三	123
三	123
中国	123
中国人	123
二	123
美国	123
美国人	123
SELECT * FROM T1_PK WHERE C1>'AB';
C1	C2
b	123
cde	123
一	123
一ab三	123
一a二b三c	123
一二三	123
三	123
中国	123
中国人	123
二	123
美国	123
美国人	123
SELECT * FROM T1_PK WHERE C1>'a';
C1	C2
A 	123
AB	123
b	123
cde	123
一	123
一ab三	123
一a二b三c	123
一二三	123
三	123
中国	123
中国人	123
二	123
美国	123
美国人	123
SELECT * FROM T1_PK WHERE C1>='a';
C1	C2
A	123
A 	123
AB	123
b	123
cde	123
一	123
一ab三	123
一a二b三c	123
一二三	123
三	123
中国	123
中国人	123
二	123
美国	123
美国人	123
SELECT * FROM T1_PK WHERE C1>='ab';
C1	C2
AB	123
b	123
cde	123
一	123
一ab三	123
一a二b三c	123
一二三	123
三	123
中国	123
中国人	123
二	123
美国	123
美国人	123
SELECT * FROM T1_PK WHERE C1>='AB';
C1	C2
AB	123
b	123
cde	123
一	123
一ab三	123
一a二b三c	123
一二三	123
三	123
中国	123
中国人	123
二	123
美国	123
美国人	123
SELECT * FROM T1_PK WHERE C1<'ab';
C1	C2
A	123
A 	123
SELECT * FROM T1_PK WHERE C1<='AB';
C1	C2
A	123
A 	123
AB	123
SELECT * FROM T1_PK ORDER BY C1 ASC;
C1	C2
A	123
A 	123
AB	123
b	123
cde	123
一	123
一ab三	123
一a二b三c	123
一二三	123
三	123
中国	123
中国人	123
二	123
美国	123
美国人	123
SELECT * FROM T1_PK ORDER BY C1 DESC;
C1	C2
美国人	123
美国	123
二	123
中国人	123
中国	123
三	123
一二三	123
一a二b三c	123
一ab三	123
一	123
cde	123
b	123
AB	123
A 	123
A	123
SELECT * FROM T1_PK WHERE C1>'ab' ORDER BY C1 DESC;
C1	C2
美国人	123
美国	123
二	123
中国人	123
中国	123
三	123
一二三	123
一a二b三c	123
一ab三	123
一	123
cde	123
b	123
SELECT * FROM T1_PK WHERE C1>'ab' ORDER BY C1 ASC;
C1	C2
b	123
cde	123
一	123
一ab三	123
一a二b三c	123
一二三	123
三	123
中国	123
中国人	123
二	123
美国	123
美国人	123
SELECT * FROM T1_PK WHERE C1 LIKE 'ab%';
C1	C2
AB	123
SELECT * FROM T1_PK WHERE C1 LIKE 'AB%';
C1	C2
AB	123
SELECT * FROM T1_PK WHERE C1 LIKE '%c%';
C1	C2
cde	123
一a二b三c	123
SELECT * FROM T1_PK WHERE C1 LIKE '%CD%';
C1	C2
cde	123
SELECT * FROM T1_PK WHERE C1>'一';
C1	C2
一ab三	123
一a二b三c	123
一二三	123
三	123
中国	123
中国人	123
二	123
美国	123
美国人	123
SELECT * FROM T1_PK WHERE C1='一';
C1	C2
一	123
SELECT * FROM T1_PK WHERE C1<'一';
C1	C2
A	123
A 	123
AB	123
b	123
cde	123
SELECT * FROM T1_PK WHERE C1>'一';
C1	C2
一ab三	123
一a二b三c	123
一二三	123
三	123
中国	123
中国人	123
二	123
美国	123
美国人	123
SELECT * FROM T1_PK WHERE C1='中国';
C1	C2
中国	123
SELECT * FROM T1_PK WHERE C1='中1';
C1	C2
SELECT * FROM T1_PK WHERE C1<='中1国';
C1	C2
A	123
A 	123
AB	123
b	123
cde	123
一	123
一ab三	123
一a二b三c	123
一二三	123
三	123
SELECT * FROM T1_PK WHERE C1>='美国';
C1	C2
美国	123
美国人	123
SELECT * FROM T1_PK WHERE C1 in ('一', '二', '美国', 'AB');
C1	C2
AB	123
一	123
二	123
美国	123
SELECT * FROM T1_PK WHERE C1 LIKE '一%';
C1	C2
一	123
一ab三	123
一a二b三c	123
一二三	123
SELECT * FROM T1_PK WHERE C1 LIKE '%一%';
C1	C2
一	123
一ab三	123
一a二b三c	123
一二三	123
SELECT * FROM T1_PK WHERE C1 LIKE '%一';
C1	C2
一	123
SELECT C2,HEX(C1) FROM T1_PK where c1 LIKE '%中国%';
C2	HEX(C1)
123	E4B8ADE59BBD
123	E4B8ADE59BBDE4BABA
SELECT C2,HEX(C1) FROM T1_PK where c1 LIKE '%中a国%';
C2	HEX(C1)
SELECT C2,HEX(C1) FROM T1_PK where c1 LIKE '中国%';
C2	HEX(C1)
123	E4B8ADE59BBD
123	E4B8ADE59BBDE4BABA
UPDATE T1_PK SET C2='KFC' WHERE C1>='中国';
SELECT * FROM T1_PK;
C1	C2
A	123
A 	123
AB	123
b	123
cde	123
一	123
一ab三	123
一a二b三c	123
一二三	123
三	123
中国	KFC
中国人	KFC
二	KFC
美国	KFC
美国人	KFC
UPDATE T1_PK SET C2='KFC' WHERE C1>='AB';
SELECT * FROM T1_PK;
C1	C2
A	123
A 	123
AB	KFC
b	KFC
cde	KFC
一	KFC
一ab三	KFC
一a二b三c	KFC
一二三	KFC
三	KFC
中国	KFC
中国人	KFC
二	KFC
美国	KFC
美国人	KFC
DELETE FROM T1_PK WHERE C1>='中国';
SELECT * FROM T1_PK;
C1	C2
A	123
A 	123
AB	KFC
b	KFC
cde	KFC
一	KFC
一ab三	KFC
一a二b三c	KFC
一二三	KFC
三	KFC
DELETE FROM T1_PK WHERE C1>='ab';
SELECT * FROM T1_PK;
C1	C2
A	123
A 	123
CREATE TABLE T1_PK_CHAR(C1 CHAR(100), C2 CHAR(100), PRIMARY KEY(C1)) CHARACTER SET UTF8MB4,COLLATE UTF8MB4_0900_AI_CI;
INSERT INTO T1_PK_CHAR VALUES('A', '123');
INSERT INTO T1_PK_CHAR VALUES('AB', '123');
INSERT INTO T1_PK_CHAR VALUES('a', '123');
ERROR 23000: Duplicate entry 'a' for key 'PRIMARY'
INSERT INTO T1_PK_CHAR VALUES('a ', '123');
ERROR 23000: Duplicate entry 'a' for key 'PRIMARY'
INSERT INTO T1_PK_CHAR VALUES('ab', '123');
ERROR 23000: Duplicate entry 'ab' for key 'PRIMARY'
INSERT INTO T1_PK_CHAR VALUES('b', '123');
INSERT INTO T1_PK_CHAR VALUES('B', '123');
ERROR 23000: Duplicate entry 'B' for key 'PRIMARY'
INSERT INTO T1_PK_CHAR VALUES('cde', '123');
INSERT INTO T1_PK_CHAR VALUES('CDE', '123');
ERROR 23000: Duplicate entry 'CDE' for key 'PRIMARY'
INSERT INTO T1_PK_CHAR VALUES('CDE', '123');
ERROR 23000: Duplicate entry 'CDE' for key 'PRIMARY'
INSERT INTO T1_PK_CHAR VALUES('中国', '123');
INSERT INTO T1_PK_CHAR VALUES('中国人', '123');
INSERT INTO T1_PK_CHAR VALUES('美国', '123');
INSERT INTO T1_PK_CHAR VALUES('美国人', '123');
INSERT INTO T1_PK_CHAR VALUES('一', '123');
INSERT INTO T1_PK_CHAR VALUES('二', '123');
INSERT INTO T1_PK_CHAR VALUES('三', '123');
INSERT INTO T1_PK_CHAR VALUES('一二三','123');
INSERT INTO T1_PK_CHAR VALUES('一ab三','123');
INSERT INTO T1_PK_CHAR VALUES('一a二b三c','123');
SELECT * FROM T1_PK_CHAR WHERE C1='A';
C1	C2
A	123
SELECT * FROM T1_PK_CHAR WHERE C1='a';
C1	C2
A	123
SELECT * FROM T1_PK_CHAR WHERE C1='AB';
C1	C2
AB	123
SELECT * FROM T1_PK_CHAR WHERE C1='ab';
C1	C2
AB	123
SELECT * FROM T1_PK_CHAR WHERE C1='abc';
C1	C2
SELECT * FROM T1_PK_CHAR WHERE C1 in ('abc', 'AB');
C1	C2
AB	123
SELECT * FROM T1_PK_CHAR WHERE C1 in ('ABC', 'CDE', 'cde');
C1	C2
cde	123
SELECT C2,HEX(C1) FROM T1_PK_CHAR where c1=0xF09F92BB6161F09F93BA;
C2	HEX(C1)
SELECT C2,HEX(C1) FROM T1_PK_CHAR where c1=0xF09F92BBE4B8ADE59BBDF09F93BA;
C2	HEX(C1)
SELECT * FROM T1_PK_CHAR WHERE C1>'ab';
C1	C2
b	123
cde	123
一	123
一ab三	123
一a二b三c	123
一二三	123
三	123
中国	123
中国人	123
二	123
美国	123
美国人	123
SELECT * FROM T1_PK_CHAR WHERE C1>'AB';
C1	C2
b	123
cde	123
一	123
一ab三	123
一a二b三c	123
一二三	123
三	123
中国	123
中国人	123
二	123
美国	123
美国人	123
SELECT * FROM T1_PK_CHAR WHERE C1>'a';
C1	C2
AB	123
b	123
cde	123
一	123
一ab三	123
一a二b三c	123
一二三	123
三	123
中国	123
中国人	123
二	123
美国	123
美国人	123
SELECT * FROM T1_PK_CHAR WHERE C1>='a';
C1	C2
A	123
AB	123
b	123
cde	123
一	123
一ab三	123
一a二b三c	123
一二三	123
三	123
中国	123
中国人	123
二	123
美国	123
美国人	123
SELECT * FROM T1_PK_CHAR WHERE C1>='ab';
C1	C2
AB	123
b	123
cde	123
一	123
一ab三	123
一a二b三c	123
一二三	123
三	123
中国	123
中国人	123
二	123
美国	123
美国人	123
SELECT * FROM T1_PK_CHAR WHERE C1>='AB';
C1	C2
AB	123
b	123
cde	123
一	123
一ab三	123
一a二b三c	123
一二三	123
三	123
中国	123
中国人	123
二	123
美国	123
美国人	123
SELECT * FROM T1_PK_CHAR WHERE C1<'ab';
C1	C2
A	123
SELECT * FROM T1_PK_CHAR WHERE C1<='AB';
C1	C2
A	123
AB	123
SELECT * FROM T1_PK_CHAR ORDER BY C1 ASC;
C1	C2
A	123
AB	123
b	123
cde	123
一	123
一ab三	123
一a二b三c	123
一二三	123
三	123
中国	123
中国人	123
二	123
美国	123
美国人	123
SELECT * FROM T1_PK_CHAR ORDER BY C1 DESC;
C1	C2
美国人	123
美国	123
二	123
中国人	123
中国	123
三	123
一二三	123
一a二b三c	123
一ab三	123
一	123
cde	123
b	123
AB	123
A	123
SELECT * FROM T1_PK_CHAR WHERE C1>'ab' ORDER BY C1 DESC;
C1	C2
美国人	123
美国	123
二	123
中国人	123
中国	123
三	123
一二三	123
一a二b三c	123
一ab三	123
一	123
cde	123
b	123
SELECT * FROM T1_PK_CHAR WHERE C1>'ab' ORDER BY C1 ASC;
C1	C2
b	123
cde	123
一	123
一ab三	123
一a二b三c	123
一二三	123
三	123
中国	123
中国人	123
二	123
美国	123
美国人	123
SELECT * FROM T1_PK_CHAR WHERE C1 LIKE 'a%';
C1	C2
A	123
AB	123
SELECT * FROM T1_PK_CHAR WHERE C1 LIKE 'ab%';
C1	C2
AB	123
SELECT * FROM T1_PK_CHAR WHERE C1 LIKE 'AB%';
C1	C2
AB	123
SELECT * FROM T1_PK_CHAR WHERE C1 LIKE '%c%';
C1	C2
cde	123
一a二b三c	123
SELECT * FROM T1_PK_CHAR WHERE C1 LIKE '%CD%';
C1	C2
cde	123
SELECT * FROM T1_PK_CHAR WHERE C1>='一';
C1	C2
一	123
一ab三	123
一a二b三c	123
一二三	123
三	123
中国	123
中国人	123
二	123
美国	123
美国人	123
SELECT * FROM T1_PK_CHAR WHERE C1='一';
C1	C2
一	123
SELECT * FROM T1_PK_CHAR WHERE C1<'一';
C1	C2
A	123
AB	123
b	123
cde	123
SELECT * FROM T1_PK_CHAR WHERE C1>'一';
C1	C2
一ab三	123
一a二b三c	123
一二三	123
三	123
中国	123
中国人	123
二	123
美国	123
美国人	123
SELECT * FROM T1_PK_CHAR WHERE C1='中国';
C1	C2
中国	123
SELECT * FROM T1_PK_CHAR WHERE C1='中1';
C1	C2
SELECT * FROM T1_PK_CHAR WHERE C1<='中1国';
C1	C2
A	123
AB	123
b	123
cde	123
一	123
一ab三	123
一a二b三c	123
一二三	123
三	123
SELECT * FROM T1_PK_CHAR WHERE C1>='美国';
C1	C2
美国	123
美国人	123
SELECT C2,HEX(C1) FROM T1_PK_CHAR where c1 LIKE '%中国%';
C2	HEX(C1)
123	E4B8ADE59BBD
123	E4B8ADE59BBDE4BABA
SELECT C2,HEX(C1) FROM T1_PK_CHAR where c1 LIKE '%中a国%';
C2	HEX(C1)
SELECT C2,HEX(C1) FROM T1_PK_CHAR where c1 LIKE '中国%';
C2	HEX(C1)
123	E4B8ADE59BBD
123	E4B8ADE59BBDE4BABA
UPDATE T1_PK_CHAR SET C2='KFC' WHERE C1>='中国';
SELECT * FROM T1_PK_CHAR;
C1	C2
A	123
AB	123
b	123
cde	123
一	123
一ab三	123
一a二b三c	123
一二三	123
三	123
中国	KFC
中国人	KFC
二	KFC
美国	KFC
美国人	KFC
UPDATE T1_PK_CHAR SET C2='KFC' WHERE C1>='AB';
SELECT * FROM T1_PK_CHAR;
C1	C2
A	123
AB	KFC
b	KFC
cde	KFC
一	KFC
一ab三	KFC
一a二b三c	KFC
一二三	KFC
三	KFC
中国	KFC
中国人	KFC
二	KFC
美国	KFC
美国人	KFC
DELETE FROM T1_PK_CHAR WHERE C1>='中国';
SELECT * FROM T1_PK_CHAR;
C1	C2
A	123
AB	KFC
b	KFC
cde	KFC
一	KFC
一ab三	KFC
一a二b三c	KFC
一二三	KFC
三	KFC
DELETE FROM T1_PK_CHAR WHERE C1>='ab';
SELECT * FROM T1_PK_CHAR;
C1	C2
A	123
CREATE TABLE T1_SEC(ID INT AUTO_INCREMENT, C1 VARCHAR(100), C2 VARCHAR(100), PRIMARY KEY(ID), KEY IDX_C1(C1)) CHARACTER SET UTF8MB4,COLLATE UTF8MB4_0900_AI_CI;
INSERT INTO T1_SEC(C1,C2) VALUES('A', '123');
INSERT INTO T1_SEC(C1,C2) VALUES('A ', '123');
INSERT INTO T1_SEC(C1,C2) VALUES('AB', '123');
INSERT INTO T1_SEC(C1,C2) VALUES('a', '123');
INSERT INTO T1_SEC(C1,C2) VALUES('a ', '123');
INSERT INTO T1_SEC(C1,C2) VALUES('ab', '123');
INSERT INTO T1_SEC(C1,C2) VALUES('B', '123');
INSERT INTO T1_SEC(C1,C2) VALUES('b', '123');
INSERT INTO T1_SEC(C1,C2) VALUES('cde', '123');
INSERT INTO T1_SEC(C1,C2) VALUES('CDE', '123');
INSERT INTO T1_SEC(C1,C2) VALUES('CDE', '123');
INSERT INTO T1_SEC(C1,C2) VALUES('中国', '123');
INSERT INTO T1_SEC(C1,C2) VALUES('中国人', '123');
INSERT INTO T1_SEC(C1,C2) VALUES('美国', '123');
INSERT INTO T1_SEC(C1,C2) VALUES('美国人', '123');
INSERT INTO T1_SEC(C1,C2) VALUES('一', '123');
INSERT INTO T1_SEC(C1,C2) VALUES('二', '123');
INSERT INTO T1_SEC(C1,C2) VALUES('三', '123');
INSERT INTO T1_SEC(C1,C2) VALUES('一二三','123');
INSERT INTO T1_SEC(C1,C2) VALUES('一ab三','123');
INSERT INTO T1_SEC(C1,C2) VALUES('一a二b三c','123');
SELECT * FROM T1_SEC WHERE C1='A';
ID	C1	C2
1	A	123
4	a	123
SELECT * FROM T1_SEC WHERE C1='A ';
ID	C1	C2
2	A 	123
5	a 	123
SELECT * FROM T1_SEC WHERE C1='a';
ID	C1	C2
1	A	123
4	a	123
SELECT * FROM T1_SEC WHERE C1='a ';
ID	C1	C2
2	A 	123
5	a 	123
SELECT * FROM T1_SEC WHERE C1='AB';
ID	C1	C2
3	AB	123
6	ab	123
SELECT * FROM T1_SEC WHERE C1='ab';
ID	C1	C2
3	AB	123
6	ab	123
SELECT * FROM T1_SEC WHERE C1='abc';
ID	C1	C2
SELECT * FROM T1_SEC WHERE C1 in ('abc', 'AB');
ID	C1	C2
3	AB	123
6	ab	123
SELECT * FROM T1_SEC WHERE C1 in ('ABC', 'CDE', 'cde');
ID	C1	C2
9	cde	123
10	CDE	123
11	CDE	123
SELECT * FROM T1_SEC WHERE C1>'ab' ORDER BY C1,ID;
ID	C1	C2
7	B	123
8	b	123
9	cde	123
10	CDE	123
11	CDE	123
16	一	123
20	一ab三	123
21	一a二b三c	123
19	一二三	123
18	三	123
12	中国	123
13	中国人	123
17	二	123
14	美国	123
15	美国人	123
SELECT * FROM T1_SEC WHERE C1>'AB' ORDER BY C1,ID;
ID	C1	C2
7	B	123
8	b	123
9	cde	123
10	CDE	123
11	CDE	123
16	一	123
20	一ab三	123
21	一a二b三c	123
19	一二三	123
18	三	123
12	中国	123
13	中国人	123
17	二	123
14	美国	123
15	美国人	123
SELECT * FROM T1_SEC WHERE C1>'a' ORDER BY C1,ID;
ID	C1	C2
2	A 	123
5	a 	123
3	AB	123
6	ab	123
7	B	123
8	b	123
9	cde	123
10	CDE	123
11	CDE	123
16	一	123
20	一ab三	123
21	一a二b三c	123
19	一二三	123
18	三	123
12	中国	123
13	中国人	123
17	二	123
14	美国	123
15	美国人	123
SELECT * FROM T1_SEC WHERE C1>='a' ORDER BY C1,ID;
ID	C1	C2
1	A	123
4	a	123
2	A 	123
5	a 	123
3	AB	123
6	ab	123
7	B	123
8	b	123
9	cde	123
10	CDE	123
11	CDE	123
16	一	123
20	一ab三	123
21	一a二b三c	123
19	一二三	123
18	三	123
12	中国	123
13	中国人	123
17	二	123
14	美国	123
15	美国人	123
SELECT * FROM T1_SEC WHERE C1>='ab' ORDER BY C1,ID;
ID	C1	C2
3	AB	123
6	ab	123
7	B	123
8	b	123
9	cde	123
10	CDE	123
11	CDE	123
16	一	123
20	一ab三	123
21	一a二b三c	123
19	一二三	123
18	三	123
12	中国	123
13	中国人	123
17	二	123
14	美国	123
15	美国人	123
SELECT * FROM T1_SEC WHERE C1>='AB' ORDER BY C1,ID;
ID	C1	C2
3	AB	123
6	ab	123
7	B	123
8	b	123
9	cde	123
10	CDE	123
11	CDE	123
16	一	123
20	一ab三	123
21	一a二b三c	123
19	一二三	123
18	三	123
12	中国	123
13	中国人	123
17	二	123
14	美国	123
15	美国人	123
SELECT * FROM T1_SEC WHERE C1<'ab' ORDER BY C1,ID;
ID	C1	C2
1	A	123
4	a	123
2	A 	123
5	a 	123
SELECT * FROM T1_SEC WHERE C1<='AB' ORDER BY C1,ID;
ID	C1	C2
1	A	123
4	a	123
2	A 	123
5	a 	123
3	AB	123
6	ab	123
SELECT * FROM T1_SEC ORDER BY C1 ASC, ID ASC;
ID	C1	C2
1	A	123
4	a	123
2	A 	123
5	a 	123
3	AB	123
6	ab	123
7	B	123
8	b	123
9	cde	123
10	CDE	123
11	CDE	123
16	一	123
20	一ab三	123
21	一a二b三c	123
19	一二三	123
18	三	123
12	中国	123
13	中国人	123
17	二	123
14	美国	123
15	美国人	123
SELECT * FROM T1_SEC ORDER BY C1 DESC, ID ASC;
ID	C1	C2
15	美国人	123
14	美国	123
17	二	123
13	中国人	123
12	中国	123
18	三	123
19	一二三	123
21	一a二b三c	123
20	一ab三	123
16	一	123
9	cde	123
10	CDE	123
11	CDE	123
7	B	123
8	b	123
3	AB	123
6	ab	123
2	A 	123
5	a 	123
1	A	123
4	a	123
SELECT * FROM T1_SEC WHERE C1>'ab' ORDER BY C1 DESC, ID ASC;
ID	C1	C2
15	美国人	123
14	美国	123
17	二	123
13	中国人	123
12	中国	123
18	三	123
19	一二三	123
21	一a二b三c	123
20	一ab三	123
16	一	123
9	cde	123
10	CDE	123
11	CDE	123
7	B	123
8	b	123
SELECT * FROM T1_SEC WHERE C1>'ab' ORDER BY C1 ASC, ID ASC;
ID	C1	C2
7	B	123
8	b	123
9	cde	123
10	CDE	123
11	CDE	123
16	一	123
20	一ab三	123
21	一a二b三c	123
19	一二三	123
18	三	123
12	中国	123
13	中国人	123
17	二	123
14	美国	123
15	美国人	123
SELECT * FROM T1_SEC WHERE C1>'一' ORDER BY C1,ID;
ID	C1	C2
20	一ab三	123
21	一a二b三c	123
19	一二三	123
18	三	123
12	中国	123
13	中国人	123
17	二	123
14	美国	123
15	美国人	123
SELECT * FROM T1_SEC WHERE C1='一' ORDER BY C1,ID;
ID	C1	C2
16	一	123
SELECT * FROM T1_SEC WHERE C1<'一' ORDER BY C1,ID;
ID	C1	C2
1	A	123
4	a	123
2	A 	123
5	a 	123
3	AB	123
6	ab	123
7	B	123
8	b	123
9	cde	123
10	CDE	123
11	CDE	123
SELECT * FROM T1_SEC WHERE C1>'一' ORDER BY C1,ID;
ID	C1	C2
20	一ab三	123
21	一a二b三c	123
19	一二三	123
18	三	123
12	中国	123
13	中国人	123
17	二	123
14	美国	123
15	美国人	123
SELECT * FROM T1_SEC WHERE C1='中国' ORDER BY C1,ID;
ID	C1	C2
12	中国	123
SELECT * FROM T1_SEC WHERE C1='中1' ORDER BY C1,ID;
ID	C1	C2
SELECT * FROM T1_SEC WHERE C1<='中1国' ORDER BY C1,ID;
ID	C1	C2
1	A	123
4	a	123
2	A 	123
5	a 	123
3	AB	123
6	ab	123
7	B	123
8	b	123
9	cde	123
10	CDE	123
11	CDE	123
16	一	123
20	一ab三	123
21	一a二b三c	123
19	一二三	123
18	三	123
SELECT * FROM T1_SEC WHERE C1>='美国' ORDER BY C1,ID;
ID	C1	C2
14	美国	123
15	美国人	123
SELECT * FROM T1_SEC WHERE C1 in ('一', '二', '美国', 'AB') ORDER BY C1,ID;
ID	C1	C2
3	AB	123
6	ab	123
16	一	123
17	二	123
14	美国	123
SELECT * FROM T1_SEC WHERE C1 LIKE '一%' ORDER BY C1,ID;
ID	C1	C2
16	一	123
20	一ab三	123
21	一a二b三c	123
19	一二三	123
SELECT * FROM T1_SEC WHERE C1 LIKE '%一%' ORDER BY C1,ID;
ID	C1	C2
16	一	123
20	一ab三	123
21	一a二b三c	123
19	一二三	123
SELECT * FROM T1_SEC WHERE C1 LIKE '%一' ORDER BY C1,ID;
ID	C1	C2
16	一	123
SELECT C2,HEX(C1) FROM T1_SEC where c1 LIKE '%中国%' ORDER BY C1,ID;
C2	HEX(C1)
123	E4B8ADE59BBD
123	E4B8ADE59BBDE4BABA
SELECT C2,HEX(C1) FROM T1_SEC where c1 LIKE '%中a国%' ORDER BY C1,ID;
C2	HEX(C1)
SELECT C2,HEX(C1) FROM T1_SEC where c1 LIKE '中国%' ORDER BY C1,ID;
C2	HEX(C1)
123	E4B8ADE59BBD
123	E4B8ADE59BBDE4BABA
UPDATE T1_SEC SET C2='KFC' WHERE C1>='中国';
SELECT * FROM T1_SEC;
ID	C1	C2
1	A	123
2	A 	123
3	AB	123
4	a	123
5	a 	123
6	ab	123
7	B	123
8	b	123
9	cde	123
10	CDE	123
11	CDE	123
12	中国	KFC
13	中国人	KFC
14	美国	KFC
15	美国人	KFC
16	一	123
17	二	KFC
18	三	123
19	一二三	123
20	一ab三	123
21	一a二b三c	123
UPDATE T1_SEC SET C2='KFC' WHERE C1>='AB';
SELECT * FROM T1_SEC;
ID	C1	C2
1	A	123
2	A 	123
3	AB	KFC
4	a	123
5	a 	123
6	ab	KFC
7	B	KFC
8	b	KFC
9	cde	KFC
10	CDE	KFC
11	CDE	KFC
12	中国	KFC
13	中国人	KFC
14	美国	KFC
15	美国人	KFC
16	一	KFC
17	二	KFC
18	三	KFC
19	一二三	KFC
20	一ab三	KFC
21	一a二b三c	KFC
DELETE FROM T1_SEC WHERE C1>='中国';
SELECT * FROM T1_SEC;
ID	C1	C2
1	A	123
2	A 	123
3	AB	KFC
4	a	123
5	a 	123
6	ab	KFC
7	B	KFC
8	b	KFC
9	cde	KFC
10	CDE	KFC
11	CDE	KFC
16	一	KFC
18	三	KFC
19	一二三	KFC
20	一ab三	KFC
21	一a二b三c	KFC
DELETE FROM T1_SEC WHERE C1>='ab';
SELECT * FROM T1_SEC;
ID	C1	C2
1	A	123
2	A 	123
4	a	123
5	a 	123
CREATE TABLE T1_SEC_CHAR(ID INT AUTO_INCREMENT, C1 CHAR(100), C2 CHAR(100), PRIMARY KEY(ID), KEY IDX_C1(C1)) CHARACTER SET UTF8MB4,COLLATE UTF8MB4_0900_AI_CI;
INSERT INTO T1_SEC_CHAR(C1,C2) VALUES('A', '123');
INSERT INTO T1_SEC_CHAR(C1,C2) VALUES('A ', '123');
INSERT INTO T1_SEC_CHAR(C1,C2) VALUES('AB', '123');
INSERT INTO T1_SEC_CHAR(C1,C2) VALUES('AB ', '123');
INSERT INTO T1_SEC_CHAR(C1,C2) VALUES('a', '123');
INSERT INTO T1_SEC_CHAR(C1,C2) VALUES('ab', '123');
INSERT INTO T1_SEC_CHAR(C1,C2) VALUES('B', '123');
INSERT INTO T1_SEC_CHAR(C1,C2) VALUES('b', '123');
INSERT INTO T1_SEC_CHAR(C1,C2) VALUES('cde', '123');
INSERT INTO T1_SEC_CHAR(C1,C2) VALUES('CDE', '123');
INSERT INTO T1_SEC_CHAR(C1,C2) VALUES('CDE', '123');
INSERT INTO T1_SEC_CHAR(C1,C2) VALUES('中国', '123');
INSERT INTO T1_SEC_CHAR(C1,C2) VALUES('中国 ', '123');
INSERT INTO T1_SEC_CHAR(C1,C2) VALUES('中国人', '123');
INSERT INTO T1_SEC_CHAR(C1,C2) VALUES('美国', '123');
INSERT INTO T1_SEC_CHAR(C1,C2) VALUES('美国人', '123');
INSERT INTO T1_SEC_CHAR(C1,C2) VALUES('一', '123');
INSERT INTO T1_SEC_CHAR(C1,C2) VALUES('二', '123');
INSERT INTO T1_SEC_CHAR(C1,C2) VALUES('三', '123');
INSERT INTO T1_SEC_CHAR(C1,C2) VALUES('一二三','123');
INSERT INTO T1_SEC_CHAR(C1,C2) VALUES('一ab三','123');
INSERT INTO T1_SEC_CHAR(C1,C2) VALUES('一a二b三c','123');
SELECT * FROM T1_SEC_CHAR WHERE C1='A';
ID	C1	C2
1	A	123
2	A	123
5	a	123
SELECT * FROM T1_SEC_CHAR WHERE C1='a';
ID	C1	C2
1	A	123
2	A	123
5	a	123
SELECT * FROM T1_SEC_CHAR WHERE C1='AB';
ID	C1	C2
3	AB	123
4	AB	123
6	ab	123
SELECT * FROM T1_SEC_CHAR WHERE C1='ab';
ID	C1	C2
3	AB	123
4	AB	123
6	ab	123
SELECT * FROM T1_SEC_CHAR WHERE C1='abc';
ID	C1	C2
SELECT * FROM T1_SEC_CHAR WHERE C1 in ('abc', 'AB');
ID	C1	C2
3	AB	123
4	AB	123
6	ab	123
SELECT * FROM T1_SEC_CHAR WHERE C1 in ('ABC', 'CDE', 'cde');
ID	C1	C2
9	cde	123
10	CDE	123
11	CDE	123
SELECT * FROM T1_SEC_CHAR WHERE C1>'ab' ORDER BY C1,ID;
ID	C1	C2
7	B	123
8	b	123
9	cde	123
10	CDE	123
11	CDE	123
17	一	123
21	一ab三	123
22	一a二b三c	123
20	一二三	123
19	三	123
12	中国	123
13	中国	123
14	中国人	123
18	二	123
15	美国	123
16	美国人	123
SELECT * FROM T1_SEC_CHAR WHERE C1>'AB' ORDER BY C1,ID;
ID	C1	C2
7	B	123
8	b	123
9	cde	123
10	CDE	123
11	CDE	123
17	一	123
21	一ab三	123
22	一a二b三c	123
20	一二三	123
19	三	123
12	中国	123
13	中国	123
14	中国人	123
18	二	123
15	美国	123
16	美国人	123
SELECT * FROM T1_SEC_CHAR WHERE C1>'a' ORDER BY C1,ID;
ID	C1	C2
3	AB	123
4	AB	123
6	ab	123
7	B	123
8	b	123
9	cde	123
10	CDE	123
11	CDE	123
17	一	123
21	一ab三	123
22	一a二b三c	123
20	一二三	123
19	三	123
12	中国	123
13	中国	123
14	中国人	123
18	二	123
15	美国	123
16	美国人	123
SELECT * FROM T1_SEC_CHAR WHERE C1>='a' ORDER BY C1,ID;
ID	C1	C2
1	A	123
2	A	123
5	a	123
3	AB	123
4	AB	123
6	ab	123
7	B	123
8	b	123
9	cde	123
10	CDE	123
11	CDE	123
17	一	123
21	一ab三	123
22	一a二b三c	123
20	一二三	123
19	三	123
12	中国	123
13	中国	123
14	中国人	123
18	二	123
15	美国	123
16	美国人	123
SELECT * FROM T1_SEC_CHAR WHERE C1>='ab' ORDER BY C1,ID;
ID	C1	C2
3	AB	123
4	AB	123
6	ab	123
7	B	123
8	b	123
9	cde	123
10	CDE	123
11	CDE	123
17	一	123
21	一ab三	123
22	一a二b三c	123
20	一二三	123
19	三	123
12	中国	123
13	中国	123
14	中国人	123
18	二	123
15	美国	123
16	美国人	123
SELECT * FROM T1_SEC_CHAR WHERE C1>='AB' ORDER BY C1,ID;
ID	C1	C2
3	AB	123
4	AB	123
6	ab	123
7	B	123
8	b	123
9	cde	123
10	CDE	123
11	CDE	123
17	一	123
21	一ab三	123
22	一a二b三c	123
20	一二三	123
19	三	123
12	中国	123
13	中国	123
14	中国人	123
18	二	123
15	美国	123
16	美国人	123
SELECT * FROM T1_SEC_CHAR WHERE C1<'ab' ORDER BY C1,ID;
ID	C1	C2
1	A	123
2	A	123
5	a	123
SELECT * FROM T1_SEC_CHAR WHERE C1<='AB' ORDER BY C1,ID;
ID	C1	C2
1	A	123
2	A	123
5	a	123
3	AB	123
4	AB	123
6	ab	123
SELECT * FROM T1_SEC_CHAR ORDER BY C1 ASC, ID ASC;
ID	C1	C2
1	A	123
2	A	123
5	a	123
3	AB	123
4	AB	123
6	ab	123
7	B	123
8	b	123
9	cde	123
10	CDE	123
11	CDE	123
17	一	123
21	一ab三	123
22	一a二b三c	123
20	一二三	123
19	三	123
12	中国	123
13	中国	123
14	中国人	123
18	二	123
15	美国	123
16	美国人	123
SELECT * FROM T1_SEC_CHAR ORDER BY C1 DESC, ID ASC;
ID	C1	C2
16	美国人	123
15	美国	123
18	二	123
14	中国人	123
12	中国	123
13	中国	123
19	三	123
20	一二三	123
22	一a二b三c	123
21	一ab三	123
17	一	123
9	cde	123
10	CDE	123
11	CDE	123
7	B	123
8	b	123
3	AB	123
4	AB	123
6	ab	123
1	A	123
2	A	123
5	a	123
SELECT * FROM T1_SEC_CHAR WHERE C1>'ab' ORDER BY C1 DESC, ID ASC;
ID	C1	C2
16	美国人	123
15	美国	123
18	二	123
14	中国人	123
12	中国	123
13	中国	123
19	三	123
20	一二三	123
22	一a二b三c	123
21	一ab三	123
17	一	123
9	cde	123
10	CDE	123
11	CDE	123
7	B	123
8	b	123
SELECT * FROM T1_SEC_CHAR WHERE C1>'ab' ORDER BY C1 ASC, ID ASC;
ID	C1	C2
7	B	123
8	b	123
9	cde	123
10	CDE	123
11	CDE	123
17	一	123
21	一ab三	123
22	一a二b三c	123
20	一二三	123
19	三	123
12	中国	123
13	中国	123
14	中国人	123
18	二	123
15	美国	123
16	美国人	123
SELECT * FROM T1_SEC_CHAR WHERE C1>'一' ORDER BY C1,ID;
ID	C1	C2
21	一ab三	123
22	一a二b三c	123
20	一二三	123
19	三	123
12	中国	123
13	中国	123
14	中国人	123
18	二	123
15	美国	123
16	美国人	123
SELECT * FROM T1_SEC_CHAR WHERE C1='一' ORDER BY C1,ID;
ID	C1	C2
17	一	123
SELECT * FROM T1_SEC_CHAR WHERE C1<'一' ORDER BY C1,ID;
ID	C1	C2
1	A	123
2	A	123
5	a	123
3	AB	123
4	AB	123
6	ab	123
7	B	123
8	b	123
9	cde	123
10	CDE	123
11	CDE	123
SELECT * FROM T1_SEC_CHAR WHERE C1>'一' ORDER BY C1,ID;
ID	C1	C2
21	一ab三	123
22	一a二b三c	123
20	一二三	123
19	三	123
12	中国	123
13	中国	123
14	中国人	123
18	二	123
15	美国	123
16	美国人	123
SELECT * FROM T1_SEC_CHAR WHERE C1='中国' ORDER BY C1,ID;
ID	C1	C2
12	中国	123
13	中国	123
SELECT * FROM T1_SEC_CHAR WHERE C1='中国 ' ORDER BY C1,ID;
ID	C1	C2
SELECT * FROM T1_SEC_CHAR WHERE C1='中1' ORDER BY C1,ID;
ID	C1	C2
SELECT * FROM T1_SEC_CHAR WHERE C1<='中1国' ORDER BY C1,ID;
ID	C1	C2
1	A	123
2	A	123
5	a	123
3	AB	123
4	AB	123
6	ab	123
7	B	123
8	b	123
9	cde	123
10	CDE	123
11	CDE	123
17	一	123
21	一ab三	123
22	一a二b三c	123
20	一二三	123
19	三	123
SELECT * FROM T1_SEC_CHAR WHERE C1>='美国' ORDER BY C1,ID;
ID	C1	C2
15	美国	123
16	美国人	123
SELECT * FROM T1_SEC_CHAR WHERE C1 in ('一', '二', '美国', 'AB') ORDER BY C1,ID;
ID	C1	C2
3	AB	123
4	AB	123
6	ab	123
17	一	123
18	二	123
15	美国	123
SELECT * FROM T1_SEC_CHAR WHERE C1 LIKE '一%' ORDER BY C1,ID;
ID	C1	C2
17	一	123
21	一ab三	123
22	一a二b三c	123
20	一二三	123
SELECT * FROM T1_SEC_CHAR WHERE C1 LIKE '%一%' ORDER BY C1,ID;
ID	C1	C2
17	一	123
21	一ab三	123
22	一a二b三c	123
20	一二三	123
SELECT * FROM T1_SEC_CHAR WHERE C1 LIKE '%一' ORDER BY C1,ID;
ID	C1	C2
17	一	123
SELECT C2,HEX(C1) FROM T1_SEC_CHAR where c1 LIKE '%中国%' ORDER BY C1,ID;
C2	HEX(C1)
123	E4B8ADE59BBD
123	E4B8ADE59BBD
123	E4B8ADE59BBDE4BABA
SELECT C2,HEX(C1) FROM T1_SEC_CHAR where c1 LIKE '%中a国%' ORDER BY C1,ID;
C2	HEX(C1)
SELECT C2,HEX(C1) FROM T1_SEC_CHAR where c1 LIKE '中国%' ORDER BY C1,ID;
C2	HEX(C1)
123	E4B8ADE59BBD
123	E4B8ADE59BBD
123	E4B8ADE59BBDE4BABA
UPDATE T1_SEC_CHAR SET C2='KFC' WHERE C1>='中国';
SELECT * FROM T1_SEC_CHAR;
ID	C1	C2
1	A	123
2	A	123
3	AB	123
4	AB	123
5	a	123
6	ab	123
7	B	123
8	b	123
9	cde	123
10	CDE	123
11	CDE	123
12	中国	KFC
13	中国	KFC
14	中国人	KFC
15	美国	KFC
16	美国人	KFC
17	一	123
18	二	KFC
19	三	123
20	一二三	123
21	一ab三	123
22	一a二b三c	123
UPDATE T1_SEC_CHAR SET C2='KFC' WHERE C1>='AB';
SELECT * FROM T1_SEC_CHAR;
ID	C1	C2
1	A	123
2	A	123
3	AB	KFC
4	AB	KFC
5	a	123
6	ab	KFC
7	B	KFC
8	b	KFC
9	cde	KFC
10	CDE	KFC
11	CDE	KFC
12	中国	KFC
13	中国	KFC
14	中国人	KFC
15	美国	KFC
16	美国人	KFC
17	一	KFC
18	二	KFC
19	三	KFC
20	一二三	KFC
21	一ab三	KFC
22	一a二b三c	KFC
DELETE FROM T1_SEC_CHAR WHERE C1>='中国';
SELECT * FROM T1_SEC_CHAR;
ID	C1	C2
1	A	123
2	A	123
3	AB	KFC
4	AB	KFC
5	a	123
6	ab	KFC
7	B	KFC
8	b	KFC
9	cde	KFC
10	CDE	KFC
11	CDE	KFC
17	一	KFC
19	三	KFC
20	一二三	KFC
21	一ab三	KFC
22	一a二b三c	KFC
DELETE FROM T1_SEC_CHAR WHERE C1>='ab';
SELECT * FROM T1_SEC_CHAR;
ID	C1	C2
1	A	123
2	A	123
5	a	123
CREATE TABLE T1_UNIQUE(ID INT AUTO_INCREMENT, C1 VARCHAR(100), C2 VARCHAR(100), PRIMARY KEY(ID), UNIQUE KEY IDX_C1(C1)) CHARACTER SET UTF8MB4,COLLATE UTF8MB4_0900_AI_CI;
INSERT INTO T1_UNIQUE(C1,C2) VALUES('A', '123');
INSERT INTO T1_UNIQUE(C1,C2) VALUES('A ', '123');
INSERT INTO T1_UNIQUE(C1,C2) VALUES('AB', '123');
INSERT INTO T1_UNIQUE(C1,C2) VALUES('a', '123');
ERROR 23000: Duplicate entry 'a' for key 'IDX_C1'
INSERT INTO T1_UNIQUE(C1,C2) VALUES('ab', '123');
ERROR 23000: Duplicate entry 'ab' for key 'IDX_C1'
INSERT INTO T1_UNIQUE(C1,C2) VALUES('B', '123');
INSERT INTO T1_UNIQUE(C1,C2) VALUES('b', '123');
ERROR 23000: Duplicate entry 'b' for key 'IDX_C1'
INSERT INTO T1_UNIQUE(C1,C2) VALUES('cde', '123');
INSERT INTO T1_UNIQUE(C1,C2) VALUES('CDE', '123');
ERROR 23000: Duplicate entry 'CDE' for key 'IDX_C1'
INSERT INTO T1_UNIQUE(C1,C2) VALUES('CDE', '123');
ERROR 23000: Duplicate entry 'CDE' for key 'IDX_C1'
INSERT INTO T1_UNIQUE(C1,C2) VALUES('中国', '123');
INSERT INTO T1_UNIQUE(C1,C2) VALUES('中国 ', '123');
INSERT INTO T1_UNIQUE(C1,C2) VALUES('中国人', '123');
INSERT INTO T1_UNIQUE(C1,C2) VALUES('美国', '123');
INSERT INTO T1_UNIQUE(C1,C2) VALUES('美国人', '123');
INSERT INTO T1_UNIQUE(C1,C2) VALUES('一', '123');
INSERT INTO T1_UNIQUE(C1,C2) VALUES('二', '123');
INSERT INTO T1_UNIQUE(C1,C2) VALUES('三', '123');
INSERT INTO T1_UNIQUE(C1,C2) VALUES('一二三','123');
INSERT INTO T1_UNIQUE(C1,C2) VALUES('一ab三','123');
INSERT INTO T1_UNIQUE(C1,C2) VALUES('一a二b三c','123');
SELECT * FROM T1_UNIQUE WHERE C1='A';
ID	C1	C2
1	A	123
SELECT * FROM T1_UNIQUE WHERE C1='a';
ID	C1	C2
1	A	123
SELECT * FROM T1_UNIQUE WHERE C1='A ';
ID	C1	C2
2	A 	123
SELECT * FROM T1_UNIQUE WHERE C1='AB';
ID	C1	C2
3	AB	123
SELECT * FROM T1_UNIQUE WHERE C1='ab';
ID	C1	C2
3	AB	123
SELECT * FROM T1_UNIQUE WHERE C1='abc';
ID	C1	C2
SELECT * FROM T1_UNIQUE WHERE C1 in ('abc', 'AB');
ID	C1	C2
3	AB	123
SELECT * FROM T1_UNIQUE WHERE C1 in ('ABC', 'CDE', 'cde');
ID	C1	C2
8	cde	123
SELECT * FROM T1_UNIQUE WHERE C1>'ab' ORDER BY C1,ID;
ID	C1	C2
6	B	123
8	cde	123
16	一	123
20	一ab三	123
21	一a二b三c	123
19	一二三	123
18	三	123
11	中国	123
12	中国 	123
13	中国人	123
17	二	123
14	美国	123
15	美国人	123
SELECT * FROM T1_UNIQUE WHERE C1>'AB' ORDER BY C1,ID;
ID	C1	C2
6	B	123
8	cde	123
16	一	123
20	一ab三	123
21	一a二b三c	123
19	一二三	123
18	三	123
11	中国	123
12	中国 	123
13	中国人	123
17	二	123
14	美国	123
15	美国人	123
SELECT * FROM T1_UNIQUE WHERE C1>'a' ORDER BY C1,ID;
ID	C1	C2
2	A 	123
3	AB	123
6	B	123
8	cde	123
16	一	123
20	一ab三	123
21	一a二b三c	123
19	一二三	123
18	三	123
11	中国	123
12	中国 	123
13	中国人	123
17	二	123
14	美国	123
15	美国人	123
SELECT * FROM T1_UNIQUE WHERE C1>='a' ORDER BY C1,ID;
ID	C1	C2
1	A	123
2	A 	123
3	AB	123
6	B	123
8	cde	123
16	一	123
20	一ab三	123
21	一a二b三c	123
19	一二三	123
18	三	123
11	中国	123
12	中国 	123
13	中国人	123
17	二	123
14	美国	123
15	美国人	123
SELECT * FROM T1_UNIQUE WHERE C1>='ab' ORDER BY C1,ID;
ID	C1	C2
3	AB	123
6	B	123
8	cde	123
16	一	123
20	一ab三	123
21	一a二b三c	123
19	一二三	123
18	三	123
11	中国	123
12	中国 	123
13	中国人	123
17	二	123
14	美国	123
15	美国人	123
SELECT * FROM T1_UNIQUE WHERE C1>='AB' ORDER BY C1,ID;
ID	C1	C2
3	AB	123
6	B	123
8	cde	123
16	一	123
20	一ab三	123
21	一a二b三c	123
19	一二三	123
18	三	123
11	中国	123
12	中国 	123
13	中国人	123
17	二	123
14	美国	123
15	美国人	123
SELECT * FROM T1_UNIQUE WHERE C1<'ab' ORDER BY C1,ID;
ID	C1	C2
1	A	123
2	A 	123
SELECT * FROM T1_UNIQUE WHERE C1<='AB' ORDER BY C1,ID;
ID	C1	C2
1	A	123
2	A 	123
3	AB	123
SELECT * FROM T1_UNIQUE ORDER BY C1 ASC, ID ASC;
ID	C1	C2
1	A	123
2	A 	123
3	AB	123
6	B	123
8	cde	123
16	一	123
20	一ab三	123
21	一a二b三c	123
19	一二三	123
18	三	123
11	中国	123
12	中国 	123
13	中国人	123
17	二	123
14	美国	123
15	美国人	123
SELECT * FROM T1_UNIQUE ORDER BY C1 DESC, ID ASC;
ID	C1	C2
15	美国人	123
14	美国	123
17	二	123
13	中国人	123
12	中国 	123
11	中国	123
18	三	123
19	一二三	123
21	一a二b三c	123
20	一ab三	123
16	一	123
8	cde	123
6	B	123
3	AB	123
2	A 	123
1	A	123
SELECT * FROM T1_UNIQUE WHERE C1>'ab' ORDER BY C1 DESC, ID ASC;
ID	C1	C2
15	美国人	123
14	美国	123
17	二	123
13	中国人	123
12	中国 	123
11	中国	123
18	三	123
19	一二三	123
21	一a二b三c	123
20	一ab三	123
16	一	123
8	cde	123
6	B	123
SELECT * FROM T1_UNIQUE WHERE C1>'ab' ORDER BY C1 ASC, ID ASC;
ID	C1	C2
6	B	123
8	cde	123
16	一	123
20	一ab三	123
21	一a二b三c	123
19	一二三	123
18	三	123
11	中国	123
12	中国 	123
13	中国人	123
17	二	123
14	美国	123
15	美国人	123
SELECT * FROM T1_UNIQUE WHERE C1>'一' ORDER BY C1,ID;
ID	C1	C2
20	一ab三	123
21	一a二b三c	123
19	一二三	123
18	三	123
11	中国	123
12	中国 	123
13	中国人	123
17	二	123
14	美国	123
15	美国人	123
SELECT * FROM T1_UNIQUE WHERE C1='一' ORDER BY C1,ID;
ID	C1	C2
16	一	123
SELECT * FROM T1_UNIQUE WHERE C1<'一' ORDER BY C1,ID;
ID	C1	C2
1	A	123
2	A 	123
3	AB	123
6	B	123
8	cde	123
SELECT * FROM T1_UNIQUE WHERE C1>'一' ORDER BY C1,ID;
ID	C1	C2
20	一ab三	123
21	一a二b三c	123
19	一二三	123
18	三	123
11	中国	123
12	中国 	123
13	中国人	123
17	二	123
14	美国	123
15	美国人	123
SELECT * FROM T1_UNIQUE WHERE C1='中国' ORDER BY C1,ID;
ID	C1	C2
11	中国	123
SELECT * FROM T1_UNIQUE WHERE C1='中1' ORDER BY C1,ID;
ID	C1	C2
SELECT * FROM T1_UNIQUE WHERE C1<='中1国' ORDER BY C1,ID;
ID	C1	C2
1	A	123
2	A 	123
3	AB	123
6	B	123
8	cde	123
16	一	123
20	一ab三	123
21	一a二b三c	123
19	一二三	123
18	三	123
SELECT * FROM T1_UNIQUE WHERE C1>='美国' ORDER BY C1,ID;
ID	C1	C2
14	美国	123
15	美国人	123
SELECT * FROM T1_UNIQUE WHERE C1 in ('一', '二', '美国', 'AB');
ID	C1	C2
3	AB	123
16	一	123
17	二	123
14	美国	123
SELECT * FROM T1_UNIQUE WHERE C1 LIKE '一%' ORDER BY C1,ID;
ID	C1	C2
16	一	123
20	一ab三	123
21	一a二b三c	123
19	一二三	123
SELECT * FROM T1_UNIQUE WHERE C1 LIKE '%一%' ORDER BY C1,ID;
ID	C1	C2
16	一	123
20	一ab三	123
21	一a二b三c	123
19	一二三	123
SELECT * FROM T1_UNIQUE WHERE C1 LIKE '%一' ORDER BY C1,ID;
ID	C1	C2
16	一	123
UPDATE T1_UNIQUE SET C2='KFC' WHERE C1>='中国';
SELECT * FROM T1_UNIQUE;
ID	C1	C2
1	A	123
2	A 	123
3	AB	123
6	B	123
8	cde	123
11	中国	KFC
12	中国 	KFC
13	中国人	KFC
14	美国	KFC
15	美国人	KFC
16	一	123
17	二	KFC
18	三	123
19	一二三	123
20	一ab三	123
21	一a二b三c	123
UPDATE T1_UNIQUE SET C2='KFC' WHERE C1>='AB';
SELECT * FROM T1_UNIQUE;
ID	C1	C2
1	A	123
2	A 	123
3	AB	KFC
6	B	KFC
8	cde	KFC
11	中国	KFC
12	中国 	KFC
13	中国人	KFC
14	美国	KFC
15	美国人	KFC
16	一	KFC
17	二	KFC
18	三	KFC
19	一二三	KFC
20	一ab三	KFC
21	一a二b三c	KFC
DELETE FROM T1_UNIQUE WHERE C1>='中国';
SELECT * FROM T1_UNIQUE;
ID	C1	C2
1	A	123
2	A 	123
3	AB	KFC
6	B	KFC
8	cde	KFC
16	一	KFC
18	三	KFC
19	一二三	KFC
20	一ab三	KFC
21	一a二b三c	KFC
DELETE FROM T1_UNIQUE WHERE C1>='ab';
SELECT * FROM T1_UNIQUE;
ID	C1	C2
1	A	123
2	A 	123
CREATE TABLE T1_UNIQUE_CHAR(ID INT AUTO_INCREMENT, C1 CHAR(100), C2 CHAR(100), PRIMARY KEY(ID), UNIQUE KEY IDX_C1(C1)) CHARACTER SET UTF8MB4,COLLATE UTF8MB4_0900_AI_CI;
INSERT INTO T1_UNIQUE_CHAR(C1,C2) VALUES('A', '123');
INSERT INTO T1_UNIQUE_CHAR(C1,C2) VALUES('AB', '123');
INSERT INTO T1_UNIQUE_CHAR(C1,C2) VALUES('a', '123');
ERROR 23000: Duplicate entry 'a' for key 'IDX_C1'
INSERT INTO T1_UNIQUE_CHAR(C1,C2) VALUES('a ', '123');
ERROR 23000: Duplicate entry 'a' for key 'IDX_C1'
INSERT INTO T1_UNIQUE_CHAR(C1,C2) VALUES('ab', '123');
ERROR 23000: Duplicate entry 'ab' for key 'IDX_C1'
INSERT INTO T1_UNIQUE_CHAR(C1,C2) VALUES('B', '123');
INSERT INTO T1_UNIQUE_CHAR(C1,C2) VALUES('b', '123');
ERROR 23000: Duplicate entry 'b' for key 'IDX_C1'
INSERT INTO T1_UNIQUE_CHAR(C1,C2) VALUES('cde', '123');
INSERT INTO T1_UNIQUE_CHAR(C1,C2) VALUES('CDE', '123');
ERROR 23000: Duplicate entry 'CDE' for key 'IDX_C1'
INSERT INTO T1_UNIQUE_CHAR(C1,C2) VALUES('CDE', '123');
ERROR 23000: Duplicate entry 'CDE' for key 'IDX_C1'
INSERT INTO T1_UNIQUE_CHAR(C1,C2) VALUES('中国', '123');
INSERT INTO T1_UNIQUE_CHAR(C1,C2) VALUES('中国人', '123');
INSERT INTO T1_UNIQUE_CHAR(C1,C2) VALUES('美国', '123');
INSERT INTO T1_UNIQUE_CHAR(C1,C2) VALUES('美国人', '123');
INSERT INTO T1_UNIQUE_CHAR(C1,C2) VALUES('一', '123');
INSERT INTO T1_UNIQUE_CHAR(C1,C2) VALUES('二', '123');
INSERT INTO T1_UNIQUE_CHAR(C1,C2) VALUES('三', '123');
INSERT INTO T1_UNIQUE_CHAR(C1,C2) VALUES('一二三','123');
INSERT INTO T1_UNIQUE_CHAR(C1,C2) VALUES('一ab三','123');
INSERT INTO T1_UNIQUE_CHAR(C1,C2) VALUES('一a二b三c','123');
SELECT * FROM T1_UNIQUE_CHAR WHERE C1='A';
ID	C1	C2
1	A	123
SELECT * FROM T1_UNIQUE_CHAR WHERE C1='A ';
ID	C1	C2
SELECT * FROM T1_UNIQUE_CHAR WHERE C1='a';
ID	C1	C2
1	A	123
SELECT * FROM T1_UNIQUE_CHAR WHERE C1='AB';
ID	C1	C2
2	AB	123
SELECT * FROM T1_UNIQUE_CHAR WHERE C1='ab';
ID	C1	C2
2	AB	123
SELECT * FROM T1_UNIQUE_CHAR WHERE C1='abc';
ID	C1	C2
SELECT * FROM T1_UNIQUE_CHAR WHERE C1 in ('abc', 'AB');
ID	C1	C2
2	AB	123
SELECT * FROM T1_UNIQUE_CHAR WHERE C1 in ('ABC', 'CDE', 'cde');
ID	C1	C2
8	cde	123
SELECT * FROM T1_UNIQUE_CHAR WHERE C1>'ab' ORDER BY C1,ID;
ID	C1	C2
6	B	123
8	cde	123
15	一	123
19	一ab三	123
20	一a二b三c	123
18	一二三	123
17	三	123
11	中国	123
12	中国人	123
16	二	123
13	美国	123
14	美国人	123
SELECT * FROM T1_UNIQUE_CHAR WHERE C1>'AB' ORDER BY C1,ID;
ID	C1	C2
6	B	123
8	cde	123
15	一	123
19	一ab三	123
20	一a二b三c	123
18	一二三	123
17	三	123
11	中国	123
12	中国人	123
16	二	123
13	美国	123
14	美国人	123
SELECT * FROM T1_UNIQUE_CHAR WHERE C1>'a' ORDER BY C1,ID;
ID	C1	C2
2	AB	123
6	B	123
8	cde	123
15	一	123
19	一ab三	123
20	一a二b三c	123
18	一二三	123
17	三	123
11	中国	123
12	中国人	123
16	二	123
13	美国	123
14	美国人	123
SELECT * FROM T1_UNIQUE_CHAR WHERE C1>='a' ORDER BY C1,ID;
ID	C1	C2
1	A	123
2	AB	123
6	B	123
8	cde	123
15	一	123
19	一ab三	123
20	一a二b三c	123
18	一二三	123
17	三	123
11	中国	123
12	中国人	123
16	二	123
13	美国	123
14	美国人	123
SELECT * FROM T1_UNIQUE_CHAR WHERE C1>='ab' ORDER BY C1,ID;
ID	C1	C2
2	AB	123
6	B	123
8	cde	123
15	一	123
19	一ab三	123
20	一a二b三c	123
18	一二三	123
17	三	123
11	中国	123
12	中国人	123
16	二	123
13	美国	123
14	美国人	123
SELECT * FROM T1_UNIQUE_CHAR WHERE C1>='AB' ORDER BY C1,ID;
ID	C1	C2
2	AB	123
6	B	123
8	cde	123
15	一	123
19	一ab三	123
20	一a二b三c	123
18	一二三	123
17	三	123
11	中国	123
12	中国人	123
16	二	123
13	美国	123
14	美国人	123
SELECT * FROM T1_UNIQUE_CHAR WHERE C1<'ab' ORDER BY C1,ID;
ID	C1	C2
1	A	123
SELECT * FROM T1_UNIQUE_CHAR WHERE C1<='AB' ORDER BY C1,ID;
ID	C1	C2
1	A	123
2	AB	123
SELECT * FROM T1_UNIQUE_CHAR ORDER BY C1 ASC, ID ASC;
ID	C1	C2
1	A	123
2	AB	123
6	B	123
8	cde	123
15	一	123
19	一ab三	123
20	一a二b三c	123
18	一二三	123
17	三	123
11	中国	123
12	中国人	123
16	二	123
13	美国	123
14	美国人	123
SELECT * FROM T1_UNIQUE_CHAR ORDER BY C1 DESC, ID ASC;
ID	C1	C2
14	美国人	123
13	美国	123
16	二	123
12	中国人	123
11	中国	123
17	三	123
18	一二三	123
20	一a二b三c	123
19	一ab三	123
15	一	123
8	cde	123
6	B	123
2	AB	123
1	A	123
SELECT * FROM T1_UNIQUE_CHAR WHERE C1>'ab' ORDER BY C1 DESC, ID ASC;
ID	C1	C2
14	美国人	123
13	美国	123
16	二	123
12	中国人	123
11	中国	123
17	三	123
18	一二三	123
20	一a二b三c	123
19	一ab三	123
15	一	123
8	cde	123
6	B	123
SELECT * FROM T1_UNIQUE_CHAR WHERE C1>'ab' ORDER BY C1 ASC, ID ASC;
ID	C1	C2
6	B	123
8	cde	123
15	一	123
19	一ab三	123
20	一a二b三c	123
18	一二三	123
17	三	123
11	中国	123
12	中国人	123
16	二	123
13	美国	123
14	美国人	123
SELECT * FROM T1_UNIQUE_CHAR WHERE C1>'一' ORDER BY C1,ID;
ID	C1	C2
19	一ab三	123
20	一a二b三c	123
18	一二三	123
17	三	123
11	中国	123
12	中国人	123
16	二	123
13	美国	123
14	美国人	123
SELECT * FROM T1_UNIQUE_CHAR WHERE C1='一' ORDER BY C1,ID;
ID	C1	C2
15	一	123
SELECT * FROM T1_UNIQUE_CHAR WHERE C1<'一' ORDER BY C1,ID;
ID	C1	C2
1	A	123
2	AB	123
6	B	123
8	cde	123
SELECT * FROM T1_UNIQUE_CHAR WHERE C1>'一' ORDER BY C1,ID;
ID	C1	C2
19	一ab三	123
20	一a二b三c	123
18	一二三	123
17	三	123
11	中国	123
12	中国人	123
16	二	123
13	美国	123
14	美国人	123
SELECT * FROM T1_UNIQUE_CHAR WHERE C1='中国' ORDER BY C1,ID;
ID	C1	C2
11	中国	123
SELECT * FROM T1_UNIQUE_CHAR WHERE C1='中1' ORDER BY C1,ID;
ID	C1	C2
SELECT * FROM T1_UNIQUE_CHAR WHERE C1<='中1国' ORDER BY C1,ID;
ID	C1	C2
1	A	123
2	AB	123
6	B	123
8	cde	123
15	一	123
19	一ab三	123
20	一a二b三c	123
18	一二三	123
17	三	123
SELECT * FROM T1_UNIQUE_CHAR WHERE C1>='美国' ORDER BY C1,ID;
ID	C1	C2
13	美国	123
14	美国人	123
SELECT * FROM T1_UNIQUE_CHAR WHERE C1 in ('一', '二', '美国', 'AB');
ID	C1	C2
2	AB	123
15	一	123
16	二	123
13	美国	123
SELECT * FROM T1_UNIQUE_CHAR WHERE C1 LIKE '一%' ORDER BY C1,ID;
ID	C1	C2
15	一	123
19	一ab三	123
20	一a二b三c	123
18	一二三	123
SELECT * FROM T1_UNIQUE_CHAR WHERE C1 LIKE '%一%' ORDER BY C1,ID;
ID	C1	C2
15	一	123
19	一ab三	123
20	一a二b三c	123
18	一二三	123
SELECT * FROM T1_UNIQUE_CHAR WHERE C1 LIKE '%一' ORDER BY C1,ID;
ID	C1	C2
15	一	123
SELECT C2,HEX(C1) FROM T1_UNIQUE_CHAR where c1 LIKE '%中国%' ORDER BY C1,ID;
C2	HEX(C1)
123	E4B8ADE59BBD
123	E4B8ADE59BBDE4BABA
SELECT C2,HEX(C1) FROM T1_UNIQUE_CHAR where c1 LIKE '%中a国%' ORDER BY C1,ID;
C2	HEX(C1)
SELECT C2,HEX(C1) FROM T1_UNIQUE_CHAR where c1 LIKE '中国%' ORDER BY C1,ID;
C2	HEX(C1)
123	E4B8ADE59BBD
123	E4B8ADE59BBDE4BABA
UPDATE T1_UNIQUE_CHAR SET C2='KFC' WHERE C1>='中国';
SELECT * FROM T1_UNIQUE_CHAR;
ID	C1	C2
1	A	123
2	AB	123
6	B	123
8	cde	123
11	中国	KFC
12	中国人	KFC
13	美国	KFC
14	美国人	KFC
15	一	123
16	二	KFC
17	三	123
18	一二三	123
19	一ab三	123
20	一a二b三c	123
UPDATE T1_UNIQUE_CHAR SET C2='KFC' WHERE C1>='AB';
SELECT * FROM T1_UNIQUE_CHAR;
ID	C1	C2
1	A	123
2	AB	KFC
6	B	KFC
8	cde	KFC
11	中国	KFC
12	中国人	KFC
13	美国	KFC
14	美国人	KFC
15	一	KFC
16	二	KFC
17	三	KFC
18	一二三	KFC
19	一ab三	KFC
20	一a二b三c	KFC
DELETE FROM T1_UNIQUE_CHAR WHERE C1>='中国';
SELECT * FROM T1_UNIQUE_CHAR;
ID	C1	C2
1	A	123
2	AB	KFC
6	B	KFC
8	cde	KFC
15	一	KFC
17	三	KFC
18	一二三	KFC
19	一ab三	KFC
20	一a二b三c	KFC
DELETE FROM T1_UNIQUE_CHAR WHERE C1>='ab';
SELECT * FROM T1_UNIQUE_CHAR;
ID	C1	C2
1	A	123
CREATE TABLE T1_SEC_COMBINED(ID INT AUTO_INCREMENT, C1 VARCHAR(100), C2 VARCHAR(100), PRIMARY KEY(ID), KEY IDX_C1C2(C1,C2)) CHARACTER SET UTF8MB4,COLLATE UTF8MB4_0900_AI_CI;
INSERT INTO T1_SEC_COMBINED(C1,C2) VALUES('A', 'a');
INSERT INTO T1_SEC_COMBINED(C1,C2) VALUES('AB', '中国');
INSERT INTO T1_SEC_COMBINED(C1,C2) VALUES('a', '125');
INSERT INTO T1_SEC_COMBINED(C1,C2) VALUES('ab', '美国');
INSERT INTO T1_SEC_COMBINED(C1,C2) VALUES('B', '123');
INSERT INTO T1_SEC_COMBINED(C1,C2) VALUES('b', '124');
INSERT INTO T1_SEC_COMBINED(C1,C2) VALUES('cde', 'abc');
INSERT INTO T1_SEC_COMBINED(C1,C2) VALUES('CDE', '123');
INSERT INTO T1_SEC_COMBINED(C1,C2) VALUES('CDE', '124');
INSERT INTO T1_SEC_COMBINED(C1,C2) VALUES('中国', '一');
INSERT INTO T1_SEC_COMBINED(C1,C2) VALUES('中国人', '二');
INSERT INTO T1_SEC_COMBINED(C1,C2) VALUES('美国', '124');
INSERT INTO T1_SEC_COMBINED(C1,C2) VALUES('美国人', '125');
INSERT INTO T1_SEC_COMBINED(C1,C2) VALUES('一', '中a国');
INSERT INTO T1_SEC_COMBINED(C1,C2) VALUES('二', '124');
INSERT INTO T1_SEC_COMBINED(C1,C2) VALUES('三', '123');
INSERT INTO T1_SEC_COMBINED(C1,C2) VALUES('一二三','中a国b美国');
INSERT INTO T1_SEC_COMBINED(C1,C2) VALUES('一ab三','124');
INSERT INTO T1_SEC_COMBINED(C1,C2) VALUES('一a二b三c','123');
SELECT * FROM T1_SEC_COMBINED WHERE C1='A';
ID	C1	C2
3	A	123
1	A	123
2	A	123
4	A	123
5	A	123
6	A	123
8	A	123
9	A	123
7	A	123
14	A	123
18	A	123
19	A	123
17	A	123
16	A	123
10	A	123
11	A	123
15	A	123
12	A	123
13	A	123
SELECT * FROM T1_SEC_COMBINED WHERE C1='a' and C2='125';
ID	C1	C2
3	a	125
1	a	125
2	a	125
4	a	125
5	a	125
6	a	125
8	a	125
9	a	125
7	a	125
14	a	125
18	a	125
19	a	125
17	a	125
16	a	125
10	a	125
11	a	125
15	a	125
12	a	125
13	a	125
SELECT * FROM T1_SEC_COMBINED WHERE C1='AB';
ID	C1	C2
2	AB	125
4	AB	125
5	AB	125
6	AB	125
8	AB	125
9	AB	125
7	AB	125
14	AB	125
18	AB	125
19	AB	125
17	AB	125
16	AB	125
10	AB	125
11	AB	125
15	AB	125
12	AB	125
13	AB	125
SELECT * FROM T1_SEC_COMBINED WHERE C1='ab';
ID	C1	C2
2	ab	125
4	ab	125
5	ab	125
6	ab	125
8	ab	125
9	ab	125
7	ab	125
14	ab	125
18	ab	125
19	ab	125
17	ab	125
16	ab	125
10	ab	125
11	ab	125
15	ab	125
12	ab	125
13	ab	125
SELECT * FROM T1_SEC_COMBINED WHERE C1='ab' and C2='中国';
ID	C1	C2
2	ab	中国
4	ab	中国
5	ab	中国
6	ab	中国
8	ab	中国
9	ab	中国
7	ab	中国
14	ab	中国
18	ab	中国
19	ab	中国
17	ab	中国
16	ab	中国
10	ab	中国
11	ab	中国
15	ab	中国
12	ab	中国
13	ab	中国
SELECT * FROM T1_SEC_COMBINED WHERE C1 in ('ABC', 'CDE', 'cde') ORDER BY C1,C2,ID;
ID	C1	C2
3	CDE	中国
1	CDE	中国
2	CDE	中国
4	CDE	中国
5	CDE	中国
6	CDE	中国
8	CDE	中国
9	CDE	中国
7	CDE	中国
14	CDE	中国
18	CDE	中国
19	CDE	中国
17	CDE	中国
16	CDE	中国
10	CDE	中国
11	CDE	中国
15	CDE	中国
12	CDE	中国
13	CDE	中国
SELECT * FROM T1_SEC_COMBINED WHERE C1>'ab' ORDER BY C1,C2,ID;
ID	C1	C2
SELECT * FROM T1_SEC_COMBINED WHERE C1>'ab' and C2>'中国' ORDER BY C1,C2,ID;
ID	C1	C2
SELECT * FROM T1_SEC_COMBINED WHERE C1>'a' and C2<'124' ORDER BY C1,C2,ID;
ID	C1	C2
SELECT * FROM T1_SEC_COMBINED WHERE C1>='a' ORDER BY C1,C2,ID;
ID	C1	C2
3	a	124
1	a	124
2	a	124
4	a	124
5	a	124
6	a	124
8	a	124
9	a	124
7	a	124
14	a	124
18	a	124
19	a	124
17	a	124
16	a	124
10	a	124
11	a	124
15	a	124
12	a	124
13	a	124
SELECT * FROM T1_SEC_COMBINED WHERE C1>='ab' and C2>='124' ORDER BY C1,C2,ID;
ID	C1	C2
3	ab	124
1	ab	124
2	ab	124
4	ab	124
5	ab	124
6	ab	124
8	ab	124
9	ab	124
7	ab	124
14	ab	124
18	ab	124
19	ab	124
17	ab	124
16	ab	124
10	ab	124
11	ab	124
15	ab	124
12	ab	124
13	ab	124
SELECT * FROM T1_SEC_COMBINED WHERE C1>='AB' and C2>='124' ORDER BY C1,C2,ID;
ID	C1	C2
3	AB	124
1	AB	124
2	AB	124
4	AB	124
5	AB	124
6	AB	124
8	AB	124
9	AB	124
7	AB	124
14	AB	124
18	AB	124
19	AB	124
17	AB	124
16	AB	124
10	AB	124
11	AB	124
15	AB	124
12	AB	124
13	AB	124
SELECT * FROM T1_SEC_COMBINED WHERE C1<'ab' and C2<'美国' ORDER BY C1,C2,ID;
ID	C1	C2
SELECT * FROM T1_SEC_COMBINED WHERE C1<='AB' and C2>='124' ORDER BY C1,C2,ID;
ID	C1	C2
3	AB	124
1	AB	124
2	AB	124
4	AB	124
5	AB	124
6	AB	124
8	AB	124
9	AB	124
7	AB	124
14	AB	124
18	AB	124
19	AB	124
17	AB	124
16	AB	124
10	AB	124
11	AB	124
15	AB	124
12	AB	124
13	AB	124
SELECT * FROM T1_SEC_COMBINED WHERE C1>='一ab二' and C2<'二' ORDER BY C1,C2,ID;
ID	C1	C2
SELECT * FROM T1_SEC_COMBINED WHERE C1='一ab三' ORDER BY C1,C2,ID;
ID	C1	C2
18	一ab三	NULL
19	一ab三	NULL
17	一ab三	NULL
16	一ab三	NULL
10	一ab三	NULL
11	一ab三	NULL
15	一ab三	NULL
12	一ab三	NULL
13	一ab三	NULL
SELECT * FROM T1_SEC_COMBINED WHERE C1<='一' ORDER BY C1,C2,ID;
ID	C1	C2
3	一	NULL
1	一	NULL
2	一	NULL
4	一	NULL
5	一	NULL
6	一	NULL
8	一	NULL
9	一	NULL
7	一	NULL
14	一	NULL
18	一	NULL
19	一	NULL
17	一	NULL
16	一	NULL
10	一	NULL
11	一	NULL
15	一	NULL
12	一	NULL
13	一	NULL
SELECT * FROM T1_SEC_COMBINED WHERE C1>='美a国' and C2<'125' ORDER BY C1,C2,ID;
ID	C1	C2
SELECT * FROM T1_SEC_COMBINED ORDER BY C1 ASC, C2 ASC, ID ASC;
ID	C1	C2
3	美a国	NULL
1	美a国	NULL
2	美a国	NULL
4	美a国	NULL
5	美a国	NULL
6	美a国	NULL
8	美a国	NULL
9	美a国	NULL
7	美a国	NULL
14	美a国	NULL
18	美a国	NULL
19	美a国	NULL
17	美a国	NULL
16	美a国	NULL
10	美a国	NULL
11	美a国	NULL
15	美a国	NULL
12	美a国	NULL
13	美a国	NULL
SELECT * FROM T1_SEC_COMBINED ORDER BY C1 DESC, C2 ASC, ID ASC;
ID	C1	C2
1	美a国	NULL
2	美a国	NULL
3	美a国	NULL
4	美a国	NULL
5	美a国	NULL
6	美a国	NULL
7	美a国	NULL
8	美a国	NULL
9	美a国	NULL
10	美a国	NULL
11	美a国	NULL
12	美a国	NULL
13	美a国	NULL
14	美a国	NULL
15	美a国	NULL
16	美a国	NULL
17	美a国	NULL
18	美a国	NULL
19	美a国	NULL
SELECT * FROM T1_SEC_COMBINED WHERE C1>'ab' ORDER BY C1,C2,ID DESC;
ID	C1	C2
SELECT * FROM T1_SEC_COMBINED WHERE C1>'ab' ORDER BY C1,C2,ID ASC;
ID	C1	C2
CREATE TABLE T1_SEC_COMBINED2(ID INT AUTO_INCREMENT, C1 INT, C2 VARCHAR(100), PRIMARY KEY(ID), KEY IDX_C1C2(C1,C2)) CHARACTER SET UTF8MB4,COLLATE UTF8MB4_0900_AI_CI;
INSERT INTO T1_SEC_COMBINED2(C1,C2) VALUES(1, 'a');
INSERT INTO T1_SEC_COMBINED2(C1,C2) VALUES(1, '中国');
INSERT INTO T1_SEC_COMBINED2(C1,C2) VALUES(2, '125');
INSERT INTO T1_SEC_COMBINED2(C1,C2) VALUES(3, '美国');
INSERT INTO T1_SEC_COMBINED2(C1,C2) VALUES(2, '123');
INSERT INTO T1_SEC_COMBINED2(C1,C2) VALUES(3, '124');
INSERT INTO T1_SEC_COMBINED2(C1,C2) VALUES(2, 'abc');
INSERT INTO T1_SEC_COMBINED2(C1,C2) VALUES(2, '123');
INSERT INTO T1_SEC_COMBINED2(C1,C2) VALUES(3, '124');
INSERT INTO T1_SEC_COMBINED2(C1,C2) VALUES(2, '一');
INSERT INTO T1_SEC_COMBINED2(C1,C2) VALUES(1, '二');
INSERT INTO T1_SEC_COMBINED2(C1,C2) VALUES(4, '124');
INSERT INTO T1_SEC_COMBINED2(C1,C2) VALUES(1, '125');
INSERT INTO T1_SEC_COMBINED2(C1,C2) VALUES(2, '中a国');
INSERT INTO T1_SEC_COMBINED2(C1,C2) VALUES(3, '124');
INSERT INTO T1_SEC_COMBINED2(C1,C2) VALUES(1, '123');
INSERT INTO T1_SEC_COMBINED2(C1,C2) VALUES(2,'中a国b美国');
INSERT INTO T1_SEC_COMBINED2(C1,C2) VALUES(3,'124');
INSERT INTO T1_SEC_COMBINED2(C1,C2) VALUES(1,'123');
SELECT * FROM T1_SEC_COMBINED2 WHERE C1=1;
ID	C1	C2
16	1	123
19	1	123
13	1	123
1	1	123
2	1	123
11	1	123
SELECT * FROM T1_SEC_COMBINED2 WHERE C1=2 and C2='125';
ID	C1	C2
3	2	125
7	2	125
10	2	125
14	2	125
17	2	125
SELECT * FROM T1_SEC_COMBINED2 WHERE C1=2;
ID	C1	C2
5	2	125
8	2	125
3	2	125
7	2	125
10	2	125
14	2	125
17	2	125
SELECT * FROM T1_SEC_COMBINED2 WHERE C1=3;
ID	C1	C2
6	3	125
9	3	125
15	3	125
18	3	125
4	3	125
SELECT * FROM T1_SEC_COMBINED2 WHERE C1=1 and C2='中国';
ID	C1	C2
2	1	中国
11	1	中国
SELECT * FROM T1_SEC_COMBINED2 WHERE C1 in (1, 3, 4) ORDER BY C1,C2,ID;
ID	C1	C2
16	1	中国
19	1	中国
13	1	中国
1	1	中国
2	1	中国
11	1	中国
6	3	中国
9	3	中国
15	3	中国
18	3	中国
4	3	中国
12	4	中国
SELECT * FROM T1_SEC_COMBINED2 WHERE C1>1 ORDER BY C1,C2,ID;
ID	C1	C2
5	2	NULL
8	2	NULL
3	2	NULL
7	2	NULL
10	2	NULL
14	2	NULL
17	2	NULL
6	3	NULL
9	3	NULL
15	3	NULL
18	3	NULL
4	3	NULL
12	4	NULL
SELECT * FROM T1_SEC_COMBINED2 WHERE C1>1 and C2>'中国' ORDER BY C1,C2,ID;
ID	C1	C2
SELECT * FROM T1_SEC_COMBINED2 WHERE C1>2 and C2<'124' ORDER BY C1,C2,ID;
ID	C1	C2
SELECT * FROM T1_SEC_COMBINED2 WHERE C1>=2 ORDER BY C1,C2,ID;
ID	C1	C2
5	2	NULL
8	2	NULL
3	2	NULL
7	2	NULL
10	2	NULL
14	2	NULL
17	2	NULL
6	3	NULL
9	3	NULL
15	3	NULL
18	3	NULL
4	3	NULL
12	4	NULL
SELECT * FROM T1_SEC_COMBINED2 WHERE C1>=2 and C2>='124' ORDER BY C1,C2,ID;
ID	C1	C2
3	2	124
7	2	124
10	2	124
14	2	124
17	2	124
6	3	124
9	3	124
15	3	124
18	3	124
4	3	124
12	4	124
SELECT * FROM T1_SEC_COMBINED2 WHERE C1>=2 and C2>='124' ORDER BY C1,C2,ID;
ID	C1	C2
3	2	124
7	2	124
10	2	124
14	2	124
17	2	124
6	3	124
9	3	124
15	3	124
18	3	124
4	3	124
12	4	124
SELECT * FROM T1_SEC_COMBINED2 WHERE C1<3 and C2<'美国' ORDER BY C1,C2,ID;
ID	C1	C2
SELECT * FROM T1_SEC_COMBINED2 WHERE C1<=2 and C2>='124' ORDER BY C1,C2,ID;
ID	C1	C2
SELECT * FROM T1_SEC_COMBINED2 WHERE C1>=1 and C2<'二' ORDER BY C1,C2,ID;
ID	C1	C2
SELECT * FROM T1_SEC_COMBINED2 WHERE C1=1 ORDER BY C1,C2,ID;
ID	C1	C2
16	1	NULL
19	1	NULL
13	1	NULL
1	1	NULL
2	1	NULL
11	1	NULL
SELECT * FROM T1_SEC_COMBINED2 WHERE C1<=2 ORDER BY C1,C2,ID;
ID	C1	C2
16	1	NULL
19	1	NULL
13	1	NULL
1	1	NULL
2	1	NULL
11	1	NULL
5	2	NULL
8	2	NULL
3	2	NULL
7	2	NULL
10	2	NULL
14	2	NULL
17	2	NULL
SELECT * FROM T1_SEC_COMBINED2 WHERE C1>=2 and C2<'125' ORDER BY C1,C2,ID;
ID	C1	C2
SELECT * FROM T1_SEC_COMBINED2 ORDER BY C1 ASC, C2 ASC, ID ASC;
ID	C1	C2
16	1	NULL
19	1	NULL
13	1	NULL
1	1	NULL
2	1	NULL
11	1	NULL
5	2	NULL
8	2	NULL
3	2	NULL
7	2	NULL
10	2	NULL
14	2	NULL
17	2	NULL
6	3	NULL
9	3	NULL
15	3	NULL
18	3	NULL
4	3	NULL
12	4	NULL
SELECT * FROM T1_SEC_COMBINED2 ORDER BY C1 DESC, C2 ASC, ID ASC;
ID	C1	C2
12	4	NULL
4	3	NULL
6	3	NULL
9	3	NULL
15	3	NULL
18	3	NULL
3	2	NULL
5	2	NULL
7	2	NULL
8	2	NULL
10	2	NULL
14	2	NULL
17	2	NULL
1	1	NULL
2	1	NULL
11	1	NULL
13	1	NULL
16	1	NULL
19	1	NULL
SELECT * FROM T1_SEC_COMBINED2 WHERE C1>1 ORDER BY C1,C2,ID DESC;
ID	C1	C2
17	2	NULL
14	2	NULL
10	2	NULL
8	2	NULL
7	2	NULL
5	2	NULL
3	2	NULL
18	3	NULL
15	3	NULL
9	3	NULL
6	3	NULL
4	3	NULL
12	4	NULL
SELECT * FROM T1_SEC_COMBINED2 WHERE C1>1 ORDER BY C1,C2,ID ASC;
ID	C1	C2
5	2	NULL
8	2	NULL
3	2	NULL
7	2	NULL
10	2	NULL
14	2	NULL
17	2	NULL
6	3	NULL
9	3	NULL
15	3	NULL
18	3	NULL
4	3	NULL
12	4	NULL
CREATE TABLE T1_SEC_COMBINED3(ID INT AUTO_INCREMENT, C1 VARCHAR(100), C2 INT, PRIMARY KEY(ID), KEY IDX_C1C2(C1,C2)) CHARACTER SET UTF8MB4,COLLATE UTF8MB4_0900_AI_CI;
INSERT INTO T1_SEC_COMBINED3(C1,C2) VALUES('A', 1);
INSERT INTO T1_SEC_COMBINED3(C1,C2) VALUES('AB', 2);
INSERT INTO T1_SEC_COMBINED3(C1,C2) VALUES('a', 3);
INSERT INTO T1_SEC_COMBINED3(C1,C2) VALUES('ab', 1);
INSERT INTO T1_SEC_COMBINED3(C1,C2) VALUES('B', 2);
INSERT INTO T1_SEC_COMBINED3(C1,C2) VALUES('b', 3);
INSERT INTO T1_SEC_COMBINED3(C1,C2) VALUES('cde', 1);
INSERT INTO T1_SEC_COMBINED3(C1,C2) VALUES('CDE', 2);
INSERT INTO T1_SEC_COMBINED3(C1,C2) VALUES('CDE', 3);
INSERT INTO T1_SEC_COMBINED3(C1,C2) VALUES('中国', 4);
INSERT INTO T1_SEC_COMBINED3(C1,C2) VALUES('中国人', 3);
INSERT INTO T1_SEC_COMBINED3(C1,C2) VALUES('美国', 2);
INSERT INTO T1_SEC_COMBINED3(C1,C2) VALUES('美国人', 4);
INSERT INTO T1_SEC_COMBINED3(C1,C2) VALUES('一', 3);
INSERT INTO T1_SEC_COMBINED3(C1,C2) VALUES('二', 2);
INSERT INTO T1_SEC_COMBINED3(C1,C2) VALUES('三', 1);
INSERT INTO T1_SEC_COMBINED3(C1,C2) VALUES('一二三', 4);
INSERT INTO T1_SEC_COMBINED3(C1,C2) VALUES('一ab三', 2);
INSERT INTO T1_SEC_COMBINED3(C1,C2) VALUES('一a二b三c',1);
SELECT * FROM T1_SEC_COMBINED3 WHERE C1='A';
ID	C1	C2
1	A	1
3	A	3
4	A	1
2	A	2
5	A	2
6	A	3
7	A	1
8	A	2
9	A	3
14	A	3
18	A	2
19	A	1
17	A	4
16	A	1
10	A	4
11	A	3
15	A	2
12	A	2
13	A	4
SELECT * FROM T1_SEC_COMBINED3 WHERE C1='a' and C2=1;
ID	C1	C2
1	a	1
SELECT * FROM T1_SEC_COMBINED3 WHERE C1='AB';
ID	C1	C2
4	AB	1
2	AB	2
5	AB	2
6	AB	3
7	AB	1
8	AB	2
9	AB	3
14	AB	3
18	AB	2
19	AB	1
17	AB	4
16	AB	1
10	AB	4
11	AB	3
15	AB	2
12	AB	2
13	AB	4
SELECT * FROM T1_SEC_COMBINED3 WHERE C1='ab';
ID	C1	C2
4	ab	1
2	ab	2
5	ab	2
6	ab	3
7	ab	1
8	ab	2
9	ab	3
14	ab	3
18	ab	2
19	ab	1
17	ab	4
16	ab	1
10	ab	4
11	ab	3
15	ab	2
12	ab	2
13	ab	4
SELECT * FROM T1_SEC_COMBINED3 WHERE C1='ab' and C2=2;
ID	C1	C2
2	ab	2
5	ab	2
SELECT * FROM T1_SEC_COMBINED3 WHERE C1 in ('ABC', 'CDE', 'cde');
ID	C1	C2
1	CDE	1
3	CDE	3
4	CDE	1
2	CDE	2
5	CDE	2
6	CDE	3
7	CDE	1
8	CDE	2
9	CDE	3
14	CDE	3
18	CDE	2
19	CDE	1
17	CDE	4
16	CDE	1
10	CDE	4
11	CDE	3
15	CDE	2
12	CDE	2
13	CDE	4
SELECT * FROM T1_SEC_COMBINED3 WHERE C1>'ab' ORDER BY C1,C2;
ID	C1	C2
SELECT * FROM T1_SEC_COMBINED3 WHERE C1>'ab' and C2>1 ORDER BY C1,C2;
ID	C1	C2
SELECT * FROM T1_SEC_COMBINED3 WHERE C1>'a' and C2<4 ORDER BY C1,C2;
ID	C1	C2
SELECT * FROM T1_SEC_COMBINED3 WHERE C1>='a' ORDER BY C1,C2;
ID	C1	C2
1	a	1
3	a	3
4	a	1
2	a	2
5	a	2
6	a	3
7	a	1
8	a	2
9	a	3
14	a	3
18	a	2
19	a	1
17	a	4
16	a	1
10	a	4
11	a	3
15	a	2
12	a	2
13	a	4
SELECT * FROM T1_SEC_COMBINED3 WHERE C1>='ab' and C2>=1 ORDER BY C1,C2;
ID	C1	C2
1	ab	1
3	ab	3
4	ab	1
2	ab	2
5	ab	2
6	ab	3
7	ab	1
8	ab	2
9	ab	3
14	ab	3
18	ab	2
19	ab	1
17	ab	4
16	ab	1
10	ab	4
11	ab	3
15	ab	2
12	ab	2
13	ab	4
SELECT * FROM T1_SEC_COMBINED3 WHERE C1>='AB' and C2>=2 ORDER BY C1,C2;
ID	C1	C2
3	AB	3
2	AB	2
5	AB	2
6	AB	3
8	AB	2
9	AB	3
14	AB	3
18	AB	2
17	AB	4
10	AB	4
11	AB	3
15	AB	2
12	AB	2
13	AB	4
SELECT * FROM T1_SEC_COMBINED3 WHERE C1<'ab' and C2<4 ORDER BY C1,C2;
ID	C1	C2
SELECT * FROM T1_SEC_COMBINED3 WHERE C1<='AB' and C2>=2 ORDER BY C1,C2;
ID	C1	C2
3	AB	3
2	AB	2
5	AB	2
6	AB	3
8	AB	2
9	AB	3
14	AB	3
18	AB	2
17	AB	4
10	AB	4
11	AB	3
15	AB	2
12	AB	2
13	AB	4
SELECT * FROM T1_SEC_COMBINED3 WHERE C1>='一ab二' and C2<3 ORDER BY C1,C2;
ID	C1	C2
1	一ab二	1
4	一ab二	1
2	一ab二	2
5	一ab二	2
7	一ab二	1
8	一ab二	2
18	一ab二	2
19	一ab二	1
16	一ab二	1
15	一ab二	2
12	一ab二	2
SELECT * FROM T1_SEC_COMBINED3 WHERE C1='一ab三' ORDER BY C1,C2;
ID	C1	C2
18	一ab三	2
19	一ab三	1
17	一ab三	4
16	一ab三	1
10	一ab三	4
11	一ab三	3
15	一ab三	2
12	一ab三	2
13	一ab三	4
SELECT * FROM T1_SEC_COMBINED3 WHERE C1<='一' ORDER BY C1,C2;
ID	C1	C2
1	一	1
3	一	3
4	一	1
2	一	2
5	一	2
6	一	3
7	一	1
8	一	2
9	一	3
14	一	3
18	一	2
19	一	1
17	一	4
16	一	1
10	一	4
11	一	3
15	一	2
12	一	2
13	一	4
SELECT * FROM T1_SEC_COMBINED3 WHERE C1>='美a国' and C2<3 ORDER BY C1,C2;
ID	C1	C2
1	美a国	1
4	美a国	1
2	美a国	2
5	美a国	2
7	美a国	1
8	美a国	2
18	美a国	2
19	美a国	1
16	美a国	1
15	美a国	2
12	美a国	2
SELECT * FROM T1_SEC_COMBINED3 ORDER BY C1 ASC, C2 ASC;
ID	C1	C2
1	美a国	1
3	美a国	3
4	美a国	1
2	美a国	2
5	美a国	2
6	美a国	3
7	美a国	1
8	美a国	2
9	美a国	3
14	美a国	3
18	美a国	2
19	美a国	1
17	美a国	4
16	美a国	1
10	美a国	4
11	美a国	3
15	美a国	2
12	美a国	2
13	美a国	4
SELECT * FROM T1_SEC_COMBINED3 ORDER BY C1 DESC, C2 ASC;
ID	C1	C2
1	美a国	1
4	美a国	1
7	美a国	1
19	美a国	1
16	美a国	1
2	美a国	2
5	美a国	2
12	美a国	2
8	美a国	2
15	美a国	2
18	美a国	2
3	美a国	3
11	美a国	3
14	美a国	3
9	美a国	3
6	美a国	3
17	美a国	4
10	美a国	4
13	美a国	4
SELECT * FROM T1_SEC_COMBINED3 WHERE C1>'ab' ORDER BY C1,C2 DESC;
ID	C1	C2
SELECT * FROM T1_SEC_COMBINED3 WHERE C1>'ab' ORDER BY C1,C2 ASC;
ID	C1	C2
CREATE TABLE T1_SEC_COMBINED_CHAR(ID INT AUTO_INCREMENT, C1 CHAR(100), C2 CHAR(100), PRIMARY KEY(ID), KEY IDX_C2C1(C2,C1)) CHARACTER SET UTF8MB4,COLLATE UTF8MB4_0900_AI_CI;
INSERT INTO T1_SEC_COMBINED_CHAR(C1,C2) VALUES('A', 'a');
INSERT INTO T1_SEC_COMBINED_CHAR(C1,C2) VALUES('AB', '中国');
INSERT INTO T1_SEC_COMBINED_CHAR(C1,C2) VALUES('a', '125');
INSERT INTO T1_SEC_COMBINED_CHAR(C1,C2) VALUES('ab', '美国');
INSERT INTO T1_SEC_COMBINED_CHAR(C1,C2) VALUES('B', '123');
INSERT INTO T1_SEC_COMBINED_CHAR(C1,C2) VALUES('b', '124');
INSERT INTO T1_SEC_COMBINED_CHAR(C1,C2) VALUES('cde', 'abc');
INSERT INTO T1_SEC_COMBINED_CHAR(C1,C2) VALUES('CDE', '123');
INSERT INTO T1_SEC_COMBINED_CHAR(C1,C2) VALUES('CDE', '124');
INSERT INTO T1_SEC_COMBINED_CHAR(C1,C2) VALUES('中国', '一');
INSERT INTO T1_SEC_COMBINED_CHAR(C1,C2) VALUES('中国人', '二');
INSERT INTO T1_SEC_COMBINED_CHAR(C1,C2) VALUES('美国', '124');
INSERT INTO T1_SEC_COMBINED_CHAR(C1,C2) VALUES('美国人', '125');
INSERT INTO T1_SEC_COMBINED_CHAR(C1,C2) VALUES('一', '中a国');
INSERT INTO T1_SEC_COMBINED_CHAR(C1,C2) VALUES('二', '124');
INSERT INTO T1_SEC_COMBINED_CHAR(C1,C2) VALUES('三', '123');
INSERT INTO T1_SEC_COMBINED_CHAR(C1,C2) VALUES('一二三','中a国b美国');
INSERT INTO T1_SEC_COMBINED_CHAR(C1,C2) VALUES('一ab三','124');
INSERT INTO T1_SEC_COMBINED_CHAR(C1,C2) VALUES('一a二b三c','123');
SELECT * FROM T1_SEC_COMBINED_CHAR WHERE C1='A' ORDER BY ID;
ID	C1	C2
1	A	a
3	a	125
SELECT * FROM T1_SEC_COMBINED_CHAR WHERE C1='a' and C2='125';
ID	C1	C2
3	a	125
13	a	125
1	a	125
7	a	125
10	a	125
14	a	125
17	a	125
2	a	125
11	a	125
4	a	125
SELECT * FROM T1_SEC_COMBINED_CHAR WHERE C1='AB' ORDER BY ID;
ID	C1	C2
2	AB	中国
4	ab	美国
SELECT * FROM T1_SEC_COMBINED_CHAR WHERE C1='ab' ORDER BY ID;
ID	C1	C2
2	AB	中国
4	ab	美国
SELECT * FROM T1_SEC_COMBINED_CHAR WHERE C1='ab' and C2='美国';
ID	C1	C2
4	ab	美国
SELECT * FROM T1_SEC_COMBINED_CHAR WHERE C1 in ('ABC', 'CDE', 'cde') ORDER BY ID;
ID	C1	C2
7	cde	abc
8	CDE	123
9	CDE	124
SELECT * FROM T1_SEC_COMBINED_CHAR WHERE C1>'ab' ORDER BY C2,C1;
ID	C1	C2
SELECT * FROM T1_SEC_COMBINED_CHAR WHERE C1>'ab' and C2>'中国' ORDER BY C2,C1;
ID	C1	C2
SELECT * FROM T1_SEC_COMBINED_CHAR WHERE C1>'a' and C2<'124' ORDER BY C2,C1;
ID	C1	C2
SELECT * FROM T1_SEC_COMBINED_CHAR WHERE C1>='a' ORDER BY C2,C1;
ID	C1	C2
5	a	124
8	a	124
19	a	124
16	a	124
6	a	124
9	a	124
18	a	124
15	a	124
12	a	124
3	a	124
13	a	124
1	a	124
7	a	124
10	a	124
14	a	124
17	a	124
2	a	124
11	a	124
4	a	124
SELECT * FROM T1_SEC_COMBINED_CHAR WHERE C1>='ab' and C2>='124' ORDER BY C2,C1;
ID	C1	C2
5	ab	124
8	ab	124
19	ab	124
16	ab	124
6	ab	124
9	ab	124
18	ab	124
15	ab	124
12	ab	124
3	ab	124
13	ab	124
1	ab	124
7	ab	124
10	ab	124
14	ab	124
17	ab	124
2	ab	124
11	ab	124
4	ab	124
SELECT * FROM T1_SEC_COMBINED_CHAR WHERE C1>='AB' and C2>='124' ORDER BY C2,C1;
ID	C1	C2
5	AB	124
8	AB	124
19	AB	124
16	AB	124
6	AB	124
9	AB	124
18	AB	124
15	AB	124
12	AB	124
3	AB	124
13	AB	124
1	AB	124
7	AB	124
10	AB	124
14	AB	124
17	AB	124
2	AB	124
11	AB	124
4	AB	124
SELECT * FROM T1_SEC_COMBINED_CHAR WHERE C1<'ab' and C2<'美国' ORDER BY C2,C1;
ID	C1	C2
SELECT * FROM T1_SEC_COMBINED_CHAR WHERE C1<='AB' and C2>='124' ORDER BY C2,C1;
ID	C1	C2
SELECT * FROM T1_SEC_COMBINED_CHAR ORDER BY C1 ASC, C2 ASC;
ID	C1	C2
3	NULL	124
4	NULL	124
11	NULL	124
2	NULL	124
17	NULL	124
14	NULL	124
10	NULL	124
7	NULL	124
1	NULL	124
13	NULL	124
5	NULL	124
12	NULL	124
15	NULL	124
18	NULL	124
9	NULL	124
6	NULL	124
16	NULL	124
19	NULL	124
8	NULL	124
SELECT * FROM T1_SEC_COMBINED_CHAR ORDER BY C1 DESC, C2 ASC;
ID	C1	C2
3	NULL	124
4	NULL	124
11	NULL	124
2	NULL	124
17	NULL	124
14	NULL	124
10	NULL	124
7	NULL	124
1	NULL	124
13	NULL	124
5	NULL	124
12	NULL	124
15	NULL	124
18	NULL	124
9	NULL	124
6	NULL	124
16	NULL	124
19	NULL	124
8	NULL	124
SELECT * FROM T1_SEC_COMBINED_CHAR WHERE C1>'ab' ORDER BY C1,C2 DESC;
ID	C1	C2
SELECT * FROM T1_SEC_COMBINED_CHAR WHERE C1>'ab' ORDER BY C1,C2 ASC;
ID	C1	C2
DROP TABLE T1_COLUMN;
DROP TABLE T1_TEXT;
DROP TABLE T1_PK;
DROP TABLE T1_PK_CHAR;
DROP TABLE T1_SEC;
DROP TABLE T1_SEC_CHAR;
DROP TABLE T1_UNIQUE;
DROP TABLE T1_UNIQUE_CHAR;
DROP TABLE T1_SEC_COMBINED;
DROP TABLE T1_SEC_COMBINED2;
DROP TABLE T1_SEC_COMBINED3;
DROP TABLE T1_SEC_COMBINED_CHAR;
