set names utf8;
Warnings:
Warning	3719	'utf8' is currently an alias for the character set UTF8MB3, but will be an alias for UTF8MB4 in a future release. Please consider using UTF8MB4 in order to be unambiguous.
CREATE TABLE T1_COLUMN(C1 VARCHAR(100), C2 VARCHAR(100)) CHARACTER SET UTF8,COLLATE UTF8_GENERAL_CI;
Warnings:
Warning	3719	'utf8' is currently an alias for the character set UTF8MB3, but will be an alias for UTF8MB4 in a future release. Please consider using UTF8MB4 in order to be unambiguous.
Warning	3778	'utf8_general_ci' is a collation of the deprecated character set UTF8MB3. Please consider using UTF8MB4 with an appropriate collation instead.
INSERT INTO T1_COLUMN VALUES('A', '123');
INSERT INTO T1_COLUMN VALUES('AB', '123');
INSERT INTO T1_COLUMN VALUES('a', '123');
INSERT INTO T1_COLUMN VALUES('ab', '123');
INSERT INTO T1_COLUMN VALUES('B', '123');
INSERT INTO T1_COLUMN VALUES('b', '123');
INSERT INTO T1_COLUMN VALUES('cde', '123');
INSERT INTO T1_COLUMN VALUES('CDE', '123');
INSERT INTO T1_COLUMN VALUES('CDE', '123');
INSERT INTO T1_COLUMN VALUES('中国', '123');
INSERT INTO T1_COLUMN VALUES('中国人', '123');
INSERT INTO T1_COLUMN VALUES('美国', '123');
INSERT INTO T1_COLUMN VALUES('美国人', '123');
INSERT INTO T1_COLUMN VALUES('一', '123');
INSERT INTO T1_COLUMN VALUES('二', '123');
INSERT INTO T1_COLUMN VALUES('三', '123');
INSERT INTO T1_COLUMN VALUES('一二三','123');
INSERT INTO T1_COLUMN VALUES('一ab三','123');
INSERT INTO T1_COLUMN VALUES('一a二b三c','123');
SELECT * FROM T1_COLUMN WHERE C1='A';
C1	C2
A	123
a	123
SELECT * FROM T1_COLUMN WHERE C1='a';
C1	C2
A	123
a	123
SELECT * FROM T1_COLUMN WHERE C1='AB';
C1	C2
AB	123
ab	123
SELECT * FROM T1_COLUMN WHERE C1='ab';
C1	C2
AB	123
ab	123
SELECT * FROM T1_COLUMN WHERE C1='abc';
C1	C2
SELECT * FROM T1_COLUMN WHERE C1 in ('abc', 'AB');
C1	C2
AB	123
ab	123
SELECT * FROM T1_COLUMN WHERE C1 in ('ABC', 'CDE', 'cde');
C1	C2
cde	123
CDE	123
CDE	123
SELECT * FROM T1_COLUMN WHERE C1>'ab';
C1	C2
B	123
b	123
cde	123
CDE	123
CDE	123
中国	123
中国人	123
美国	123
美国人	123
一	123
二	123
三	123
一二三	123
一ab三	123
一a二b三c	123
SELECT * FROM T1_COLUMN WHERE C1>'AB';
C1	C2
B	123
b	123
cde	123
CDE	123
CDE	123
中国	123
中国人	123
美国	123
美国人	123
一	123
二	123
三	123
一二三	123
一ab三	123
一a二b三c	123
SELECT COUNT(*) FROM T1_COLUMN WHERE C1>'ab';
COUNT(*)
15
SELECT COUNT(*) FROM T1_COLUMN WHERE C1>'AB';
COUNT(*)
15
SELECT * FROM T1_COLUMN WHERE C1>'a';
C1	C2
AB	123
ab	123
B	123
b	123
cde	123
CDE	123
CDE	123
中国	123
中国人	123
美国	123
美国人	123
一	123
二	123
三	123
一二三	123
一ab三	123
一a二b三c	123
SELECT * FROM T1_COLUMN WHERE C1>='a';
C1	C2
A	123
AB	123
a	123
ab	123
B	123
b	123
cde	123
CDE	123
CDE	123
中国	123
中国人	123
美国	123
美国人	123
一	123
二	123
三	123
一二三	123
一ab三	123
一a二b三c	123
SELECT * FROM T1_COLUMN WHERE C1>='ab';
C1	C2
AB	123
ab	123
B	123
b	123
cde	123
CDE	123
CDE	123
中国	123
中国人	123
美国	123
美国人	123
一	123
二	123
三	123
一二三	123
一ab三	123
一a二b三c	123
SELECT * FROM T1_COLUMN WHERE C1>='AB';
C1	C2
AB	123
ab	123
B	123
b	123
cde	123
CDE	123
CDE	123
中国	123
中国人	123
美国	123
美国人	123
一	123
二	123
三	123
一二三	123
一ab三	123
一a二b三c	123
SELECT * FROM T1_COLUMN WHERE C1<'ab';
C1	C2
A	123
a	123
SELECT * FROM T1_COLUMN WHERE C1<='AB';
C1	C2
A	123
AB	123
a	123
ab	123
SELECT * FROM T1_COLUMN ORDER BY C1 ASC;
C1	C2
a	123
A	123
AB	123
ab	123
B	123
b	123
cde	123
CDE	123
CDE	123
一	123
一ab三	123
一a二b三c	123
一二三	123
三	123
中国	123
中国人	123
二	123
美国	123
美国人	123
SELECT * FROM T1_COLUMN ORDER BY C1 DESC;
C1	C2
美国人	123
美国	123
二	123
中国人	123
中国	123
三	123
一二三	123
一a二b三c	123
一ab三	123
一	123
CDE	123
CDE	123
cde	123
b	123
B	123
ab	123
AB	123
a	123
A	123
SELECT * FROM T1_COLUMN WHERE C1>'ab' ORDER BY C1 DESC;
C1	C2
美国人	123
美国	123
二	123
中国人	123
中国	123
三	123
一二三	123
一a二b三c	123
一ab三	123
一	123
cde	123
CDE	123
CDE	123
B	123
b	123
SELECT * FROM T1_COLUMN WHERE C1>'ab' ORDER BY C1 ASC;
C1	C2
B	123
b	123
cde	123
CDE	123
CDE	123
一	123
一ab三	123
一a二b三c	123
一二三	123
三	123
中国	123
中国人	123
二	123
美国	123
美国人	123
SELECT * FROM T1_COLUMN WHERE C1 LIKE 'ab%';
C1	C2
AB	123
ab	123
SELECT * FROM T1_COLUMN WHERE C1 LIKE 'AB%';
C1	C2
AB	123
ab	123
SELECT * FROM T1_COLUMN WHERE C1 LIKE '%c%';
C1	C2
cde	123
CDE	123
CDE	123
一a二b三c	123
SELECT * FROM T1_COLUMN WHERE C1 LIKE '%CD%';
C1	C2
cde	123
CDE	123
CDE	123
SELECT COUNT(*) FROM T1_COLUMN;
COUNT(*)
19
SELECT * FROM T1_COLUMN WHERE C1>'一';
C1	C2
中国	123
中国人	123
美国	123
美国人	123
二	123
三	123
一二三	123
一ab三	123
一a二b三c	123
SELECT * FROM T1_COLUMN WHERE C1='一';
C1	C2
一	123
SELECT * FROM T1_COLUMN WHERE C1<'一';
C1	C2
A	123
AB	123
a	123
ab	123
B	123
b	123
cde	123
CDE	123
CDE	123
SELECT * FROM T1_COLUMN WHERE C1>'一';
C1	C2
中国	123
中国人	123
美国	123
美国人	123
二	123
三	123
一二三	123
一ab三	123
一a二b三c	123
SELECT * FROM T1_COLUMN WHERE C1='中国';
C1	C2
中国	123
SELECT * FROM T1_COLUMN WHERE C1='中1';
C1	C2
SELECT * FROM T1_COLUMN WHERE C1<='中1国';
C1	C2
A	123
AB	123
a	123
ab	123
B	123
b	123
cde	123
CDE	123
CDE	123
一	123
三	123
一二三	123
一ab三	123
一a二b三c	123
SELECT * FROM T1_COLUMN WHERE C1>='美国';
C1	C2
美国	123
美国人	123
SELECT * FROM T1_COLUMN WHERE C1 in ('一', '二', '美国', 'AB');
C1	C2
AB	123
ab	123
美国	123
一	123
二	123
SELECT * FROM T1_COLUMN WHERE C1 LIKE '一%';
C1	C2
一	123
一二三	123
一ab三	123
一a二b三c	123
SELECT * FROM T1_COLUMN WHERE C1 LIKE '%一%';
C1	C2
一	123
一二三	123
一ab三	123
一a二b三c	123
SELECT * FROM T1_COLUMN WHERE C1 LIKE '%一';
C1	C2
一	123
UPDATE T1_COLUMN SET C2='KFC' WHERE C1>='中国';
SELECT * FROM T1_COLUMN;
C1	C2
A	123
AB	123
a	123
ab	123
B	123
b	123
cde	123
CDE	123
CDE	123
中国	KFC
中国人	KFC
美国	KFC
美国人	KFC
一	123
二	KFC
三	123
一二三	123
一ab三	123
一a二b三c	123
UPDATE T1_COLUMN SET C2='KFC' WHERE C1>='AB';
SELECT * FROM T1_COLUMN;
C1	C2
A	123
AB	KFC
a	123
ab	KFC
B	KFC
b	KFC
cde	KFC
CDE	KFC
CDE	KFC
中国	KFC
中国人	KFC
美国	KFC
美国人	KFC
一	KFC
二	KFC
三	KFC
一二三	KFC
一ab三	KFC
一a二b三c	KFC
DELETE FROM T1_COLUMN WHERE C1>='中国';
SELECT * FROM T1_COLUMN;
C1	C2
A	123
AB	KFC
a	123
ab	KFC
B	KFC
b	KFC
cde	KFC
CDE	KFC
CDE	KFC
一	KFC
三	KFC
一二三	KFC
一ab三	KFC
一a二b三c	KFC
DELETE FROM T1_COLUMN WHERE C1>='ab';
SELECT * FROM T1_COLUMN;
C1	C2
A	123
a	123
CREATE TABLE T1_TEXT(C1 TEXT, C2 VARCHAR(100)) CHARACTER SET UTF8,COLLATE UTF8_GENERAL_CI;
Warnings:
Warning	3719	'utf8' is currently an alias for the character set UTF8MB3, but will be an alias for UTF8MB4 in a future release. Please consider using UTF8MB4 in order to be unambiguous.
Warning	3778	'utf8_general_ci' is a collation of the deprecated character set UTF8MB3. Please consider using UTF8MB4 with an appropriate collation instead.
INSERT INTO T1_TEXT VALUES('A', '123');
INSERT INTO T1_TEXT VALUES('AB', '123');
INSERT INTO T1_TEXT VALUES('a', '123');
INSERT INTO T1_TEXT VALUES('ab', '123');
INSERT INTO T1_TEXT VALUES('B', '123');
INSERT INTO T1_TEXT VALUES('b', '123');
INSERT INTO T1_TEXT VALUES('cde', '123');
INSERT INTO T1_TEXT VALUES('CDE', '123');
INSERT INTO T1_TEXT VALUES('CDE', '123');
INSERT INTO T1_TEXT VALUES('中国', '123');
INSERT INTO T1_TEXT VALUES('中国人', '123');
INSERT INTO T1_TEXT VALUES('美国', '123');
INSERT INTO T1_TEXT VALUES('美国人', '123');
INSERT INTO T1_TEXT VALUES('一', '123');
INSERT INTO T1_TEXT VALUES('二', '123');
INSERT INTO T1_TEXT VALUES('三', '123');
INSERT INTO T1_TEXT VALUES('一二三','123');
INSERT INTO T1_TEXT VALUES('一ab三','123');
INSERT INTO T1_TEXT VALUES('一a二b三c','123');
SELECT * FROM T1_TEXT WHERE C1='A';
C1	C2
A	123
a	123
SELECT * FROM T1_TEXT WHERE C1='a';
C1	C2
A	123
a	123
SELECT * FROM T1_TEXT WHERE C1='AB';
C1	C2
AB	123
ab	123
SELECT * FROM T1_TEXT WHERE C1='ab';
C1	C2
AB	123
ab	123
SELECT * FROM T1_TEXT WHERE C1='abc';
C1	C2
SELECT * FROM T1_TEXT WHERE C1 in ('abc', 'AB');
C1	C2
AB	123
ab	123
SELECT * FROM T1_TEXT WHERE C1 in ('ABC', 'CDE', 'cde');
C1	C2
cde	123
CDE	123
CDE	123
SELECT * FROM T1_TEXT WHERE C1>'ab';
C1	C2
B	123
b	123
cde	123
CDE	123
CDE	123
中国	123
中国人	123
美国	123
美国人	123
一	123
二	123
三	123
一二三	123
一ab三	123
一a二b三c	123
SELECT * FROM T1_TEXT WHERE C1>'AB';
C1	C2
B	123
b	123
cde	123
CDE	123
CDE	123
中国	123
中国人	123
美国	123
美国人	123
一	123
二	123
三	123
一二三	123
一ab三	123
一a二b三c	123
SELECT COUNT(*) FROM T1_TEXT WHERE C1>'ab';
COUNT(*)
15
SELECT COUNT(*) FROM T1_TEXT WHERE C1>'AB';
COUNT(*)
15
SELECT * FROM T1_TEXT WHERE C1>'a';
C1	C2
AB	123
ab	123
B	123
b	123
cde	123
CDE	123
CDE	123
中国	123
中国人	123
美国	123
美国人	123
一	123
二	123
三	123
一二三	123
一ab三	123
一a二b三c	123
SELECT * FROM T1_TEXT WHERE C1>='a';
C1	C2
A	123
AB	123
a	123
ab	123
B	123
b	123
cde	123
CDE	123
CDE	123
中国	123
中国人	123
美国	123
美国人	123
一	123
二	123
三	123
一二三	123
一ab三	123
一a二b三c	123
SELECT * FROM T1_TEXT WHERE C1>='ab';
C1	C2
AB	123
ab	123
B	123
b	123
cde	123
CDE	123
CDE	123
中国	123
中国人	123
美国	123
美国人	123
一	123
二	123
三	123
一二三	123
一ab三	123
一a二b三c	123
SELECT * FROM T1_TEXT WHERE C1>='AB';
C1	C2
AB	123
ab	123
B	123
b	123
cde	123
CDE	123
CDE	123
中国	123
中国人	123
美国	123
美国人	123
一	123
二	123
三	123
一二三	123
一ab三	123
一a二b三c	123
SELECT * FROM T1_TEXT WHERE C1<'ab';
C1	C2
A	123
a	123
SELECT * FROM T1_TEXT WHERE C1<='AB';
C1	C2
A	123
AB	123
a	123
ab	123
SELECT * FROM T1_TEXT ORDER BY C1 ASC;
C1	C2
A	123
a	123
AB	123
ab	123
B	123
b	123
cde	123
CDE	123
CDE	123
一	123
一ab三	123
一a二b三c	123
一二三	123
三	123
中国	123
中国人	123
二	123
美国	123
美国人	123
SELECT * FROM T1_TEXT ORDER BY C1 DESC;
C1	C2
美国人	123
美国	123
二	123
中国人	123
中国	123
三	123
一二三	123
一a二b三c	123
一ab三	123
一	123
cde	123
CDE	123
CDE	123
B	123
b	123
AB	123
ab	123
A	123
a	123
SELECT * FROM T1_TEXT WHERE C1>'ab' ORDER BY C1 DESC;
C1	C2
美国人	123
美国	123
二	123
中国人	123
中国	123
三	123
一二三	123
一a二b三c	123
一ab三	123
一	123
cde	123
CDE	123
CDE	123
B	123
b	123
SELECT * FROM T1_TEXT WHERE C1>'ab' ORDER BY C1 ASC;
C1	C2
B	123
b	123
cde	123
CDE	123
CDE	123
一	123
一ab三	123
一a二b三c	123
一二三	123
三	123
中国	123
中国人	123
二	123
美国	123
美国人	123
SELECT * FROM T1_TEXT WHERE C1 LIKE 'ab%';
C1	C2
AB	123
ab	123
SELECT * FROM T1_TEXT WHERE C1 LIKE 'AB%';
C1	C2
AB	123
ab	123
SELECT * FROM T1_TEXT WHERE C1 LIKE '%c%';
C1	C2
cde	123
CDE	123
CDE	123
一a二b三c	123
SELECT * FROM T1_TEXT WHERE C1 LIKE '%CD%';
C1	C2
cde	123
CDE	123
CDE	123
SELECT COUNT(*) FROM T1_TEXT;
COUNT(*)
19
SELECT * FROM T1_TEXT WHERE C1>'一';
C1	C2
中国	123
中国人	123
美国	123
美国人	123
二	123
三	123
一二三	123
一ab三	123
一a二b三c	123
SELECT * FROM T1_TEXT WHERE C1='一';
C1	C2
一	123
SELECT * FROM T1_TEXT WHERE C1<'一';
C1	C2
A	123
AB	123
a	123
ab	123
B	123
b	123
cde	123
CDE	123
CDE	123
SELECT * FROM T1_TEXT WHERE C1>'一';
C1	C2
中国	123
中国人	123
美国	123
美国人	123
二	123
三	123
一二三	123
一ab三	123
一a二b三c	123
SELECT * FROM T1_TEXT WHERE C1='中国';
C1	C2
中国	123
SELECT * FROM T1_TEXT WHERE C1='中1';
C1	C2
SELECT * FROM T1_TEXT WHERE C1<='中1国';
C1	C2
A	123
AB	123
a	123
ab	123
B	123
b	123
cde	123
CDE	123
CDE	123
一	123
三	123
一二三	123
一ab三	123
一a二b三c	123
SELECT * FROM T1_TEXT WHERE C1>='美国';
C1	C2
美国	123
美国人	123
SELECT * FROM T1_TEXT WHERE C1 in ('一', '二', '美国', 'AB');
C1	C2
AB	123
ab	123
美国	123
一	123
二	123
SELECT * FROM T1_TEXT WHERE C1 LIKE '一%';
C1	C2
一	123
一二三	123
一ab三	123
一a二b三c	123
SELECT * FROM T1_TEXT WHERE C1 LIKE '%一%';
C1	C2
一	123
一二三	123
一ab三	123
一a二b三c	123
SELECT * FROM T1_TEXT WHERE C1 LIKE '%一';
C1	C2
一	123
UPDATE T1_TEXT SET C2='KFC' WHERE C1>='中国';
SELECT * FROM T1_TEXT;
C1	C2
A	123
AB	123
a	123
ab	123
B	123
b	123
cde	123
CDE	123
CDE	123
中国	KFC
中国人	KFC
美国	KFC
美国人	KFC
一	123
二	KFC
三	123
一二三	123
一ab三	123
一a二b三c	123
UPDATE T1_TEXT SET C2='KFC' WHERE C1>='AB';
SELECT * FROM T1_TEXT;
C1	C2
A	123
AB	KFC
a	123
ab	KFC
B	KFC
b	KFC
cde	KFC
CDE	KFC
CDE	KFC
中国	KFC
中国人	KFC
美国	KFC
美国人	KFC
一	KFC
二	KFC
三	KFC
一二三	KFC
一ab三	KFC
一a二b三c	KFC
DELETE FROM T1_TEXT WHERE C1>='中国';
SELECT * FROM T1_TEXT;
C1	C2
A	123
AB	KFC
a	123
ab	KFC
B	KFC
b	KFC
cde	KFC
CDE	KFC
CDE	KFC
一	KFC
三	KFC
一二三	KFC
一ab三	KFC
一a二b三c	KFC
DELETE FROM T1_TEXT WHERE C1>='ab';
SELECT * FROM T1_TEXT;
C1	C2
A	123
a	123
CREATE TABLE T1_PK(C1 VARCHAR(100), C2 VARCHAR(100), PRIMARY KEY(C1)) CHARACTER SET UTF8,COLLATE UTF8_GENERAL_CI;
Warnings:
Warning	3719	'utf8' is currently an alias for the character set UTF8MB3, but will be an alias for UTF8MB4 in a future release. Please consider using UTF8MB4 in order to be unambiguous.
Warning	3778	'utf8_general_ci' is a collation of the deprecated character set UTF8MB3. Please consider using UTF8MB4 with an appropriate collation instead.
INSERT INTO T1_PK VALUES('A', '123');
INSERT INTO T1_PK VALUES('AB', '123');
INSERT INTO T1_PK VALUES('a', '123');
ERROR 23000: Duplicate entry 'a' for key 'PRIMARY'
INSERT INTO T1_PK VALUES('ab', '123');
ERROR 23000: Duplicate entry 'ab' for key 'PRIMARY'
INSERT INTO T1_PK VALUES('b', '123');
INSERT INTO T1_PK VALUES('B', '123');
ERROR 23000: Duplicate entry 'B' for key 'PRIMARY'
INSERT INTO T1_PK VALUES('cde', '123');
INSERT INTO T1_PK VALUES('CDE', '123');
ERROR 23000: Duplicate entry 'CDE' for key 'PRIMARY'
INSERT INTO T1_PK VALUES('CDE', '123');
ERROR 23000: Duplicate entry 'CDE' for key 'PRIMARY'
INSERT INTO T1_PK VALUES('中国', '123');
INSERT INTO T1_PK VALUES('中国人', '123');
INSERT INTO T1_PK VALUES('美国', '123');
INSERT INTO T1_PK VALUES('美国人', '123');
INSERT INTO T1_PK VALUES('一', '123');
INSERT INTO T1_PK VALUES('二', '123');
INSERT INTO T1_PK VALUES('三', '123');
INSERT INTO T1_PK VALUES('一二三','123');
INSERT INTO T1_PK VALUES('一ab三','123');
INSERT INTO T1_PK VALUES('一a二b三c','123');
SELECT * FROM T1_PK WHERE C1='A';
C1	C2
A	123
SELECT * FROM T1_PK WHERE C1='a';
C1	C2
A	123
SELECT * FROM T1_PK WHERE C1='AB';
C1	C2
AB	123
SELECT * FROM T1_PK WHERE C1='ab';
C1	C2
AB	123
SELECT * FROM T1_PK WHERE C1='abc';
C1	C2
SELECT * FROM T1_PK WHERE C1 in ('abc', 'AB');
C1	C2
AB	123
SELECT * FROM T1_PK WHERE C1 in ('ABC', 'CDE', 'cde');
C1	C2
cde	123
SELECT * FROM T1_PK WHERE C1>'ab';
C1	C2
b	123
cde	123
一	123
一ab三	123
一a二b三c	123
一二三	123
三	123
中国	123
中国人	123
二	123
美国	123
美国人	123
SELECT * FROM T1_PK WHERE C1>'AB';
C1	C2
b	123
cde	123
一	123
一ab三	123
一a二b三c	123
一二三	123
三	123
中国	123
中国人	123
二	123
美国	123
美国人	123
SELECT * FROM T1_PK WHERE C1>'a';
C1	C2
AB	123
b	123
cde	123
一	123
一ab三	123
一a二b三c	123
一二三	123
三	123
中国	123
中国人	123
二	123
美国	123
美国人	123
SELECT * FROM T1_PK WHERE C1>='a';
C1	C2
A	123
AB	123
b	123
cde	123
一	123
一ab三	123
一a二b三c	123
一二三	123
三	123
中国	123
中国人	123
二	123
美国	123
美国人	123
SELECT * FROM T1_PK WHERE C1>='ab';
C1	C2
AB	123
b	123
cde	123
一	123
一ab三	123
一a二b三c	123
一二三	123
三	123
中国	123
中国人	123
二	123
美国	123
美国人	123
SELECT * FROM T1_PK WHERE C1>='AB';
C1	C2
AB	123
b	123
cde	123
一	123
一ab三	123
一a二b三c	123
一二三	123
三	123
中国	123
中国人	123
二	123
美国	123
美国人	123
SELECT * FROM T1_PK WHERE C1<'ab';
C1	C2
A	123
SELECT * FROM T1_PK WHERE C1<='AB';
C1	C2
A	123
AB	123
SELECT * FROM T1_PK ORDER BY C1 ASC;
C1	C2
A	123
AB	123
b	123
cde	123
一	123
一ab三	123
一a二b三c	123
一二三	123
三	123
中国	123
中国人	123
二	123
美国	123
美国人	123
SELECT * FROM T1_PK ORDER BY C1 DESC;
C1	C2
美国人	123
美国	123
二	123
中国人	123
中国	123
三	123
一二三	123
一a二b三c	123
一ab三	123
一	123
cde	123
b	123
AB	123
A	123
SELECT * FROM T1_PK WHERE C1>'ab' ORDER BY C1 DESC;
C1	C2
美国人	123
美国	123
二	123
中国人	123
中国	123
三	123
一二三	123
一a二b三c	123
一ab三	123
一	123
cde	123
b	123
SELECT * FROM T1_PK WHERE C1>'ab' ORDER BY C1 ASC;
C1	C2
b	123
cde	123
一	123
一ab三	123
一a二b三c	123
一二三	123
三	123
中国	123
中国人	123
二	123
美国	123
美国人	123
SELECT * FROM T1_PK WHERE C1 LIKE 'ab%';
C1	C2
AB	123
SELECT * FROM T1_PK WHERE C1 LIKE 'AB%';
C1	C2
AB	123
SELECT * FROM T1_PK WHERE C1 LIKE '%c%';
C1	C2
cde	123
一a二b三c	123
SELECT * FROM T1_PK WHERE C1 LIKE '%CD%';
C1	C2
cde	123
SELECT * FROM T1_PK WHERE C1>'一';
C1	C2
一ab三	123
一a二b三c	123
一二三	123
三	123
中国	123
中国人	123
二	123
美国	123
美国人	123
SELECT * FROM T1_PK WHERE C1='一';
C1	C2
一	123
SELECT * FROM T1_PK WHERE C1<'一';
C1	C2
A	123
AB	123
b	123
cde	123
SELECT * FROM T1_PK WHERE C1>'一';
C1	C2
一ab三	123
一a二b三c	123
一二三	123
三	123
中国	123
中国人	123
二	123
美国	123
美国人	123
SELECT * FROM T1_PK WHERE C1='中国';
C1	C2
中国	123
SELECT * FROM T1_PK WHERE C1='中1';
C1	C2
SELECT * FROM T1_PK WHERE C1<='中1国';
C1	C2
A	123
AB	123
b	123
cde	123
一	123
一ab三	123
一a二b三c	123
一二三	123
三	123
SELECT * FROM T1_PK WHERE C1>='美国';
C1	C2
美国	123
美国人	123
SELECT * FROM T1_PK WHERE C1 in ('一', '二', '美国', 'AB');
C1	C2
AB	123
一	123
二	123
美国	123
SELECT * FROM T1_PK WHERE C1 LIKE '一%';
C1	C2
一	123
一ab三	123
一a二b三c	123
一二三	123
SELECT * FROM T1_PK WHERE C1 LIKE '%一%';
C1	C2
一	123
一ab三	123
一a二b三c	123
一二三	123
SELECT * FROM T1_PK WHERE C1 LIKE '%一';
C1	C2
一	123
UPDATE T1_PK SET C2='KFC' WHERE C1>='中国';
SELECT * FROM T1_PK;
C1	C2
A	123
AB	123
b	123
cde	123
一	123
一ab三	123
一a二b三c	123
一二三	123
三	123
中国	KFC
中国人	KFC
二	KFC
美国	KFC
美国人	KFC
UPDATE T1_PK SET C2='KFC' WHERE C1>='AB';
SELECT * FROM T1_PK;
C1	C2
A	123
AB	KFC
b	KFC
cde	KFC
一	KFC
一ab三	KFC
一a二b三c	KFC
一二三	KFC
三	KFC
中国	KFC
中国人	KFC
二	KFC
美国	KFC
美国人	KFC
DELETE FROM T1_PK WHERE C1>='中国';
SELECT * FROM T1_PK;
C1	C2
A	123
AB	KFC
b	KFC
cde	KFC
一	KFC
一ab三	KFC
一a二b三c	KFC
一二三	KFC
三	KFC
DELETE FROM T1_PK WHERE C1>='ab';
SELECT * FROM T1_PK;
C1	C2
A	123
CREATE TABLE T1_PK_CHAR(C1 CHAR(100), C2 CHAR(100), PRIMARY KEY(C1)) CHARACTER SET UTF8,COLLATE UTF8_GENERAL_CI;
Warnings:
Warning	3719	'utf8' is currently an alias for the character set UTF8MB3, but will be an alias for UTF8MB4 in a future release. Please consider using UTF8MB4 in order to be unambiguous.
Warning	3778	'utf8_general_ci' is a collation of the deprecated character set UTF8MB3. Please consider using UTF8MB4 with an appropriate collation instead.
INSERT INTO T1_PK_CHAR VALUES('A', '123');
INSERT INTO T1_PK_CHAR VALUES('AB', '123');
INSERT INTO T1_PK_CHAR VALUES('a', '123');
ERROR 23000: Duplicate entry 'a' for key 'PRIMARY'
INSERT INTO T1_PK_CHAR VALUES('ab', '123');
ERROR 23000: Duplicate entry 'ab' for key 'PRIMARY'
INSERT INTO T1_PK_CHAR VALUES('b', '123');
INSERT INTO T1_PK_CHAR VALUES('B', '123');
ERROR 23000: Duplicate entry 'B' for key 'PRIMARY'
INSERT INTO T1_PK_CHAR VALUES('cde', '123');
INSERT INTO T1_PK_CHAR VALUES('CDE', '123');
ERROR 23000: Duplicate entry 'CDE' for key 'PRIMARY'
INSERT INTO T1_PK_CHAR VALUES('CDE', '123');
ERROR 23000: Duplicate entry 'CDE' for key 'PRIMARY'
INSERT INTO T1_PK_CHAR VALUES('中国', '123');
INSERT INTO T1_PK_CHAR VALUES('中国人', '123');
INSERT INTO T1_PK_CHAR VALUES('美国', '123');
INSERT INTO T1_PK_CHAR VALUES('美国人', '123');
INSERT INTO T1_PK_CHAR VALUES('一', '123');
INSERT INTO T1_PK_CHAR VALUES('二', '123');
INSERT INTO T1_PK_CHAR VALUES('三', '123');
INSERT INTO T1_PK_CHAR VALUES('一二三','123');
INSERT INTO T1_PK_CHAR VALUES('一ab三','123');
INSERT INTO T1_PK_CHAR VALUES('一a二b三c','123');
SELECT * FROM T1_PK_CHAR WHERE C1='A';
C1	C2
A	123
SELECT * FROM T1_PK_CHAR WHERE C1='a';
C1	C2
A	123
SELECT * FROM T1_PK_CHAR WHERE C1='AB';
C1	C2
AB	123
SELECT * FROM T1_PK_CHAR WHERE C1='ab';
C1	C2
AB	123
SELECT * FROM T1_PK_CHAR WHERE C1='abc';
C1	C2
SELECT * FROM T1_PK_CHAR WHERE C1 in ('abc', 'AB');
C1	C2
AB	123
SELECT * FROM T1_PK_CHAR WHERE C1 in ('ABC', 'CDE', 'cde');
C1	C2
cde	123
SELECT * FROM T1_PK_CHAR WHERE C1>'ab';
C1	C2
b	123
cde	123
一	123
一ab三	123
一a二b三c	123
一二三	123
三	123
中国	123
中国人	123
二	123
美国	123
美国人	123
SELECT * FROM T1_PK_CHAR WHERE C1>'AB';
C1	C2
b	123
cde	123
一	123
一ab三	123
一a二b三c	123
一二三	123
三	123
中国	123
中国人	123
二	123
美国	123
美国人	123
SELECT * FROM T1_PK_CHAR WHERE C1>'a';
C1	C2
AB	123
b	123
cde	123
一	123
一ab三	123
一a二b三c	123
一二三	123
三	123
中国	123
中国人	123
二	123
美国	123
美国人	123
SELECT * FROM T1_PK_CHAR WHERE C1>='a';
C1	C2
A	123
AB	123
b	123
cde	123
一	123
一ab三	123
一a二b三c	123
一二三	123
三	123
中国	123
中国人	123
二	123
美国	123
美国人	123
SELECT * FROM T1_PK_CHAR WHERE C1>='ab';
C1	C2
AB	123
b	123
cde	123
一	123
一ab三	123
一a二b三c	123
一二三	123
三	123
中国	123
中国人	123
二	123
美国	123
美国人	123
SELECT * FROM T1_PK_CHAR WHERE C1>='AB';
C1	C2
AB	123
b	123
cde	123
一	123
一ab三	123
一a二b三c	123
一二三	123
三	123
中国	123
中国人	123
二	123
美国	123
美国人	123
SELECT * FROM T1_PK_CHAR WHERE C1<'ab';
C1	C2
A	123
SELECT * FROM T1_PK_CHAR WHERE C1<='AB';
C1	C2
A	123
AB	123
SELECT * FROM T1_PK_CHAR ORDER BY C1 ASC;
C1	C2
A	123
AB	123
b	123
cde	123
一	123
一ab三	123
一a二b三c	123
一二三	123
三	123
中国	123
中国人	123
二	123
美国	123
美国人	123
SELECT * FROM T1_PK_CHAR ORDER BY C1 DESC;
C1	C2
美国人	123
美国	123
二	123
中国人	123
中国	123
三	123
一二三	123
一a二b三c	123
一ab三	123
一	123
cde	123
b	123
AB	123
A	123
SELECT * FROM T1_PK_CHAR WHERE C1>'ab' ORDER BY C1 DESC;
C1	C2
美国人	123
美国	123
二	123
中国人	123
中国	123
三	123
一二三	123
一a二b三c	123
一ab三	123
一	123
cde	123
b	123
SELECT * FROM T1_PK_CHAR WHERE C1>'ab' ORDER BY C1 ASC;
C1	C2
b	123
cde	123
一	123
一ab三	123
一a二b三c	123
一二三	123
三	123
中国	123
中国人	123
二	123
美国	123
美国人	123
SELECT * FROM T1_PK_CHAR WHERE C1 LIKE 'a%';
C1	C2
A	123
AB	123
SELECT * FROM T1_PK_CHAR WHERE C1 LIKE 'ab%';
C1	C2
AB	123
SELECT * FROM T1_PK_CHAR WHERE C1 LIKE 'AB%';
C1	C2
AB	123
SELECT * FROM T1_PK_CHAR WHERE C1 LIKE '%c%';
C1	C2
cde	123
一a二b三c	123
SELECT * FROM T1_PK_CHAR WHERE C1 LIKE '%CD%';
C1	C2
cde	123
SELECT * FROM T1_PK_CHAR WHERE C1>='一';
C1	C2
一	123
一ab三	123
一a二b三c	123
一二三	123
三	123
中国	123
中国人	123
二	123
美国	123
美国人	123
SELECT * FROM T1_PK_CHAR WHERE C1='一';
C1	C2
一	123
SELECT * FROM T1_PK_CHAR WHERE C1<'一';
C1	C2
A	123
AB	123
b	123
cde	123
SELECT * FROM T1_PK_CHAR WHERE C1>'一';
C1	C2
一ab三	123
一a二b三c	123
一二三	123
三	123
中国	123
中国人	123
二	123
美国	123
美国人	123
SELECT * FROM T1_PK_CHAR WHERE C1='中国';
C1	C2
中国	123
SELECT * FROM T1_PK_CHAR WHERE C1='中1';
C1	C2
SELECT * FROM T1_PK_CHAR WHERE C1<='中1国';
C1	C2
A	123
AB	123
b	123
cde	123
一	123
一ab三	123
一a二b三c	123
一二三	123
三	123
SELECT * FROM T1_PK_CHAR WHERE C1>='美国';
C1	C2
美国	123
美国人	123
UPDATE T1_PK_CHAR SET C2='KFC' WHERE C1>='中国';
SELECT * FROM T1_PK_CHAR;
C1	C2
A	123
AB	123
b	123
cde	123
一	123
一ab三	123
一a二b三c	123
一二三	123
三	123
中国	KFC
中国人	KFC
二	KFC
美国	KFC
美国人	KFC
UPDATE T1_PK_CHAR SET C2='KFC' WHERE C1>='AB';
SELECT * FROM T1_PK_CHAR;
C1	C2
A	123
AB	KFC
b	KFC
cde	KFC
一	KFC
一ab三	KFC
一a二b三c	KFC
一二三	KFC
三	KFC
中国	KFC
中国人	KFC
二	KFC
美国	KFC
美国人	KFC
DELETE FROM T1_PK_CHAR WHERE C1>='中国';
SELECT * FROM T1_PK_CHAR;
C1	C2
A	123
AB	KFC
b	KFC
cde	KFC
一	KFC
一ab三	KFC
一a二b三c	KFC
一二三	KFC
三	KFC
DELETE FROM T1_PK_CHAR WHERE C1>='ab';
SELECT * FROM T1_PK_CHAR;
C1	C2
A	123
CREATE TABLE T1_SEC(ID INT AUTO_INCREMENT, C1 VARCHAR(100), C2 VARCHAR(100), PRIMARY KEY(ID), KEY IDX_C1(C1)) CHARACTER SET UTF8,COLLATE UTF8_GENERAL_CI;
Warnings:
Warning	3719	'utf8' is currently an alias for the character set UTF8MB3, but will be an alias for UTF8MB4 in a future release. Please consider using UTF8MB4 in order to be unambiguous.
Warning	3778	'utf8_general_ci' is a collation of the deprecated character set UTF8MB3. Please consider using UTF8MB4 with an appropriate collation instead.
INSERT INTO T1_SEC(C1,C2) VALUES('A', '123');
INSERT INTO T1_SEC(C1,C2) VALUES('AB', '123');
INSERT INTO T1_SEC(C1,C2) VALUES('a', '123');
INSERT INTO T1_SEC(C1,C2) VALUES('ab', '123');
INSERT INTO T1_SEC(C1,C2) VALUES('B', '123');
INSERT INTO T1_SEC(C1,C2) VALUES('b', '123');
INSERT INTO T1_SEC(C1,C2) VALUES('cde', '123');
INSERT INTO T1_SEC(C1,C2) VALUES('CDE', '123');
INSERT INTO T1_SEC(C1,C2) VALUES('CDE', '123');
INSERT INTO T1_SEC(C1,C2) VALUES('中国', '123');
INSERT INTO T1_SEC(C1,C2) VALUES('中国人', '123');
INSERT INTO T1_SEC(C1,C2) VALUES('美国', '123');
INSERT INTO T1_SEC(C1,C2) VALUES('美国人', '123');
INSERT INTO T1_SEC(C1,C2) VALUES('一', '123');
INSERT INTO T1_SEC(C1,C2) VALUES('二', '123');
INSERT INTO T1_SEC(C1,C2) VALUES('三', '123');
INSERT INTO T1_SEC(C1,C2) VALUES('一二三','123');
INSERT INTO T1_SEC(C1,C2) VALUES('一ab三','123');
INSERT INTO T1_SEC(C1,C2) VALUES('一a二b三c','123');
SELECT * FROM T1_SEC FORCE INDEX(IDX_C1) WHERE C1='A';
ID	C1	C2
1	A	123
3	a	123
SELECT * FROM T1_SEC FORCE INDEX(IDX_C1) WHERE C1='a';
ID	C1	C2
1	A	123
3	a	123
SELECT * FROM T1_SEC FORCE INDEX(IDX_C1) WHERE C1='AB';
ID	C1	C2
2	AB	123
4	ab	123
SELECT * FROM T1_SEC FORCE INDEX(IDX_C1) WHERE C1='ab';
ID	C1	C2
2	AB	123
4	ab	123
SELECT * FROM T1_SEC FORCE INDEX(IDX_C1) WHERE C1='abc';
ID	C1	C2
SELECT * FROM T1_SEC FORCE INDEX(IDX_C1) WHERE C1 in ('abc', 'AB');
ID	C1	C2
2	AB	123
4	ab	123
SELECT * FROM T1_SEC FORCE INDEX(IDX_C1) WHERE C1 in ('ABC', 'CDE', 'cde');
ID	C1	C2
7	cde	123
8	CDE	123
9	CDE	123
SELECT * FROM T1_SEC FORCE INDEX(IDX_C1) WHERE C1>'ab';
ID	C1	C2
5	B	123
6	b	123
7	cde	123
8	CDE	123
9	CDE	123
14	一	123
18	一ab三	123
19	一a二b三c	123
17	一二三	123
16	三	123
10	中国	123
11	中国人	123
15	二	123
12	美国	123
13	美国人	123
SELECT * FROM T1_SEC FORCE INDEX(IDX_C1) WHERE C1>'AB';
ID	C1	C2
5	B	123
6	b	123
7	cde	123
8	CDE	123
9	CDE	123
14	一	123
18	一ab三	123
19	一a二b三c	123
17	一二三	123
16	三	123
10	中国	123
11	中国人	123
15	二	123
12	美国	123
13	美国人	123
SELECT * FROM T1_SEC FORCE INDEX(IDX_C1) WHERE C1>'a';
ID	C1	C2
2	AB	123
4	ab	123
5	B	123
6	b	123
7	cde	123
8	CDE	123
9	CDE	123
14	一	123
18	一ab三	123
19	一a二b三c	123
17	一二三	123
16	三	123
10	中国	123
11	中国人	123
15	二	123
12	美国	123
13	美国人	123
SELECT * FROM T1_SEC FORCE INDEX(IDX_C1) WHERE C1>='a';
ID	C1	C2
1	A	123
3	a	123
2	AB	123
4	ab	123
5	B	123
6	b	123
7	cde	123
8	CDE	123
9	CDE	123
14	一	123
18	一ab三	123
19	一a二b三c	123
17	一二三	123
16	三	123
10	中国	123
11	中国人	123
15	二	123
12	美国	123
13	美国人	123
SELECT * FROM T1_SEC FORCE INDEX(IDX_C1) WHERE C1>='ab';
ID	C1	C2
2	AB	123
4	ab	123
5	B	123
6	b	123
7	cde	123
8	CDE	123
9	CDE	123
14	一	123
18	一ab三	123
19	一a二b三c	123
17	一二三	123
16	三	123
10	中国	123
11	中国人	123
15	二	123
12	美国	123
13	美国人	123
SELECT * FROM T1_SEC FORCE INDEX(IDX_C1) WHERE C1>='AB';
ID	C1	C2
2	AB	123
4	ab	123
5	B	123
6	b	123
7	cde	123
8	CDE	123
9	CDE	123
14	一	123
18	一ab三	123
19	一a二b三c	123
17	一二三	123
16	三	123
10	中国	123
11	中国人	123
15	二	123
12	美国	123
13	美国人	123
SELECT * FROM T1_SEC FORCE INDEX(IDX_C1) WHERE C1<'ab';
ID	C1	C2
1	A	123
3	a	123
SELECT * FROM T1_SEC FORCE INDEX(IDX_C1) WHERE C1<='AB';
ID	C1	C2
1	A	123
3	a	123
2	AB	123
4	ab	123
SELECT * FROM T1_SEC FORCE INDEX(IDX_C1) ORDER BY C1 ASC;
ID	C1	C2
1	A	123
3	a	123
2	AB	123
4	ab	123
5	B	123
6	b	123
7	cde	123
8	CDE	123
9	CDE	123
14	一	123
18	一ab三	123
19	一a二b三c	123
17	一二三	123
16	三	123
10	中国	123
11	中国人	123
15	二	123
12	美国	123
13	美国人	123
SELECT * FROM T1_SEC FORCE INDEX(IDX_C1) ORDER BY C1 DESC;
ID	C1	C2
13	美国人	123
12	美国	123
15	二	123
11	中国人	123
10	中国	123
16	三	123
17	一二三	123
19	一a二b三c	123
18	一ab三	123
14	一	123
9	CDE	123
8	CDE	123
7	cde	123
6	b	123
5	B	123
4	ab	123
2	AB	123
3	a	123
1	A	123
SELECT * FROM T1_SEC FORCE INDEX(IDX_C1) WHERE C1>'ab' ORDER BY C1 DESC;
ID	C1	C2
13	美国人	123
12	美国	123
15	二	123
11	中国人	123
10	中国	123
16	三	123
17	一二三	123
19	一a二b三c	123
18	一ab三	123
14	一	123
9	CDE	123
8	CDE	123
7	cde	123
6	b	123
5	B	123
SELECT * FROM T1_SEC FORCE INDEX(IDX_C1) WHERE C1>'ab' ORDER BY C1 ASC;
ID	C1	C2
5	B	123
6	b	123
7	cde	123
8	CDE	123
9	CDE	123
14	一	123
18	一ab三	123
19	一a二b三c	123
17	一二三	123
16	三	123
10	中国	123
11	中国人	123
15	二	123
12	美国	123
13	美国人	123
SELECT * FROM T1_SEC FORCE INDEX(IDX_C1) WHERE C1>'一';
ID	C1	C2
18	一ab三	123
19	一a二b三c	123
17	一二三	123
16	三	123
10	中国	123
11	中国人	123
15	二	123
12	美国	123
13	美国人	123
SELECT * FROM T1_SEC FORCE INDEX(IDX_C1) WHERE C1='一';
ID	C1	C2
14	一	123
SELECT * FROM T1_SEC FORCE INDEX(IDX_C1) WHERE C1<'一';
ID	C1	C2
1	A	123
3	a	123
2	AB	123
4	ab	123
5	B	123
6	b	123
7	cde	123
8	CDE	123
9	CDE	123
SELECT * FROM T1_SEC FORCE INDEX(IDX_C1) WHERE C1>'一';
ID	C1	C2
18	一ab三	123
19	一a二b三c	123
17	一二三	123
16	三	123
10	中国	123
11	中国人	123
15	二	123
12	美国	123
13	美国人	123
SELECT * FROM T1_SEC FORCE INDEX(IDX_C1) WHERE C1='中国';
ID	C1	C2
10	中国	123
SELECT * FROM T1_SEC FORCE INDEX(IDX_C1) WHERE C1='中1';
ID	C1	C2
SELECT * FROM T1_SEC FORCE INDEX(IDX_C1) WHERE C1<='中1国';
ID	C1	C2
1	A	123
3	a	123
2	AB	123
4	ab	123
5	B	123
6	b	123
7	cde	123
8	CDE	123
9	CDE	123
14	一	123
18	一ab三	123
19	一a二b三c	123
17	一二三	123
16	三	123
SELECT * FROM T1_SEC FORCE INDEX(IDX_C1) WHERE C1>='美国';
ID	C1	C2
12	美国	123
13	美国人	123
SELECT * FROM T1_SEC FORCE INDEX(IDX_C1) WHERE C1 in ('一', '二', '美国', 'AB');
ID	C1	C2
2	AB	123
4	ab	123
14	一	123
15	二	123
12	美国	123
SELECT * FROM T1_SEC FORCE INDEX(IDX_C1) WHERE C1 LIKE '一%';
ID	C1	C2
14	一	123
18	一ab三	123
19	一a二b三c	123
17	一二三	123
SELECT * FROM T1_SEC FORCE INDEX(IDX_C1) WHERE C1 LIKE '%一%';
ID	C1	C2
14	一	123
17	一二三	123
18	一ab三	123
19	一a二b三c	123
SELECT * FROM T1_SEC FORCE INDEX(IDX_C1) WHERE C1 LIKE '%一';
ID	C1	C2
14	一	123
UPDATE T1_SEC FORCE INDEX(IDX_C1) SET C2='KFC' WHERE C1>='中国';
SELECT * FROM T1_SEC;
ID	C1	C2
1	A	123
2	AB	123
3	a	123
4	ab	123
5	B	123
6	b	123
7	cde	123
8	CDE	123
9	CDE	123
10	中国	KFC
11	中国人	KFC
12	美国	KFC
13	美国人	KFC
14	一	123
15	二	KFC
16	三	123
17	一二三	123
18	一ab三	123
19	一a二b三c	123
UPDATE T1_SEC FORCE INDEX(IDX_C1) SET C2='KFC' WHERE C1>='AB';
SELECT * FROM T1_SEC;
ID	C1	C2
1	A	123
2	AB	KFC
3	a	123
4	ab	KFC
5	B	KFC
6	b	KFC
7	cde	KFC
8	CDE	KFC
9	CDE	KFC
10	中国	KFC
11	中国人	KFC
12	美国	KFC
13	美国人	KFC
14	一	KFC
15	二	KFC
16	三	KFC
17	一二三	KFC
18	一ab三	KFC
19	一a二b三c	KFC
DELETE FROM T1_SEC  WHERE C1>='中国';
SELECT * FROM T1_SEC;
ID	C1	C2
1	A	123
2	AB	KFC
3	a	123
4	ab	KFC
5	B	KFC
6	b	KFC
7	cde	KFC
8	CDE	KFC
9	CDE	KFC
14	一	KFC
16	三	KFC
17	一二三	KFC
18	一ab三	KFC
19	一a二b三c	KFC
DELETE FROM T1_SEC  WHERE C1>='ab';
SELECT * FROM T1_SEC;
ID	C1	C2
1	A	123
3	a	123
CREATE TABLE T1_SEC_CHAR(ID INT AUTO_INCREMENT, C1 CHAR(100), C2 CHAR(100), PRIMARY KEY(ID), KEY IDX_C1(C1)) CHARACTER SET UTF8,COLLATE UTF8_GENERAL_CI;
Warnings:
Warning	3719	'utf8' is currently an alias for the character set UTF8MB3, but will be an alias for UTF8MB4 in a future release. Please consider using UTF8MB4 in order to be unambiguous.
Warning	3778	'utf8_general_ci' is a collation of the deprecated character set UTF8MB3. Please consider using UTF8MB4 with an appropriate collation instead.
INSERT INTO T1_SEC_CHAR(C1,C2) VALUES('A', '123');
INSERT INTO T1_SEC_CHAR(C1,C2) VALUES('AB', '123');
INSERT INTO T1_SEC_CHAR(C1,C2) VALUES('a', '123');
INSERT INTO T1_SEC_CHAR(C1,C2) VALUES('ab', '123');
INSERT INTO T1_SEC_CHAR(C1,C2) VALUES('B', '123');
INSERT INTO T1_SEC_CHAR(C1,C2) VALUES('b', '123');
INSERT INTO T1_SEC_CHAR(C1,C2) VALUES('cde', '123');
INSERT INTO T1_SEC_CHAR(C1,C2) VALUES('CDE', '123');
INSERT INTO T1_SEC_CHAR(C1,C2) VALUES('CDE', '123');
INSERT INTO T1_SEC_CHAR(C1,C2) VALUES('中国', '123');
INSERT INTO T1_SEC_CHAR(C1,C2) VALUES('中国人', '123');
INSERT INTO T1_SEC_CHAR(C1,C2) VALUES('美国', '123');
INSERT INTO T1_SEC_CHAR(C1,C2) VALUES('美国人', '123');
INSERT INTO T1_SEC_CHAR(C1,C2) VALUES('一', '123');
INSERT INTO T1_SEC_CHAR(C1,C2) VALUES('二', '123');
INSERT INTO T1_SEC_CHAR(C1,C2) VALUES('三', '123');
INSERT INTO T1_SEC_CHAR(C1,C2) VALUES('一二三','123');
INSERT INTO T1_SEC_CHAR(C1,C2) VALUES('一ab三','123');
INSERT INTO T1_SEC_CHAR(C1,C2) VALUES('一a二b三c','123');
SELECT * FROM T1_SEC_CHAR WHERE C1='A';
ID	C1	C2
1	A	123
3	a	123
SELECT * FROM T1_SEC_CHAR WHERE C1='a';
ID	C1	C2
1	A	123
3	a	123
SELECT * FROM T1_SEC_CHAR WHERE C1='AB';
ID	C1	C2
2	AB	123
4	ab	123
SELECT * FROM T1_SEC_CHAR WHERE C1='ab';
ID	C1	C2
2	AB	123
4	ab	123
SELECT * FROM T1_SEC_CHAR WHERE C1='abc';
ID	C1	C2
SELECT * FROM T1_SEC_CHAR WHERE C1 in ('abc', 'AB');
ID	C1	C2
2	AB	123
4	ab	123
SELECT * FROM T1_SEC_CHAR WHERE C1 in ('ABC', 'CDE', 'cde');
ID	C1	C2
7	cde	123
8	CDE	123
9	CDE	123
SELECT * FROM T1_SEC_CHAR FORCE INDEX(IDX_C1) WHERE C1>'ab';
ID	C1	C2
5	B	123
6	b	123
7	cde	123
8	CDE	123
9	CDE	123
14	一	123
18	一ab三	123
19	一a二b三c	123
17	一二三	123
16	三	123
10	中国	123
11	中国人	123
15	二	123
12	美国	123
13	美国人	123
SELECT * FROM T1_SEC_CHAR FORCE INDEX(IDX_C1) WHERE C1>'AB';
ID	C1	C2
5	B	123
6	b	123
7	cde	123
8	CDE	123
9	CDE	123
14	一	123
18	一ab三	123
19	一a二b三c	123
17	一二三	123
16	三	123
10	中国	123
11	中国人	123
15	二	123
12	美国	123
13	美国人	123
SELECT * FROM T1_SEC_CHAR FORCE INDEX(IDX_C1) WHERE C1>'a';
ID	C1	C2
2	AB	123
4	ab	123
5	B	123
6	b	123
7	cde	123
8	CDE	123
9	CDE	123
14	一	123
18	一ab三	123
19	一a二b三c	123
17	一二三	123
16	三	123
10	中国	123
11	中国人	123
15	二	123
12	美国	123
13	美国人	123
SELECT * FROM T1_SEC_CHAR FORCE INDEX(IDX_C1) WHERE C1>='a';
ID	C1	C2
1	A	123
3	a	123
2	AB	123
4	ab	123
5	B	123
6	b	123
7	cde	123
8	CDE	123
9	CDE	123
14	一	123
18	一ab三	123
19	一a二b三c	123
17	一二三	123
16	三	123
10	中国	123
11	中国人	123
15	二	123
12	美国	123
13	美国人	123
SELECT * FROM T1_SEC_CHAR FORCE INDEX(IDX_C1) WHERE C1>='ab';
ID	C1	C2
2	AB	123
4	ab	123
5	B	123
6	b	123
7	cde	123
8	CDE	123
9	CDE	123
14	一	123
18	一ab三	123
19	一a二b三c	123
17	一二三	123
16	三	123
10	中国	123
11	中国人	123
15	二	123
12	美国	123
13	美国人	123
SELECT * FROM T1_SEC_CHAR FORCE INDEX(IDX_C1) WHERE C1>='AB';
ID	C1	C2
2	AB	123
4	ab	123
5	B	123
6	b	123
7	cde	123
8	CDE	123
9	CDE	123
14	一	123
18	一ab三	123
19	一a二b三c	123
17	一二三	123
16	三	123
10	中国	123
11	中国人	123
15	二	123
12	美国	123
13	美国人	123
SELECT * FROM T1_SEC_CHAR FORCE INDEX(IDX_C1) WHERE C1<'ab';
ID	C1	C2
1	A	123
3	a	123
SELECT * FROM T1_SEC_CHAR FORCE INDEX(IDX_C1) WHERE C1<='AB';
ID	C1	C2
1	A	123
3	a	123
2	AB	123
4	ab	123
SELECT * FROM T1_SEC_CHAR FORCE INDEX(IDX_C1) ORDER BY C1 ASC;
ID	C1	C2
1	A	123
3	a	123
2	AB	123
4	ab	123
5	B	123
6	b	123
7	cde	123
8	CDE	123
9	CDE	123
14	一	123
18	一ab三	123
19	一a二b三c	123
17	一二三	123
16	三	123
10	中国	123
11	中国人	123
15	二	123
12	美国	123
13	美国人	123
SELECT * FROM T1_SEC_CHAR FORCE INDEX(IDX_C1) ORDER BY C1 DESC;
ID	C1	C2
13	美国人	123
12	美国	123
15	二	123
11	中国人	123
10	中国	123
16	三	123
17	一二三	123
19	一a二b三c	123
18	一ab三	123
14	一	123
9	CDE	123
8	CDE	123
7	cde	123
6	b	123
5	B	123
4	ab	123
2	AB	123
3	a	123
1	A	123
SELECT * FROM T1_SEC_CHAR FORCE INDEX(IDX_C1) WHERE C1>'ab' ORDER BY C1 DESC;
ID	C1	C2
13	美国人	123
12	美国	123
15	二	123
11	中国人	123
10	中国	123
16	三	123
17	一二三	123
19	一a二b三c	123
18	一ab三	123
14	一	123
9	CDE	123
8	CDE	123
7	cde	123
6	b	123
5	B	123
SELECT * FROM T1_SEC_CHAR FORCE INDEX(IDX_C1) WHERE C1>'ab' ORDER BY C1 ASC;
ID	C1	C2
5	B	123
6	b	123
7	cde	123
8	CDE	123
9	CDE	123
14	一	123
18	一ab三	123
19	一a二b三c	123
17	一二三	123
16	三	123
10	中国	123
11	中国人	123
15	二	123
12	美国	123
13	美国人	123
SELECT * FROM T1_SEC_CHAR FORCE INDEX(IDX_C1) WHERE C1>'一';
ID	C1	C2
18	一ab三	123
19	一a二b三c	123
17	一二三	123
16	三	123
10	中国	123
11	中国人	123
15	二	123
12	美国	123
13	美国人	123
SELECT * FROM T1_SEC_CHAR FORCE INDEX(IDX_C1) WHERE C1='一';
ID	C1	C2
14	一	123
SELECT * FROM T1_SEC_CHAR FORCE INDEX(IDX_C1) WHERE C1<'一';
ID	C1	C2
1	A	123
3	a	123
2	AB	123
4	ab	123
5	B	123
6	b	123
7	cde	123
8	CDE	123
9	CDE	123
SELECT * FROM T1_SEC_CHAR FORCE INDEX(IDX_C1) WHERE C1>'一';
ID	C1	C2
18	一ab三	123
19	一a二b三c	123
17	一二三	123
16	三	123
10	中国	123
11	中国人	123
15	二	123
12	美国	123
13	美国人	123
SELECT * FROM T1_SEC_CHAR FORCE INDEX(IDX_C1) WHERE C1='中国';
ID	C1	C2
10	中国	123
SELECT * FROM T1_SEC_CHAR FORCE INDEX(IDX_C1) WHERE C1='中1';
ID	C1	C2
SELECT * FROM T1_SEC_CHAR FORCE INDEX(IDX_C1) WHERE C1<='中1国';
ID	C1	C2
1	A	123
3	a	123
2	AB	123
4	ab	123
5	B	123
6	b	123
7	cde	123
8	CDE	123
9	CDE	123
14	一	123
18	一ab三	123
19	一a二b三c	123
17	一二三	123
16	三	123
SELECT * FROM T1_SEC_CHAR FORCE INDEX(IDX_C1) WHERE C1>='美国';
ID	C1	C2
12	美国	123
13	美国人	123
SELECT * FROM T1_SEC_CHAR FORCE INDEX(IDX_C1) WHERE C1 in ('一', '二', '美国', 'AB');
ID	C1	C2
2	AB	123
4	ab	123
14	一	123
15	二	123
12	美国	123
SELECT * FROM T1_SEC_CHAR FORCE INDEX(IDX_C1) WHERE C1 LIKE '一%';
ID	C1	C2
14	一	123
18	一ab三	123
19	一a二b三c	123
17	一二三	123
SELECT * FROM T1_SEC_CHAR FORCE INDEX(IDX_C1) WHERE C1 LIKE '%一%';
ID	C1	C2
14	一	123
17	一二三	123
18	一ab三	123
19	一a二b三c	123
SELECT * FROM T1_SEC_CHAR FORCE INDEX(IDX_C1) WHERE C1 LIKE '%一';
ID	C1	C2
14	一	123
UPDATE T1_SEC_CHAR FORCE INDEX(IDX_C1) SET C2='KFC' WHERE C1>='中国';
SELECT * FROM T1_SEC_CHAR;
ID	C1	C2
1	A	123
2	AB	123
3	a	123
4	ab	123
5	B	123
6	b	123
7	cde	123
8	CDE	123
9	CDE	123
10	中国	KFC
11	中国人	KFC
12	美国	KFC
13	美国人	KFC
14	一	123
15	二	KFC
16	三	123
17	一二三	123
18	一ab三	123
19	一a二b三c	123
UPDATE T1_SEC_CHAR FORCE INDEX(IDX_C1) SET C2='KFC' WHERE C1>='AB';
SELECT * FROM T1_SEC_CHAR;
ID	C1	C2
1	A	123
2	AB	KFC
3	a	123
4	ab	KFC
5	B	KFC
6	b	KFC
7	cde	KFC
8	CDE	KFC
9	CDE	KFC
10	中国	KFC
11	中国人	KFC
12	美国	KFC
13	美国人	KFC
14	一	KFC
15	二	KFC
16	三	KFC
17	一二三	KFC
18	一ab三	KFC
19	一a二b三c	KFC
DELETE FROM T1_SEC_CHAR WHERE C1>='中国';
SELECT * FROM T1_SEC_CHAR;
ID	C1	C2
1	A	123
2	AB	KFC
3	a	123
4	ab	KFC
5	B	KFC
6	b	KFC
7	cde	KFC
8	CDE	KFC
9	CDE	KFC
14	一	KFC
16	三	KFC
17	一二三	KFC
18	一ab三	KFC
19	一a二b三c	KFC
DELETE FROM T1_SEC_CHAR WHERE C1>='ab';
SELECT * FROM T1_SEC_CHAR;
ID	C1	C2
1	A	123
3	a	123
CREATE TABLE T1_UNIQUE(ID INT AUTO_INCREMENT, C1 VARCHAR(100), C2 VARCHAR(100), PRIMARY KEY(ID), UNIQUE KEY IDX_C1(C1)) CHARACTER SET UTF8,COLLATE UTF8_GENERAL_CI;
Warnings:
Warning	3719	'utf8' is currently an alias for the character set UTF8MB3, but will be an alias for UTF8MB4 in a future release. Please consider using UTF8MB4 in order to be unambiguous.
Warning	3778	'utf8_general_ci' is a collation of the deprecated character set UTF8MB3. Please consider using UTF8MB4 with an appropriate collation instead.
INSERT INTO T1_UNIQUE(C1,C2) VALUES('A', '123');
INSERT INTO T1_UNIQUE(C1,C2) VALUES('AB', '123');
INSERT INTO T1_UNIQUE(C1,C2) VALUES('a', '123');
ERROR 23000: Duplicate entry 'a' for key 'IDX_C1'
INSERT INTO T1_UNIQUE(C1,C2) VALUES('ab', '123');
ERROR 23000: Duplicate entry 'ab' for key 'IDX_C1'
INSERT INTO T1_UNIQUE(C1,C2) VALUES('B', '123');
INSERT INTO T1_UNIQUE(C1,C2) VALUES('b', '123');
ERROR 23000: Duplicate entry 'b' for key 'IDX_C1'
INSERT INTO T1_UNIQUE(C1,C2) VALUES('cde', '123');
INSERT INTO T1_UNIQUE(C1,C2) VALUES('CDE', '123');
ERROR 23000: Duplicate entry 'CDE' for key 'IDX_C1'
INSERT INTO T1_UNIQUE(C1,C2) VALUES('CDE', '123');
ERROR 23000: Duplicate entry 'CDE' for key 'IDX_C1'
INSERT INTO T1_UNIQUE(C1,C2) VALUES('中国', '123');
INSERT INTO T1_UNIQUE(C1,C2) VALUES('中国人', '123');
INSERT INTO T1_UNIQUE(C1,C2) VALUES('美国', '123');
INSERT INTO T1_UNIQUE(C1,C2) VALUES('美国人', '123');
INSERT INTO T1_UNIQUE(C1,C2) VALUES('一', '123');
INSERT INTO T1_UNIQUE(C1,C2) VALUES('二', '123');
INSERT INTO T1_UNIQUE(C1,C2) VALUES('三', '123');
INSERT INTO T1_UNIQUE(C1,C2) VALUES('一二三','123');
INSERT INTO T1_UNIQUE(C1,C2) VALUES('一ab三','123');
INSERT INTO T1_UNIQUE(C1,C2) VALUES('一a二b三c','123');
SELECT * FROM T1_UNIQUE WHERE C1='A';
ID	C1	C2
1	A	123
SELECT * FROM T1_UNIQUE WHERE C1='a';
ID	C1	C2
1	A	123
SELECT * FROM T1_UNIQUE WHERE C1='AB';
ID	C1	C2
2	AB	123
SELECT * FROM T1_UNIQUE WHERE C1='ab';
ID	C1	C2
2	AB	123
SELECT * FROM T1_UNIQUE WHERE C1='abc';
ID	C1	C2
SELECT * FROM T1_UNIQUE WHERE C1 in ('abc', 'AB');
ID	C1	C2
2	AB	123
SELECT * FROM T1_UNIQUE WHERE C1 in ('ABC', 'CDE', 'cde');
ID	C1	C2
7	cde	123
SELECT * FROM T1_UNIQUE FORCE INDEX(IDX_C1) WHERE C1>'ab';
ID	C1	C2
5	B	123
7	cde	123
14	一	123
18	一ab三	123
19	一a二b三c	123
17	一二三	123
16	三	123
10	中国	123
11	中国人	123
15	二	123
12	美国	123
13	美国人	123
SELECT * FROM T1_UNIQUE FORCE INDEX(IDX_C1) WHERE C1>'AB';
ID	C1	C2
5	B	123
7	cde	123
14	一	123
18	一ab三	123
19	一a二b三c	123
17	一二三	123
16	三	123
10	中国	123
11	中国人	123
15	二	123
12	美国	123
13	美国人	123
SELECT * FROM T1_UNIQUE FORCE INDEX(IDX_C1) WHERE C1>'a';
ID	C1	C2
2	AB	123
5	B	123
7	cde	123
14	一	123
18	一ab三	123
19	一a二b三c	123
17	一二三	123
16	三	123
10	中国	123
11	中国人	123
15	二	123
12	美国	123
13	美国人	123
SELECT * FROM T1_UNIQUE FORCE INDEX(IDX_C1) WHERE C1>='a';
ID	C1	C2
1	A	123
2	AB	123
5	B	123
7	cde	123
14	一	123
18	一ab三	123
19	一a二b三c	123
17	一二三	123
16	三	123
10	中国	123
11	中国人	123
15	二	123
12	美国	123
13	美国人	123
SELECT * FROM T1_UNIQUE FORCE INDEX(IDX_C1) WHERE C1>='ab';
ID	C1	C2
2	AB	123
5	B	123
7	cde	123
14	一	123
18	一ab三	123
19	一a二b三c	123
17	一二三	123
16	三	123
10	中国	123
11	中国人	123
15	二	123
12	美国	123
13	美国人	123
SELECT * FROM T1_UNIQUE FORCE INDEX(IDX_C1) WHERE C1>='AB';
ID	C1	C2
2	AB	123
5	B	123
7	cde	123
14	一	123
18	一ab三	123
19	一a二b三c	123
17	一二三	123
16	三	123
10	中国	123
11	中国人	123
15	二	123
12	美国	123
13	美国人	123
SELECT * FROM T1_UNIQUE FORCE INDEX(IDX_C1) WHERE C1<'ab';
ID	C1	C2
1	A	123
SELECT * FROM T1_UNIQUE FORCE INDEX(IDX_C1) WHERE C1<='AB';
ID	C1	C2
1	A	123
2	AB	123
SELECT * FROM T1_UNIQUE FORCE INDEX(IDX_C1) ORDER BY C1 ASC;
ID	C1	C2
1	A	123
2	AB	123
5	B	123
7	cde	123
14	一	123
18	一ab三	123
19	一a二b三c	123
17	一二三	123
16	三	123
10	中国	123
11	中国人	123
15	二	123
12	美国	123
13	美国人	123
SELECT * FROM T1_UNIQUE FORCE INDEX(IDX_C1) ORDER BY C1 DESC;
ID	C1	C2
13	美国人	123
12	美国	123
15	二	123
11	中国人	123
10	中国	123
16	三	123
17	一二三	123
19	一a二b三c	123
18	一ab三	123
14	一	123
7	cde	123
5	B	123
2	AB	123
1	A	123
SELECT * FROM T1_UNIQUE FORCE INDEX(IDX_C1) WHERE C1>'ab' ORDER BY C1 DESC;
ID	C1	C2
13	美国人	123
12	美国	123
15	二	123
11	中国人	123
10	中国	123
16	三	123
17	一二三	123
19	一a二b三c	123
18	一ab三	123
14	一	123
7	cde	123
5	B	123
SELECT * FROM T1_UNIQUE FORCE INDEX(IDX_C1) WHERE C1>'ab' ORDER BY C1 ASC;
ID	C1	C2
5	B	123
7	cde	123
14	一	123
18	一ab三	123
19	一a二b三c	123
17	一二三	123
16	三	123
10	中国	123
11	中国人	123
15	二	123
12	美国	123
13	美国人	123
SELECT * FROM T1_UNIQUE FORCE INDEX(IDX_C1) WHERE C1>'一';
ID	C1	C2
18	一ab三	123
19	一a二b三c	123
17	一二三	123
16	三	123
10	中国	123
11	中国人	123
15	二	123
12	美国	123
13	美国人	123
SELECT * FROM T1_UNIQUE FORCE INDEX(IDX_C1) WHERE C1='一';
ID	C1	C2
14	一	123
SELECT * FROM T1_UNIQUE FORCE INDEX(IDX_C1) WHERE C1<'一';
ID	C1	C2
1	A	123
2	AB	123
5	B	123
7	cde	123
SELECT * FROM T1_UNIQUE FORCE INDEX(IDX_C1) WHERE C1>'一';
ID	C1	C2
18	一ab三	123
19	一a二b三c	123
17	一二三	123
16	三	123
10	中国	123
11	中国人	123
15	二	123
12	美国	123
13	美国人	123
SELECT * FROM T1_UNIQUE FORCE INDEX(IDX_C1) WHERE C1='中国';
ID	C1	C2
10	中国	123
SELECT * FROM T1_UNIQUE FORCE INDEX(IDX_C1) WHERE C1='中1';
ID	C1	C2
SELECT * FROM T1_UNIQUE FORCE INDEX(IDX_C1) WHERE C1<='中1国';
ID	C1	C2
1	A	123
2	AB	123
5	B	123
7	cde	123
14	一	123
18	一ab三	123
19	一a二b三c	123
17	一二三	123
16	三	123
SELECT * FROM T1_UNIQUE FORCE INDEX(IDX_C1) WHERE C1>='美国';
ID	C1	C2
12	美国	123
13	美国人	123
SELECT * FROM T1_UNIQUE FORCE INDEX(IDX_C1) WHERE C1 in ('一', '二', '美国', 'AB');
ID	C1	C2
2	AB	123
14	一	123
15	二	123
12	美国	123
SELECT * FROM T1_UNIQUE FORCE INDEX(IDX_C1) WHERE C1 LIKE '一%';
ID	C1	C2
14	一	123
18	一ab三	123
19	一a二b三c	123
17	一二三	123
SELECT * FROM T1_UNIQUE FORCE INDEX(IDX_C1) WHERE C1 LIKE '%一%';
ID	C1	C2
14	一	123
17	一二三	123
18	一ab三	123
19	一a二b三c	123
SELECT * FROM T1_UNIQUE FORCE INDEX(IDX_C1) WHERE C1 LIKE '%一';
ID	C1	C2
14	一	123
UPDATE T1_UNIQUE FORCE INDEX(IDX_C1) SET C2='KFC' WHERE C1>='中国';
SELECT * FROM T1_UNIQUE;
ID	C1	C2
1	A	123
2	AB	123
5	B	123
7	cde	123
10	中国	KFC
11	中国人	KFC
12	美国	KFC
13	美国人	KFC
14	一	123
15	二	KFC
16	三	123
17	一二三	123
18	一ab三	123
19	一a二b三c	123
UPDATE T1_UNIQUE FORCE INDEX(IDX_C1) SET C2='KFC' WHERE C1>='AB';
SELECT * FROM T1_UNIQUE;
ID	C1	C2
1	A	123
2	AB	KFC
5	B	KFC
7	cde	KFC
10	中国	KFC
11	中国人	KFC
12	美国	KFC
13	美国人	KFC
14	一	KFC
15	二	KFC
16	三	KFC
17	一二三	KFC
18	一ab三	KFC
19	一a二b三c	KFC
DELETE FROM T1_UNIQUE WHERE C1>='中国';
SELECT * FROM T1_UNIQUE;
ID	C1	C2
1	A	123
2	AB	KFC
5	B	KFC
7	cde	KFC
14	一	KFC
16	三	KFC
17	一二三	KFC
18	一ab三	KFC
19	一a二b三c	KFC
DELETE FROM T1_UNIQUE WHERE C1>='ab';
SELECT * FROM T1_UNIQUE;
ID	C1	C2
1	A	123
CREATE TABLE T1_UNIQUE_CHAR(ID INT AUTO_INCREMENT, C1 CHAR(100), C2 CHAR(100), PRIMARY KEY(ID), UNIQUE KEY IDX_C1(C1)) CHARACTER SET UTF8,COLLATE UTF8_GENERAL_CI;
Warnings:
Warning	3719	'utf8' is currently an alias for the character set UTF8MB3, but will be an alias for UTF8MB4 in a future release. Please consider using UTF8MB4 in order to be unambiguous.
Warning	3778	'utf8_general_ci' is a collation of the deprecated character set UTF8MB3. Please consider using UTF8MB4 with an appropriate collation instead.
INSERT INTO T1_UNIQUE_CHAR(C1,C2) VALUES('A', '123');
INSERT INTO T1_UNIQUE_CHAR(C1,C2) VALUES('AB', '123');
INSERT INTO T1_UNIQUE_CHAR(C1,C2) VALUES('a', '123');
ERROR 23000: Duplicate entry 'a' for key 'IDX_C1'
INSERT INTO T1_UNIQUE_CHAR(C1,C2) VALUES('ab', '123');
ERROR 23000: Duplicate entry 'ab' for key 'IDX_C1'
INSERT INTO T1_UNIQUE_CHAR(C1,C2) VALUES('B', '123');
INSERT INTO T1_UNIQUE_CHAR(C1,C2) VALUES('b', '123');
ERROR 23000: Duplicate entry 'b' for key 'IDX_C1'
INSERT INTO T1_UNIQUE_CHAR(C1,C2) VALUES('cde', '123');
INSERT INTO T1_UNIQUE_CHAR(C1,C2) VALUES('CDE', '123');
ERROR 23000: Duplicate entry 'CDE' for key 'IDX_C1'
INSERT INTO T1_UNIQUE_CHAR(C1,C2) VALUES('CDE', '123');
ERROR 23000: Duplicate entry 'CDE' for key 'IDX_C1'
INSERT INTO T1_UNIQUE_CHAR(C1,C2) VALUES('中国', '123');
INSERT INTO T1_UNIQUE_CHAR(C1,C2) VALUES('中国人', '123');
INSERT INTO T1_UNIQUE_CHAR(C1,C2) VALUES('美国', '123');
INSERT INTO T1_UNIQUE_CHAR(C1,C2) VALUES('美国人', '123');
INSERT INTO T1_UNIQUE_CHAR(C1,C2) VALUES('一', '123');
INSERT INTO T1_UNIQUE_CHAR(C1,C2) VALUES('二', '123');
INSERT INTO T1_UNIQUE_CHAR(C1,C2) VALUES('三', '123');
INSERT INTO T1_UNIQUE_CHAR(C1,C2) VALUES('一二三','123');
INSERT INTO T1_UNIQUE_CHAR(C1,C2) VALUES('一ab三','123');
INSERT INTO T1_UNIQUE_CHAR(C1,C2) VALUES('一a二b三c','123');
SELECT * FROM T1_UNIQUE_CHAR WHERE C1='A';
ID	C1	C2
1	A	123
SELECT * FROM T1_UNIQUE_CHAR WHERE C1='a';
ID	C1	C2
1	A	123
SELECT * FROM T1_UNIQUE_CHAR WHERE C1='AB';
ID	C1	C2
2	AB	123
SELECT * FROM T1_UNIQUE_CHAR WHERE C1='ab';
ID	C1	C2
2	AB	123
SELECT * FROM T1_UNIQUE_CHAR WHERE C1='abc';
ID	C1	C2
SELECT * FROM T1_UNIQUE_CHAR WHERE C1 in ('abc', 'AB');
ID	C1	C2
2	AB	123
SELECT * FROM T1_UNIQUE_CHAR WHERE C1 in ('ABC', 'CDE', 'cde');
ID	C1	C2
7	cde	123
SELECT * FROM T1_UNIQUE_CHAR FORCE INDEX(IDX_C1) WHERE C1>'ab';
ID	C1	C2
5	B	123
7	cde	123
14	一	123
18	一ab三	123
19	一a二b三c	123
17	一二三	123
16	三	123
10	中国	123
11	中国人	123
15	二	123
12	美国	123
13	美国人	123
SELECT * FROM T1_UNIQUE_CHAR FORCE INDEX(IDX_C1) WHERE C1>'AB';
ID	C1	C2
5	B	123
7	cde	123
14	一	123
18	一ab三	123
19	一a二b三c	123
17	一二三	123
16	三	123
10	中国	123
11	中国人	123
15	二	123
12	美国	123
13	美国人	123
SELECT * FROM T1_UNIQUE_CHAR FORCE INDEX(IDX_C1) WHERE C1>'a';
ID	C1	C2
2	AB	123
5	B	123
7	cde	123
14	一	123
18	一ab三	123
19	一a二b三c	123
17	一二三	123
16	三	123
10	中国	123
11	中国人	123
15	二	123
12	美国	123
13	美国人	123
SELECT * FROM T1_UNIQUE_CHAR FORCE INDEX(IDX_C1) WHERE C1>='a';
ID	C1	C2
1	A	123
2	AB	123
5	B	123
7	cde	123
14	一	123
18	一ab三	123
19	一a二b三c	123
17	一二三	123
16	三	123
10	中国	123
11	中国人	123
15	二	123
12	美国	123
13	美国人	123
SELECT * FROM T1_UNIQUE_CHAR FORCE INDEX(IDX_C1) WHERE C1>='ab';
ID	C1	C2
2	AB	123
5	B	123
7	cde	123
14	一	123
18	一ab三	123
19	一a二b三c	123
17	一二三	123
16	三	123
10	中国	123
11	中国人	123
15	二	123
12	美国	123
13	美国人	123
SELECT * FROM T1_UNIQUE_CHAR FORCE INDEX(IDX_C1) WHERE C1>='AB';
ID	C1	C2
2	AB	123
5	B	123
7	cde	123
14	一	123
18	一ab三	123
19	一a二b三c	123
17	一二三	123
16	三	123
10	中国	123
11	中国人	123
15	二	123
12	美国	123
13	美国人	123
SELECT * FROM T1_UNIQUE_CHAR FORCE INDEX(IDX_C1) WHERE C1<'ab';
ID	C1	C2
1	A	123
SELECT * FROM T1_UNIQUE_CHAR FORCE INDEX(IDX_C1) WHERE C1<='AB';
ID	C1	C2
1	A	123
2	AB	123
SELECT * FROM T1_UNIQUE_CHAR FORCE INDEX(IDX_C1) ORDER BY C1 ASC;
ID	C1	C2
1	A	123
2	AB	123
5	B	123
7	cde	123
14	一	123
18	一ab三	123
19	一a二b三c	123
17	一二三	123
16	三	123
10	中国	123
11	中国人	123
15	二	123
12	美国	123
13	美国人	123
SELECT * FROM T1_UNIQUE_CHAR FORCE INDEX(IDX_C1) ORDER BY C1 DESC;
ID	C1	C2
13	美国人	123
12	美国	123
15	二	123
11	中国人	123
10	中国	123
16	三	123
17	一二三	123
19	一a二b三c	123
18	一ab三	123
14	一	123
7	cde	123
5	B	123
2	AB	123
1	A	123
SELECT * FROM T1_UNIQUE_CHAR FORCE INDEX(IDX_C1) WHERE C1>'ab' ORDER BY C1 DESC;
ID	C1	C2
13	美国人	123
12	美国	123
15	二	123
11	中国人	123
10	中国	123
16	三	123
17	一二三	123
19	一a二b三c	123
18	一ab三	123
14	一	123
7	cde	123
5	B	123
SELECT * FROM T1_UNIQUE_CHAR FORCE INDEX(IDX_C1) WHERE C1>'ab' ORDER BY C1 ASC;
ID	C1	C2
5	B	123
7	cde	123
14	一	123
18	一ab三	123
19	一a二b三c	123
17	一二三	123
16	三	123
10	中国	123
11	中国人	123
15	二	123
12	美国	123
13	美国人	123
SELECT * FROM T1_UNIQUE_CHAR FORCE INDEX(IDX_C1) WHERE C1>'一';
ID	C1	C2
18	一ab三	123
19	一a二b三c	123
17	一二三	123
16	三	123
10	中国	123
11	中国人	123
15	二	123
12	美国	123
13	美国人	123
SELECT * FROM T1_UNIQUE_CHAR FORCE INDEX(IDX_C1) WHERE C1='一';
ID	C1	C2
14	一	123
SELECT * FROM T1_UNIQUE_CHAR FORCE INDEX(IDX_C1) WHERE C1<'一';
ID	C1	C2
1	A	123
2	AB	123
5	B	123
7	cde	123
SELECT * FROM T1_UNIQUE_CHAR FORCE INDEX(IDX_C1) WHERE C1>'一';
ID	C1	C2
18	一ab三	123
19	一a二b三c	123
17	一二三	123
16	三	123
10	中国	123
11	中国人	123
15	二	123
12	美国	123
13	美国人	123
SELECT * FROM T1_UNIQUE_CHAR FORCE INDEX(IDX_C1) WHERE C1='中国';
ID	C1	C2
10	中国	123
SELECT * FROM T1_UNIQUE_CHAR FORCE INDEX(IDX_C1) WHERE C1='中1';
ID	C1	C2
SELECT * FROM T1_UNIQUE_CHAR FORCE INDEX(IDX_C1) WHERE C1<='中1国';
ID	C1	C2
1	A	123
2	AB	123
5	B	123
7	cde	123
14	一	123
18	一ab三	123
19	一a二b三c	123
17	一二三	123
16	三	123
SELECT * FROM T1_UNIQUE_CHAR FORCE INDEX(IDX_C1) WHERE C1>='美国';
ID	C1	C2
12	美国	123
13	美国人	123
SELECT * FROM T1_UNIQUE_CHAR FORCE INDEX(IDX_C1) WHERE C1 in ('一', '二', '美国', 'AB');
ID	C1	C2
2	AB	123
14	一	123
15	二	123
12	美国	123
SELECT * FROM T1_UNIQUE_CHAR FORCE INDEX(IDX_C1) WHERE C1 LIKE '一%';
ID	C1	C2
14	一	123
18	一ab三	123
19	一a二b三c	123
17	一二三	123
SELECT * FROM T1_UNIQUE_CHAR FORCE INDEX(IDX_C1) WHERE C1 LIKE '%一%';
ID	C1	C2
14	一	123
17	一二三	123
18	一ab三	123
19	一a二b三c	123
SELECT * FROM T1_UNIQUE_CHAR FORCE INDEX(IDX_C1) WHERE C1 LIKE '%一';
ID	C1	C2
14	一	123
UPDATE T1_UNIQUE_CHAR FORCE INDEX(IDX_C1) SET C2='KFC' WHERE C1>='中国';
SELECT * FROM T1_UNIQUE_CHAR;
ID	C1	C2
1	A	123
2	AB	123
5	B	123
7	cde	123
10	中国	KFC
11	中国人	KFC
12	美国	KFC
13	美国人	KFC
14	一	123
15	二	KFC
16	三	123
17	一二三	123
18	一ab三	123
19	一a二b三c	123
UPDATE T1_UNIQUE_CHAR FORCE INDEX(IDX_C1) SET C2='KFC' WHERE C1>='AB';
SELECT * FROM T1_UNIQUE_CHAR;
ID	C1	C2
1	A	123
2	AB	KFC
5	B	KFC
7	cde	KFC
10	中国	KFC
11	中国人	KFC
12	美国	KFC
13	美国人	KFC
14	一	KFC
15	二	KFC
16	三	KFC
17	一二三	KFC
18	一ab三	KFC
19	一a二b三c	KFC
DELETE FROM T1_UNIQUE_CHAR WHERE C1>='中国';
SELECT * FROM T1_UNIQUE_CHAR;
ID	C1	C2
1	A	123
2	AB	KFC
5	B	KFC
7	cde	KFC
14	一	KFC
16	三	KFC
17	一二三	KFC
18	一ab三	KFC
19	一a二b三c	KFC
DELETE FROM T1_UNIQUE_CHAR WHERE C1>='ab';
SELECT * FROM T1_UNIQUE_CHAR;
ID	C1	C2
1	A	123
CREATE TABLE T1_SEC_COMBINED(ID INT AUTO_INCREMENT, C1 VARCHAR(100), C2 VARCHAR(100), PRIMARY KEY(ID), KEY IDX_C1C2(C1,C2)) CHARACTER SET UTF8,COLLATE UTF8_GENERAL_CI;
Warnings:
Warning	3719	'utf8' is currently an alias for the character set UTF8MB3, but will be an alias for UTF8MB4 in a future release. Please consider using UTF8MB4 in order to be unambiguous.
Warning	3778	'utf8_general_ci' is a collation of the deprecated character set UTF8MB3. Please consider using UTF8MB4 with an appropriate collation instead.
INSERT INTO T1_SEC_COMBINED(C1,C2) VALUES('A', 'a');
INSERT INTO T1_SEC_COMBINED(C1,C2) VALUES('AB', '中国');
INSERT INTO T1_SEC_COMBINED(C1,C2) VALUES('a', '125');
INSERT INTO T1_SEC_COMBINED(C1,C2) VALUES('ab', '美国');
INSERT INTO T1_SEC_COMBINED(C1,C2) VALUES('B', '123');
INSERT INTO T1_SEC_COMBINED(C1,C2) VALUES('b', '124');
INSERT INTO T1_SEC_COMBINED(C1,C2) VALUES('cde', 'abc');
INSERT INTO T1_SEC_COMBINED(C1,C2) VALUES('CDE', '123');
INSERT INTO T1_SEC_COMBINED(C1,C2) VALUES('CDE', '124');
INSERT INTO T1_SEC_COMBINED(C1,C2) VALUES('中国', '一');
INSERT INTO T1_SEC_COMBINED(C1,C2) VALUES('中国人', '二');
INSERT INTO T1_SEC_COMBINED(C1,C2) VALUES('美国', '124');
INSERT INTO T1_SEC_COMBINED(C1,C2) VALUES('美国人', '125');
INSERT INTO T1_SEC_COMBINED(C1,C2) VALUES('一', '中a国');
INSERT INTO T1_SEC_COMBINED(C1,C2) VALUES('二', '124');
INSERT INTO T1_SEC_COMBINED(C1,C2) VALUES('三', '123');
INSERT INTO T1_SEC_COMBINED(C1,C2) VALUES('一二三','中a国b美国');
INSERT INTO T1_SEC_COMBINED(C1,C2) VALUES('一ab三','124');
INSERT INTO T1_SEC_COMBINED(C1,C2) VALUES('一a二b三c','123');
SELECT * FROM T1_SEC_COMBINED WHERE C1='A';
ID	C1	C2
3	a	125
1	A	a
SELECT * FROM T1_SEC_COMBINED WHERE C1='a' and C2='125';
ID	C1	C2
3	a	125
SELECT * FROM T1_SEC_COMBINED WHERE C1='AB';
ID	C1	C2
2	AB	中国
4	ab	美国
SELECT * FROM T1_SEC_COMBINED WHERE C1='ab';
ID	C1	C2
2	AB	中国
4	ab	美国
SELECT * FROM T1_SEC_COMBINED WHERE C1='ab' and C2='中国';
ID	C1	C2
2	AB	中国
SELECT * FROM T1_SEC_COMBINED WHERE C1 in ('ABC', 'CDE', 'cde');
ID	C1	C2
8	CDE	123
9	CDE	124
7	cde	abc
SELECT * FROM T1_SEC_COMBINED FORCE INDEX(IDX_C1C2) WHERE C1>'ab';
ID	C1	C2
5	B	123
6	b	124
8	CDE	123
9	CDE	124
7	cde	abc
14	一	中a国
18	一ab三	124
19	一a二b三c	123
17	一二三	中a国b美国
16	三	123
10	中国	一
11	中国人	二
15	二	124
12	美国	124
13	美国人	125
SELECT * FROM T1_SEC_COMBINED FORCE INDEX(IDX_C1C2) WHERE C1>'ab' and C2>'中国';
ID	C1	C2
11	中国人	二
SELECT * FROM T1_SEC_COMBINED FORCE INDEX(IDX_C1C2) WHERE C1>'a' and C2<'124';
ID	C1	C2
5	B	123
8	CDE	123
19	一a二b三c	123
16	三	123
SELECT * FROM T1_SEC_COMBINED FORCE INDEX(IDX_C1C2) WHERE C1>='a';
ID	C1	C2
3	a	125
1	A	a
2	AB	中国
4	ab	美国
5	B	123
6	b	124
8	CDE	123
9	CDE	124
7	cde	abc
14	一	中a国
18	一ab三	124
19	一a二b三c	123
17	一二三	中a国b美国
16	三	123
10	中国	一
11	中国人	二
15	二	124
12	美国	124
13	美国人	125
SELECT * FROM T1_SEC_COMBINED FORCE INDEX(IDX_C1C2) WHERE C1>='ab' and C2>='124';
ID	C1	C2
2	AB	中国
4	ab	美国
6	b	124
9	CDE	124
7	cde	abc
14	一	中a国
18	一ab三	124
17	一二三	中a国b美国
10	中国	一
11	中国人	二
15	二	124
12	美国	124
13	美国人	125
SELECT * FROM T1_SEC_COMBINED FORCE INDEX(IDX_C1C2) WHERE C1>='AB' and C2>='124';
ID	C1	C2
2	AB	中国
4	ab	美国
6	b	124
9	CDE	124
7	cde	abc
14	一	中a国
18	一ab三	124
17	一二三	中a国b美国
10	中国	一
11	中国人	二
15	二	124
12	美国	124
13	美国人	125
SELECT * FROM T1_SEC_COMBINED FORCE INDEX(IDX_C1C2) WHERE C1<'ab' and C2<'美国';
ID	C1	C2
3	a	125
1	A	a
SELECT * FROM T1_SEC_COMBINED FORCE INDEX(IDX_C1C2) WHERE C1<='AB' and C2>='124';
ID	C1	C2
3	a	125
1	A	a
2	AB	中国
4	ab	美国
SELECT * FROM T1_SEC_COMBINED FORCE INDEX(IDX_C1C2) WHERE C1>='一ab二' and C2<'二';
ID	C1	C2
19	一a二b三c	123
17	一二三	中a国b美国
16	三	123
10	中国	一
15	二	124
12	美国	124
13	美国人	125
SELECT * FROM T1_SEC_COMBINED FORCE INDEX(IDX_C1C2) WHERE C1='一ab三';
ID	C1	C2
18	一ab三	124
SELECT * FROM T1_SEC_COMBINED FORCE INDEX(IDX_C1C2) WHERE C1<='一';
ID	C1	C2
3	a	125
1	A	a
2	AB	中国
4	ab	美国
5	B	123
6	b	124
8	CDE	123
9	CDE	124
7	cde	abc
14	一	中a国
SELECT * FROM T1_SEC_COMBINED FORCE INDEX(IDX_C1C2) WHERE C1>='美a国' and C2<'125';
ID	C1	C2
12	美国	124
SELECT * FROM T1_SEC_COMBINED FORCE INDEX(IDX_C1C2) ORDER BY C1 ASC, C2 ASC;
ID	C1	C2
3	a	125
1	A	a
2	AB	中国
4	ab	美国
5	B	123
6	b	124
8	CDE	123
9	CDE	124
7	cde	abc
14	一	中a国
18	一ab三	124
19	一a二b三c	123
17	一二三	中a国b美国
16	三	123
10	中国	一
11	中国人	二
15	二	124
12	美国	124
13	美国人	125
SELECT * FROM T1_SEC_COMBINED FORCE INDEX(IDX_C1C2) ORDER BY C1 DESC, C2 ASC;
ID	C1	C2
13	美国人	125
12	美国	124
15	二	124
11	中国人	二
10	中国	一
16	三	123
17	一二三	中a国b美国
19	一a二b三c	123
18	一ab三	124
14	一	中a国
8	CDE	123
9	CDE	124
7	cde	abc
5	B	123
6	b	124
2	AB	中国
4	ab	美国
3	a	125
1	A	a
SELECT * FROM T1_SEC_COMBINED FORCE INDEX(IDX_C1C2) WHERE C1>'ab' ORDER BY C1,C2 DESC;
ID	C1	C2
6	b	124
5	B	123
7	cde	abc
9	CDE	124
8	CDE	123
14	一	中a国
18	一ab三	124
19	一a二b三c	123
17	一二三	中a国b美国
16	三	123
10	中国	一
11	中国人	二
15	二	124
12	美国	124
13	美国人	125
SELECT * FROM T1_SEC_COMBINED FORCE INDEX(IDX_C1C2) WHERE C1>'ab' ORDER BY C1,C2 ASC;
ID	C1	C2
5	B	123
6	b	124
8	CDE	123
9	CDE	124
7	cde	abc
14	一	中a国
18	一ab三	124
19	一a二b三c	123
17	一二三	中a国b美国
16	三	123
10	中国	一
11	中国人	二
15	二	124
12	美国	124
13	美国人	125
CREATE TABLE T1_SEC_COMBINED2(ID INT AUTO_INCREMENT, C1 INT, C2 VARCHAR(100), PRIMARY KEY(ID), KEY IDX_C1C2(C1,C2)) CHARACTER SET UTF8,COLLATE UTF8_GENERAL_CI;
Warnings:
Warning	3719	'utf8' is currently an alias for the character set UTF8MB3, but will be an alias for UTF8MB4 in a future release. Please consider using UTF8MB4 in order to be unambiguous.
Warning	3778	'utf8_general_ci' is a collation of the deprecated character set UTF8MB3. Please consider using UTF8MB4 with an appropriate collation instead.
INSERT INTO T1_SEC_COMBINED2(C1,C2) VALUES(1, 'a');
INSERT INTO T1_SEC_COMBINED2(C1,C2) VALUES(1, '中国');
INSERT INTO T1_SEC_COMBINED2(C1,C2) VALUES(2, '125');
INSERT INTO T1_SEC_COMBINED2(C1,C2) VALUES(3, '美国');
INSERT INTO T1_SEC_COMBINED2(C1,C2) VALUES(2, '123');
INSERT INTO T1_SEC_COMBINED2(C1,C2) VALUES(3, '124');
INSERT INTO T1_SEC_COMBINED2(C1,C2) VALUES(2, 'abc');
INSERT INTO T1_SEC_COMBINED2(C1,C2) VALUES(2, '123');
INSERT INTO T1_SEC_COMBINED2(C1,C2) VALUES(3, '124');
INSERT INTO T1_SEC_COMBINED2(C1,C2) VALUES(2, '一');
INSERT INTO T1_SEC_COMBINED2(C1,C2) VALUES(1, '二');
INSERT INTO T1_SEC_COMBINED2(C1,C2) VALUES(4, '124');
INSERT INTO T1_SEC_COMBINED2(C1,C2) VALUES(1, '125');
INSERT INTO T1_SEC_COMBINED2(C1,C2) VALUES(2, '中a国');
INSERT INTO T1_SEC_COMBINED2(C1,C2) VALUES(3, '124');
INSERT INTO T1_SEC_COMBINED2(C1,C2) VALUES(1, '123');
INSERT INTO T1_SEC_COMBINED2(C1,C2) VALUES(2,'中a国b美国');
INSERT INTO T1_SEC_COMBINED2(C1,C2) VALUES(3,'124');
INSERT INTO T1_SEC_COMBINED2(C1,C2) VALUES(1,'123');
SELECT * FROM T1_SEC_COMBINED2 WHERE C1=1;
ID	C1	C2
16	1	123
19	1	123
13	1	125
1	1	a
2	1	中国
11	1	二
SELECT * FROM T1_SEC_COMBINED2 WHERE C1=2 and C2='125';
ID	C1	C2
3	2	125
SELECT * FROM T1_SEC_COMBINED2 WHERE C1=2;
ID	C1	C2
5	2	123
8	2	123
3	2	125
7	2	abc
10	2	一
14	2	中a国
17	2	中a国b美国
SELECT * FROM T1_SEC_COMBINED2 WHERE C1=3;
ID	C1	C2
6	3	124
9	3	124
15	3	124
18	3	124
4	3	美国
SELECT * FROM T1_SEC_COMBINED2 WHERE C1=1 and C2='中国';
ID	C1	C2
2	1	中国
SELECT * FROM T1_SEC_COMBINED2 WHERE C1 in (1, 3, 4);
ID	C1	C2
16	1	123
19	1	123
13	1	125
1	1	a
2	1	中国
11	1	二
6	3	124
9	3	124
15	3	124
18	3	124
4	3	美国
12	4	124
SELECT * FROM T1_SEC_COMBINED2 FORCE INDEX(IDX_C1C2) WHERE C1>1;
ID	C1	C2
5	2	123
8	2	123
3	2	125
7	2	abc
10	2	一
14	2	中a国
17	2	中a国b美国
6	3	124
9	3	124
15	3	124
18	3	124
4	3	美国
12	4	124
SELECT * FROM T1_SEC_COMBINED2 FORCE INDEX(IDX_C1C2) WHERE C1>1 and C2>'中国';
ID	C1	C2
4	3	美国
SELECT * FROM T1_SEC_COMBINED2 FORCE INDEX(IDX_C1C2) WHERE C1>2 and C2<'124';
ID	C1	C2
SELECT * FROM T1_SEC_COMBINED2 FORCE INDEX(IDX_C1C2) WHERE C1>=2;
ID	C1	C2
5	2	123
8	2	123
3	2	125
7	2	abc
10	2	一
14	2	中a国
17	2	中a国b美国
6	3	124
9	3	124
15	3	124
18	3	124
4	3	美国
12	4	124
SELECT * FROM T1_SEC_COMBINED2 FORCE INDEX(IDX_C1C2) WHERE C1>=2 and C2>='124';
ID	C1	C2
3	2	125
7	2	abc
10	2	一
14	2	中a国
17	2	中a国b美国
6	3	124
9	3	124
15	3	124
18	3	124
4	3	美国
12	4	124
SELECT * FROM T1_SEC_COMBINED2 FORCE INDEX(IDX_C1C2) WHERE C1>=2 and C2>='124';
ID	C1	C2
3	2	125
7	2	abc
10	2	一
14	2	中a国
17	2	中a国b美国
6	3	124
9	3	124
15	3	124
18	3	124
4	3	美国
12	4	124
SELECT * FROM T1_SEC_COMBINED2 FORCE INDEX(IDX_C1C2) WHERE C1<3 and C2<'美国';
ID	C1	C2
16	1	123
19	1	123
13	1	125
1	1	a
2	1	中国
11	1	二
5	2	123
8	2	123
3	2	125
7	2	abc
10	2	一
14	2	中a国
17	2	中a国b美国
SELECT * FROM T1_SEC_COMBINED2 FORCE INDEX(IDX_C1C2) WHERE C1<=2 and C2>='124';
ID	C1	C2
13	1	125
1	1	a
2	1	中国
11	1	二
3	2	125
7	2	abc
10	2	一
14	2	中a国
17	2	中a国b美国
SELECT * FROM T1_SEC_COMBINED2 FORCE INDEX(IDX_C1C2) WHERE C1>=1 and C2<'二';
ID	C1	C2
16	1	123
19	1	123
13	1	125
1	1	a
2	1	中国
5	2	123
8	2	123
3	2	125
7	2	abc
10	2	一
14	2	中a国
17	2	中a国b美国
6	3	124
9	3	124
15	3	124
18	3	124
12	4	124
SELECT * FROM T1_SEC_COMBINED2 FORCE INDEX(IDX_C1C2) WHERE C1=1;
ID	C1	C2
16	1	123
19	1	123
13	1	125
1	1	a
2	1	中国
11	1	二
SELECT * FROM T1_SEC_COMBINED2 FORCE INDEX(IDX_C1C2) WHERE C1<=2;
ID	C1	C2
16	1	123
19	1	123
13	1	125
1	1	a
2	1	中国
11	1	二
5	2	123
8	2	123
3	2	125
7	2	abc
10	2	一
14	2	中a国
17	2	中a国b美国
SELECT * FROM T1_SEC_COMBINED2 FORCE INDEX(IDX_C1C2) WHERE C1>=2 and C2<'125';
ID	C1	C2
5	2	123
8	2	123
6	3	124
9	3	124
15	3	124
18	3	124
12	4	124
SELECT * FROM T1_SEC_COMBINED2 FORCE INDEX(IDX_C1C2) ORDER BY C1 ASC, C2 ASC;
ID	C1	C2
16	1	123
19	1	123
13	1	125
1	1	a
2	1	中国
11	1	二
5	2	123
8	2	123
3	2	125
7	2	abc
10	2	一
14	2	中a国
17	2	中a国b美国
6	3	124
9	3	124
15	3	124
18	3	124
4	3	美国
12	4	124
SELECT * FROM T1_SEC_COMBINED2 FORCE INDEX(IDX_C1C2) WHERE C1>1 ORDER BY C1,C2,ID DESC;
ID	C1	C2
8	2	123
5	2	123
3	2	125
7	2	abc
10	2	一
14	2	中a国
17	2	中a国b美国
18	3	124
15	3	124
9	3	124
6	3	124
4	3	美国
12	4	124
SELECT * FROM T1_SEC_COMBINED2 FORCE INDEX(IDX_C1C2) WHERE C1>1 ORDER BY C1,C2,ID ASC;
ID	C1	C2
5	2	123
8	2	123
3	2	125
7	2	abc
10	2	一
14	2	中a国
17	2	中a国b美国
6	3	124
9	3	124
15	3	124
18	3	124
4	3	美国
12	4	124
CREATE TABLE T1_SEC_COMBINED3(ID INT AUTO_INCREMENT, C1 VARCHAR(100), C2 INT, PRIMARY KEY(ID), KEY IDX_C1C2(C1,C2)) CHARACTER SET UTF8,COLLATE UTF8_GENERAL_CI;
Warnings:
Warning	3719	'utf8' is currently an alias for the character set UTF8MB3, but will be an alias for UTF8MB4 in a future release. Please consider using UTF8MB4 in order to be unambiguous.
Warning	3778	'utf8_general_ci' is a collation of the deprecated character set UTF8MB3. Please consider using UTF8MB4 with an appropriate collation instead.
INSERT INTO T1_SEC_COMBINED3(C1,C2) VALUES('A', 1);
INSERT INTO T1_SEC_COMBINED3(C1,C2) VALUES('AB', 2);
INSERT INTO T1_SEC_COMBINED3(C1,C2) VALUES('a', 3);
INSERT INTO T1_SEC_COMBINED3(C1,C2) VALUES('ab', 1);
INSERT INTO T1_SEC_COMBINED3(C1,C2) VALUES('B', 2);
INSERT INTO T1_SEC_COMBINED3(C1,C2) VALUES('b', 3);
INSERT INTO T1_SEC_COMBINED3(C1,C2) VALUES('cde', 1);
INSERT INTO T1_SEC_COMBINED3(C1,C2) VALUES('CDE', 2);
INSERT INTO T1_SEC_COMBINED3(C1,C2) VALUES('CDE', 3);
INSERT INTO T1_SEC_COMBINED3(C1,C2) VALUES('中国', 4);
INSERT INTO T1_SEC_COMBINED3(C1,C2) VALUES('中国人', 3);
INSERT INTO T1_SEC_COMBINED3(C1,C2) VALUES('美国', 2);
INSERT INTO T1_SEC_COMBINED3(C1,C2) VALUES('美国人', 4);
INSERT INTO T1_SEC_COMBINED3(C1,C2) VALUES('一', 3);
INSERT INTO T1_SEC_COMBINED3(C1,C2) VALUES('二', 2);
INSERT INTO T1_SEC_COMBINED3(C1,C2) VALUES('三', 1);
INSERT INTO T1_SEC_COMBINED3(C1,C2) VALUES('一二三', 4);
INSERT INTO T1_SEC_COMBINED3(C1,C2) VALUES('一ab三', 2);
INSERT INTO T1_SEC_COMBINED3(C1,C2) VALUES('一a二b三c',1);
SELECT * FROM T1_SEC_COMBINED3 WHERE C1='A';
ID	C1	C2
1	A	1
3	a	3
SELECT * FROM T1_SEC_COMBINED3 WHERE C1='a' and C2=1;
ID	C1	C2
1	A	1
SELECT * FROM T1_SEC_COMBINED3 WHERE C1='AB';
ID	C1	C2
4	ab	1
2	AB	2
SELECT * FROM T1_SEC_COMBINED3 WHERE C1='ab';
ID	C1	C2
4	ab	1
2	AB	2
SELECT * FROM T1_SEC_COMBINED3 WHERE C1='ab' and C2=2;
ID	C1	C2
2	AB	2
SELECT * FROM T1_SEC_COMBINED3 WHERE C1 in ('ABC', 'CDE', 'cde');
ID	C1	C2
7	cde	1
8	CDE	2
9	CDE	3
SELECT * FROM T1_SEC_COMBINED3 WHERE C1>'ab';
ID	C1	C2
5	B	2
6	b	3
7	cde	1
8	CDE	2
9	CDE	3
14	一	3
18	一ab三	2
19	一a二b三c	1
17	一二三	4
16	三	1
10	中国	4
11	中国人	3
15	二	2
12	美国	2
13	美国人	4
SELECT * FROM T1_SEC_COMBINED3 WHERE C1>'ab' and C2>1;
ID	C1	C2
5	B	2
6	b	3
8	CDE	2
9	CDE	3
14	一	3
18	一ab三	2
17	一二三	4
10	中国	4
11	中国人	3
15	二	2
12	美国	2
13	美国人	4
SELECT * FROM T1_SEC_COMBINED3 WHERE C1>'a' and C2<4;
ID	C1	C2
4	ab	1
2	AB	2
5	B	2
6	b	3
7	cde	1
8	CDE	2
9	CDE	3
14	一	3
18	一ab三	2
19	一a二b三c	1
16	三	1
11	中国人	3
15	二	2
12	美国	2
SELECT * FROM T1_SEC_COMBINED3 WHERE C1>='a';
ID	C1	C2
1	A	1
3	a	3
4	ab	1
2	AB	2
5	B	2
6	b	3
7	cde	1
8	CDE	2
9	CDE	3
14	一	3
18	一ab三	2
19	一a二b三c	1
17	一二三	4
16	三	1
10	中国	4
11	中国人	3
15	二	2
12	美国	2
13	美国人	4
SELECT * FROM T1_SEC_COMBINED3 WHERE C1>='ab' and C2>=1;
ID	C1	C2
4	ab	1
2	AB	2
5	B	2
6	b	3
7	cde	1
8	CDE	2
9	CDE	3
14	一	3
18	一ab三	2
19	一a二b三c	1
17	一二三	4
16	三	1
10	中国	4
11	中国人	3
15	二	2
12	美国	2
13	美国人	4
SELECT * FROM T1_SEC_COMBINED3 WHERE C1>='AB' and C2>=2;
ID	C1	C2
2	AB	2
5	B	2
6	b	3
8	CDE	2
9	CDE	3
14	一	3
18	一ab三	2
17	一二三	4
10	中国	4
11	中国人	3
15	二	2
12	美国	2
13	美国人	4
SELECT * FROM T1_SEC_COMBINED3 WHERE C1<'ab' and C2<4;
ID	C1	C2
1	A	1
3	a	3
SELECT * FROM T1_SEC_COMBINED3 WHERE C1<='AB' and C2>=2;
ID	C1	C2
3	a	3
2	AB	2
SELECT * FROM T1_SEC_COMBINED3 WHERE C1>='一ab二' and C2<3;
ID	C1	C2
19	一a二b三c	1
16	三	1
15	二	2
12	美国	2
SELECT * FROM T1_SEC_COMBINED3 WHERE C1='一ab三';
ID	C1	C2
18	一ab三	2
SELECT * FROM T1_SEC_COMBINED3 WHERE C1<='一';
ID	C1	C2
1	A	1
3	a	3
4	ab	1
2	AB	2
5	B	2
6	b	3
7	cde	1
8	CDE	2
9	CDE	3
14	一	3
SELECT * FROM T1_SEC_COMBINED3 WHERE C1>='美a国' and C2<3;
ID	C1	C2
12	美国	2
SELECT * FROM T1_SEC_COMBINED3 ORDER BY C1 ASC, C2 ASC;
ID	C1	C2
1	A	1
3	a	3
4	ab	1
2	AB	2
5	B	2
6	b	3
7	cde	1
8	CDE	2
9	CDE	3
14	一	3
18	一ab三	2
19	一a二b三c	1
17	一二三	4
16	三	1
10	中国	4
11	中国人	3
15	二	2
12	美国	2
13	美国人	4
SELECT * FROM T1_SEC_COMBINED3 ORDER BY C1 DESC, C2 ASC;
ID	C1	C2
13	美国人	4
12	美国	2
15	二	2
11	中国人	3
10	中国	4
16	三	1
17	一二三	4
19	一a二b三c	1
18	一ab三	2
14	一	3
7	cde	1
8	CDE	2
9	CDE	3
5	B	2
6	b	3
4	ab	1
2	AB	2
1	A	1
3	a	3
SELECT * FROM T1_SEC_COMBINED3 WHERE C1>'ab' ORDER BY C1,C2 DESC;
ID	C1	C2
6	b	3
5	B	2
9	CDE	3
8	CDE	2
7	cde	1
14	一	3
18	一ab三	2
19	一a二b三c	1
17	一二三	4
16	三	1
10	中国	4
11	中国人	3
15	二	2
12	美国	2
13	美国人	4
SELECT * FROM T1_SEC_COMBINED3 WHERE C1>'ab' ORDER BY C1,C2 ASC;
ID	C1	C2
5	B	2
6	b	3
7	cde	1
8	CDE	2
9	CDE	3
14	一	3
18	一ab三	2
19	一a二b三c	1
17	一二三	4
16	三	1
10	中国	4
11	中国人	3
15	二	2
12	美国	2
13	美国人	4
CREATE TABLE T1_SEC_COMBINED_CHAR(ID INT AUTO_INCREMENT, C1 CHAR(100), C2 CHAR(100), PRIMARY KEY(ID), KEY IDX_C2C1(C2,C1)) CHARACTER SET UTF8,COLLATE UTF8_GENERAL_CI;
Warnings:
Warning	3719	'utf8' is currently an alias for the character set UTF8MB3, but will be an alias for UTF8MB4 in a future release. Please consider using UTF8MB4 in order to be unambiguous.
Warning	3778	'utf8_general_ci' is a collation of the deprecated character set UTF8MB3. Please consider using UTF8MB4 with an appropriate collation instead.
INSERT INTO T1_SEC_COMBINED_CHAR(C1,C2) VALUES('A', 'a');
INSERT INTO T1_SEC_COMBINED_CHAR(C1,C2) VALUES('AB', '中国');
INSERT INTO T1_SEC_COMBINED_CHAR(C1,C2) VALUES('a', '125');
INSERT INTO T1_SEC_COMBINED_CHAR(C1,C2) VALUES('ab', '美国');
INSERT INTO T1_SEC_COMBINED_CHAR(C1,C2) VALUES('B', '123');
INSERT INTO T1_SEC_COMBINED_CHAR(C1,C2) VALUES('b', '124');
INSERT INTO T1_SEC_COMBINED_CHAR(C1,C2) VALUES('cde', 'abc');
INSERT INTO T1_SEC_COMBINED_CHAR(C1,C2) VALUES('CDE', '123');
INSERT INTO T1_SEC_COMBINED_CHAR(C1,C2) VALUES('CDE', '124');
INSERT INTO T1_SEC_COMBINED_CHAR(C1,C2) VALUES('中国', '一');
INSERT INTO T1_SEC_COMBINED_CHAR(C1,C2) VALUES('中国人', '二');
INSERT INTO T1_SEC_COMBINED_CHAR(C1,C2) VALUES('美国', '124');
INSERT INTO T1_SEC_COMBINED_CHAR(C1,C2) VALUES('美国人', '125');
INSERT INTO T1_SEC_COMBINED_CHAR(C1,C2) VALUES('一', '中a国');
INSERT INTO T1_SEC_COMBINED_CHAR(C1,C2) VALUES('二', '124');
INSERT INTO T1_SEC_COMBINED_CHAR(C1,C2) VALUES('三', '123');
INSERT INTO T1_SEC_COMBINED_CHAR(C1,C2) VALUES('一二三','中a国b美国');
INSERT INTO T1_SEC_COMBINED_CHAR(C1,C2) VALUES('一ab三','124');
INSERT INTO T1_SEC_COMBINED_CHAR(C1,C2) VALUES('一a二b三c','123');
SELECT * FROM T1_SEC_COMBINED_CHAR WHERE C1='A';
ID	C1	C2
3	a	125
1	A	a
SELECT * FROM T1_SEC_COMBINED_CHAR WHERE C1='a' and C2='125';
ID	C1	C2
3	a	125
SELECT * FROM T1_SEC_COMBINED_CHAR WHERE C1='AB';
ID	C1	C2
2	AB	中国
4	ab	美国
SELECT * FROM T1_SEC_COMBINED_CHAR WHERE C1='ab';
ID	C1	C2
2	AB	中国
4	ab	美国
SELECT * FROM T1_SEC_COMBINED_CHAR WHERE C1='ab' and C2='美国';
ID	C1	C2
4	ab	美国
SELECT * FROM T1_SEC_COMBINED_CHAR WHERE C1 in ('ABC', 'CDE', 'cde');
ID	C1	C2
8	CDE	123
9	CDE	124
7	cde	abc
SELECT * FROM T1_SEC_COMBINED_CHAR WHERE C1>'ab';
ID	C1	C2
5	B	123
8	CDE	123
19	一a二b三c	123
16	三	123
6	b	124
9	CDE	124
18	一ab三	124
15	二	124
12	美国	124
13	美国人	125
7	cde	abc
10	中国	一
14	一	中a国
17	一二三	中a国b美国
11	中国人	二
SELECT * FROM T1_SEC_COMBINED_CHAR WHERE C1>'ab' and C2>'中国';
ID	C1	C2
11	中国人	二
SELECT * FROM T1_SEC_COMBINED_CHAR WHERE C1>'a' and C2<'124';
ID	C1	C2
5	B	123
8	CDE	123
19	一a二b三c	123
16	三	123
SELECT * FROM T1_SEC_COMBINED_CHAR WHERE C1>='a';
ID	C1	C2
5	B	123
8	CDE	123
19	一a二b三c	123
16	三	123
6	b	124
9	CDE	124
18	一ab三	124
15	二	124
12	美国	124
3	a	125
13	美国人	125
1	A	a
7	cde	abc
10	中国	一
14	一	中a国
17	一二三	中a国b美国
2	AB	中国
11	中国人	二
4	ab	美国
SELECT * FROM T1_SEC_COMBINED_CHAR WHERE C1>='ab' and C2>='124';
ID	C1	C2
6	b	124
9	CDE	124
18	一ab三	124
15	二	124
12	美国	124
13	美国人	125
7	cde	abc
10	中国	一
14	一	中a国
17	一二三	中a国b美国
2	AB	中国
11	中国人	二
4	ab	美国
SELECT * FROM T1_SEC_COMBINED_CHAR WHERE C1>='AB' and C2>='124';
ID	C1	C2
6	b	124
9	CDE	124
18	一ab三	124
15	二	124
12	美国	124
13	美国人	125
7	cde	abc
10	中国	一
14	一	中a国
17	一二三	中a国b美国
2	AB	中国
11	中国人	二
4	ab	美国
SELECT * FROM T1_SEC_COMBINED_CHAR WHERE C1<'ab' and C2<'美国';
ID	C1	C2
3	a	125
1	A	a
SELECT * FROM T1_SEC_COMBINED_CHAR WHERE C1<='AB' and C2>='124';
ID	C1	C2
3	a	125
1	A	a
2	AB	中国
4	ab	美国
SELECT * FROM T1_SEC_COMBINED_CHAR ORDER BY C1 ASC, C2 ASC, ID ASC;
ID	C1	C2
3	a	125
1	A	a
2	AB	中国
4	ab	美国
5	B	123
6	b	124
8	CDE	123
9	CDE	124
7	cde	abc
14	一	中a国
18	一ab三	124
19	一a二b三c	123
17	一二三	中a国b美国
16	三	123
10	中国	一
11	中国人	二
15	二	124
12	美国	124
13	美国人	125
SELECT * FROM T1_SEC_COMBINED_CHAR ORDER BY C1 DESC, C2 ASC, ID ASC;
ID	C1	C2
13	美国人	125
12	美国	124
15	二	124
11	中国人	二
10	中国	一
16	三	123
17	一二三	中a国b美国
19	一a二b三c	123
18	一ab三	124
14	一	中a国
8	CDE	123
9	CDE	124
7	cde	abc
5	B	123
6	b	124
2	AB	中国
4	ab	美国
3	a	125
1	A	a
SELECT * FROM T1_SEC_COMBINED_CHAR WHERE C1>'ab' ORDER BY C1,C2,ID DESC;
ID	C1	C2
5	B	123
6	b	124
8	CDE	123
9	CDE	124
7	cde	abc
14	一	中a国
18	一ab三	124
19	一a二b三c	123
17	一二三	中a国b美国
16	三	123
10	中国	一
11	中国人	二
15	二	124
12	美国	124
13	美国人	125
SELECT * FROM T1_SEC_COMBINED_CHAR WHERE C1>'ab' ORDER BY C1,C2,ID ASC;
ID	C1	C2
5	B	123
6	b	124
8	CDE	123
9	CDE	124
7	cde	abc
14	一	中a国
18	一ab三	124
19	一a二b三c	123
17	一二三	中a国b美国
16	三	123
10	中国	一
11	中国人	二
15	二	124
12	美国	124
13	美国人	125
DROP TABLE T1_COLUMN;
DROP TABLE T1_TEXT;
DROP TABLE T1_PK;
DROP TABLE T1_PK_CHAR;
DROP TABLE T1_SEC;
DROP TABLE T1_SEC_CHAR;
DROP TABLE T1_UNIQUE;
DROP TABLE T1_UNIQUE_CHAR;
DROP TABLE T1_SEC_COMBINED;
DROP TABLE T1_SEC_COMBINED2;
DROP TABLE T1_SEC_COMBINED3;
DROP TABLE T1_SEC_COMBINED_CHAR;
