#############################
# Column Operations
#############################
create table t1 (c1 int, c2 int, c3 int, unique key(c1), key (c2));
insert into t1 (c1, c2, c3) values (1, 10, 10);
insert into t1 (c1, c2, c3) values (3, 30, 30);
#
# Add column
#
alter table t1 add column c4 int after c2, ALGORITHM=INSTANT;
insert into t1 (c1, c2, c4, c3) values (5, 50, 50, 50);
create table t2 (c1 int, c2 int, c4 int, c3 int, unique key(c1), key (c2));
alter table t2 discard tablespace;
flush table t1 for export;
unlock tables;
alter table t2 import tablespace;
select * from t2;
c1	c2	c4	c3
1	10	NULL	10
3	30	NULL	30
5	50	50	50
select c1 from t2 force index (c1);
c1
1
3
5
select c2 from t2 force index (c2);
c2
10
30
50
insert into t2 (c1, c2, c4, c3) values (7, 70, 70, 70);
update t2 set c1 = c1 + 1;
update t2 set c1 = c1 + 1;
update t2 set c2 = c2 + 1;
update t2 set c2 = c2 + 1;
select * from t2;
c1	c2	c4	c3
3	12	NULL	10
5	32	NULL	30
7	52	50	50
9	72	70	70
select c1 from t2 force index (c1);
c1
3
5
7
9
select c2 from t2 force index (c2);
c2
12
32
52
72
delete from t2;
drop table t2;
#
# Drop column
#
alter table t1 drop column c3, ALGORITHM=INSTANT;
insert into t1 (c1, c2, c4) values (7, 70, 70);
alter table t1 drop column c4, ALGORITHM=INSTANT;
insert into t1 (c1, c2) values (9, 90);
create table t2 (c1 int, c2 int, unique key(c1), key (c2));
alter table t2 discard tablespace;
flush table t1 for export;
unlock tables;
alter table t2 import tablespace;
select * from t2;
c1	c2
1	10
3	30
5	50
7	70
9	90
select c1 from t2 force index (c1);
c1
1
3
5
7
9
select c2 from t2 force index (c2);
c2
10
30
50
70
90
insert into t2 (c1, c2) values (11, 110);
update t2 set c1 = c1 + 1;
update t2 set c1 = c1 + 1;
update t2 set c2 = c2 + 1;
update t2 set c2 = c2 + 1;
select * from t2;
c1	c2
3	12
5	32
7	52
9	72
11	92
13	112
select c1 from t2 force index (c1);
c1
3
5
7
9
11
13
select c2 from t2 force index (c2);
c2
12
32
52
72
92
112
delete from t2;
drop table t2;
#
# Rename column
#
alter table t1 change c2 c5 int, ALGORITHM=INSTANT;
insert into t1 (c1, c5) values (11, 110);
create table t2 (c1 int, c5 int, unique key(c1), key c2 (c5));
alter table t2 discard tablespace;
flush table t1 for export;
unlock tables;
alter table t2 import tablespace;
select * from t2;
c1	c5
1	10
3	30
5	50
7	70
9	90
11	110
select c1 from t2 force index (c1);
c1
1
3
5
7
9
11
select c5 from t2 force index (c2);
c5
10
30
50
70
90
110
insert into t2 (c1, c5) values (13, 130);
update t2 set c1 = c1 + 1;
update t2 set c1 = c1 + 1;
update t2 set c5 = c5 + 1;
update t2 set c5 = c5 + 1;
select * from t2;
c1	c5
3	12
5	32
7	52
9	72
11	92
13	112
15	132
select c1 from t2 force index (c1);
c1
3
5
7
9
11
13
15
select c5 from t2 force index (c2);
c5
12
32
52
72
92
112
132
delete from t2;
drop table t2;
#
# Setting a column default value
#
alter table t1 ALTER COLUMN c5 SET DEFAULT 80, ALGORITHM=INSTANT;
insert into t1 (c1, c5) values (15, 150);
insert into t1 (c1) values (17);
create table t2 (c1 int, c5 int default 80, unique key(c1), key c2 (c5));
alter table t2 discard tablespace;
flush table t1 for export;
unlock tables;
alter table t2 import tablespace;
select * from t2;
c1	c5
1	10
3	30
5	50
7	70
9	90
11	110
15	150
17	80
select c1 from t2 force index (c1);
c1
1
3
5
7
9
11
15
17
select c5 from t2 force index (c2);
c5
10
30
50
70
80
90
110
150
insert into t2 (c1, c5) values (19, 190);
insert into t2 (c1) values (21);
update t2 set c1 = c1 + 1;
update t2 set c1 = c1 + 1;
update t2 set c5 = c5 + 1;
update t2 set c5 = c5 + 1;
select * from t2;
c1	c5
3	12
5	32
7	52
9	72
11	92
13	112
17	152
19	82
21	192
23	82
select c1 from t2 force index (c1);
c1
3
5
7
9
11
13
17
19
21
23
select c5 from t2 force index (c2);
c5
12
32
52
72
82
82
92
112
152
192
delete from t2;
drop table t2;
#
# Dropping a column default value
#
ALTER TABLE t1 ALTER COLUMN c1 DROP DEFAULT, ALGORITHM=INSTANT;
insert into t1 (c1, c5) values (23, 230);
create table t2 (c1 int, c5 int, unique key(c1), key c2 (c5));
alter table t2 discard tablespace;
flush table t1 for export;
unlock tables;
alter table t2 import tablespace;
select * from t2;
c1	c5
1	10
3	30
5	50
7	70
9	90
11	110
15	150
17	80
23	230
select c1 from t2 force index (c1);
c1
1
3
5
7
9
11
15
17
23
select c5 from t2 force index (c2);
c5
10
30
50
70
80
90
110
150
230
insert into t2 (c1, c5) values (25, 250);
update t2 set c1 = c1 + 1;
update t2 set c1 = c1 + 1;
update t2 set c5 = c5 + 1;
update t2 set c5 = c5 + 1;
select * from t2;
c1	c5
3	12
5	32
7	52
9	72
11	92
13	112
17	152
19	82
25	232
27	252
select c1 from t2 force index (c1);
c1
3
5
7
9
11
13
17
19
25
27
select c5 from t2 force index (c2);
c5
12
32
52
72
82
92
112
152
232
252
delete from t2;
drop table t2;
#
# Modifying the definition of an ENUM or SET column
#
alter table t1 add column c6 enum ('a', 'b', 'c'), ALGORITHM=INSTANT;
insert into t1 (c1, c5, c6) values (27, 270, 'a');
ALTER TABLE t1 MODIFY COLUMN c6 ENUM('a', 'b', 'c', 'd'), ALGORITHM=INSTANT;
insert into t1 (c1, c5, c6) values (29, 290, 'd');
create table t2 (c1 int, c5 int, c6 ENUM('a', 'b', 'c', 'd'), unique key(c1), key c2 (c5));
alter table t2 discard tablespace;
flush table t1 for export;
unlock tables;
alter table t2 import tablespace;
select * from t2;
c1	c5	c6
1	10	NULL
3	30	NULL
5	50	NULL
7	70	NULL
9	90	NULL
11	110	NULL
15	150	NULL
17	80	NULL
23	230	NULL
27	270	a
29	290	d
select c1 from t2 force index (c1);
c1
1
3
5
7
9
11
15
17
23
27
29
select c5 from t2 force index (c2);
c5
10
30
50
70
80
90
110
150
230
270
290
insert into t2 (c1, c5, c6) values (31, 310, 'd');
update t2 set c1 = c1 + 1;
update t2 set c1 = c1 + 1;
update t2 set c5 = c5 + 1;
update t2 set c5 = c5 + 1;
select * from t2;
c1	c5	c6
3	12	NULL
5	32	NULL
7	52	NULL
9	72	NULL
11	92	NULL
13	112	NULL
17	152	NULL
19	82	NULL
25	232	NULL
29	272	a
31	292	d
33	312	d
select c1 from t2 force index (c1);
c1
3
5
7
9
11
13
17
19
25
29
31
33
select c5 from t2 force index (c2);
c5
12
32
52
72
82
92
112
152
232
272
292
312
delete from t2;
drop table t2;
#############################
# Generated Column Operations
#############################
#
# Adding a VIRTUAL column
#
ALTER TABLE t1 ADD COLUMN (c7 INT GENERATED ALWAYS AS (c1 + 1) VIRTUAL), ALGORITHM=INSTANT;
insert into t1 (c1, c5, c6) values (33, 330, 'a');
create table t2 (c1 int, c5 int, c6 ENUM('a', 'b', 'c', 'd'), c7 INT GENERATED ALWAYS AS (c1 + 1) VIRTUAL, unique key(c1), key c2 (c5));
alter table t2 discard tablespace;
flush table t1 for export;
unlock tables;
alter table t2 import tablespace;
select * from t2;
c1	c5	c6	c7
1	10	NULL	2
3	30	NULL	4
5	50	NULL	6
7	70	NULL	8
9	90	NULL	10
11	110	NULL	12
15	150	NULL	16
17	80	NULL	18
23	230	NULL	24
27	270	a	28
29	290	d	30
33	330	a	34
select c1 from t2 force index (c1);
c1
1
3
5
7
9
11
15
17
23
27
29
33
select c5 from t2 force index (c2);
c5
10
30
50
70
80
90
110
150
230
270
290
330
insert into t2 (c1, c5, c6) values (35, 350, 'd');
update t2 set c1 = c1 + 1;
update t2 set c1 = c1 + 1;
update t2 set c5 = c5 + 1;
update t2 set c5 = c5 + 1;
select * from t2;
c1	c5	c6	c7
3	12	NULL	4
5	32	NULL	6
7	52	NULL	8
9	72	NULL	10
11	92	NULL	12
13	112	NULL	14
17	152	NULL	18
19	82	NULL	20
25	232	NULL	26
29	272	a	30
31	292	d	32
35	332	a	36
37	352	d	38
select c1 from t2 force index (c1);
c1
3
5
7
9
11
13
17
19
25
29
31
35
37
select c5 from t2 force index (c2);
c5
12
32
52
72
82
92
112
152
232
272
292
332
352
delete from t2;
drop table t2;
# cleanup
drop table t1;
