SET SESSION debug= '+d,skip_dd_table_access_check';
CREATE TABLE t1(a int,KEY(a));
ANALYZE TABLE t1;
Table	Op	Msg_type	Msg_text
test.t1	analyze	status	OK
SELECT TABLE_NAME, ENGINE, ROW_FORMAT, TABLE_ROWS, AVG_ROW_LENGTH, DATA_LENGTH,
MAX_DATA_LENGTH, INDEX_LENGTH, DATA_FREE, AUTO_INCREMENT from
information_schema.tables WHERE table_name='t1';
TABLE_NAME	ENGINE	ROW_FORMAT	TABLE_ROWS	AVG_ROW_LENGTH	DATA_LENGTH	MAX_DATA_LENGTH	INDEX_LENGTH	DATA_FREE	AUTO_INCREMENT
t1	XENGINE	Fixed	0	0	0	0	0	0	NULL
SELECT table_name, table_rows, avg_row_length, data_length, max_data_length,
index_length, data_free, auto_increment from mysql.table_stats where table_name='t1';
table_name	table_rows	avg_row_length	data_length	max_data_length	index_length	data_free	auto_increment
t1	0	0	0	0	0	0	0
SELECT TABLE_NAME,COLUMN_NAME, INDEX_NAME, CARDINALITY from
information_schema.statistics where table_name='t1' ORDER BY COLUMN_NAME;
TABLE_NAME	COLUMN_NAME	INDEX_NAME	CARDINALITY
t1	a	a	0
SELECT table_name, column_name, index_name, cardinality from mysql.index_stats
where table_name='t1' ORDER bY column_name;
table_name	column_name	index_name	cardinality
t1	a	a	0
SET SESSION information_schema_stats_expiry=1;
INSERT INTO t1 VALUES(3);
ANALYZE TABLE t1;
Table	Op	Msg_type	Msg_text
test.t1	analyze	status	OK
SELECT SLEEP(2);
SLEEP(2)
0
SELECT TABLE_NAME, ENGINE, ROW_FORMAT, TABLE_ROWS, AVG_ROW_LENGTH, DATA_LENGTH,
MAX_DATA_LENGTH, INDEX_LENGTH, DATA_FREE, AUTO_INCREMENT from
information_schema.tables WHERE table_name='t1';
TABLE_NAME	ENGINE	ROW_FORMAT	TABLE_ROWS	AVG_ROW_LENGTH	DATA_LENGTH	MAX_DATA_LENGTH	INDEX_LENGTH	DATA_FREE	AUTO_INCREMENT
t1	XENGINE	Fixed	1	2097203	2097203	0	2097152	0	1
SELECT table_name, table_rows, avg_row_length, data_length, max_data_length,
index_length, data_free, auto_increment from mysql.table_stats where table_name='t1';
table_name	table_rows	avg_row_length	data_length	max_data_length	index_length	data_free	auto_increment
t1	1	2097203	2097203	0	2097152	0	1
SELECT TABLE_NAME,COLUMN_NAME, INDEX_NAME, CARDINALITY from
information_schema.statistics where table_name='t1' ORDER BY COLUMN_NAME;
TABLE_NAME	COLUMN_NAME	INDEX_NAME	CARDINALITY
t1	a	a	1
SELECT table_name, column_name, index_name, cardinality from mysql.index_stats
where table_name='t1' ORDER BY column_name;
table_name	column_name	index_name	cardinality
t1	a	a	1
DELETE FROM mysql.table_stats;
DELETE FROM mysql.index_stats;
DROP TABLE t1;
CREATE TABLE t2(a int,KEY(a));
CREATE TABLE t3(b int, KEY(b));
SET SESSION information_schema_stats_expiry=0;
SELECT TABLE_NAME, ENGINE, ROW_FORMAT, TABLE_ROWS, AVG_ROW_LENGTH, DATA_LENGTH,
MAX_DATA_LENGTH, INDEX_LENGTH, DATA_FREE, AUTO_INCREMENT from
information_schema.tables WHERE table_name='t2';
TABLE_NAME	ENGINE	ROW_FORMAT	TABLE_ROWS	AVG_ROW_LENGTH	DATA_LENGTH	MAX_DATA_LENGTH	INDEX_LENGTH	DATA_FREE	AUTO_INCREMENT
t2	XENGINE	Fixed	0	0	0	0	0	0	1
SELECT table_name, table_rows, avg_row_length, data_length, max_data_length,
index_length, data_free, auto_increment from mysql.table_stats where table_name='t2';
table_name	table_rows	avg_row_length	data_length	max_data_length	index_length	data_free	auto_increment
SET SESSION information_schema_stats_expiry=default;
START TRANSACTION;
INSERT INTO t2 VALUES(1);
SELECT TABLE_NAME, ENGINE, ROW_FORMAT, TABLE_ROWS, AVG_ROW_LENGTH, DATA_LENGTH,
MAX_DATA_LENGTH, INDEX_LENGTH, DATA_FREE, AUTO_INCREMENT from
information_schema.tables WHERE table_name='t2';
TABLE_NAME	ENGINE	ROW_FORMAT	TABLE_ROWS	AVG_ROW_LENGTH	DATA_LENGTH	MAX_DATA_LENGTH	INDEX_LENGTH	DATA_FREE	AUTO_INCREMENT
t2	XENGINE	Fixed	0	0	0	0	0	0	1
ROLLBACK;
SELECT * FROM t2;
a
SELECT table_name, table_rows, avg_row_length, data_length, max_data_length,
index_length, data_free, auto_increment from mysql.table_stats where table_name='t2';
table_name	table_rows	avg_row_length	data_length	max_data_length	index_length	data_free	auto_increment
t2	0	0	0	0	0	0	1
START TRANSACTION;
INSERT INTO t3 VALUES(1);
ANALYZE TABLE t3;
Table	Op	Msg_type	Msg_text
test.t3	analyze	status	OK
SELECT TABLE_NAME, ENGINE, ROW_FORMAT, TABLE_ROWS, AVG_ROW_LENGTH, DATA_LENGTH,
MAX_DATA_LENGTH, INDEX_LENGTH, DATA_FREE, AUTO_INCREMENT from
information_schema.tables WHERE table_name='t2';
TABLE_NAME	ENGINE	ROW_FORMAT	TABLE_ROWS	AVG_ROW_LENGTH	DATA_LENGTH	MAX_DATA_LENGTH	INDEX_LENGTH	DATA_FREE	AUTO_INCREMENT
t2	XENGINE	Fixed	0	0	0	0	0	0	1
COMMIT;
SELECT * FROM t3;
b
1
SELECT TABLE_NAME, ENGINE, ROW_FORMAT, TABLE_ROWS, AVG_ROW_LENGTH, DATA_LENGTH,
MAX_DATA_LENGTH, INDEX_LENGTH, DATA_FREE, AUTO_INCREMENT from
information_schema.tables WHERE table_name='t3';
TABLE_NAME	ENGINE	ROW_FORMAT	TABLE_ROWS	AVG_ROW_LENGTH	DATA_LENGTH	MAX_DATA_LENGTH	INDEX_LENGTH	DATA_FREE	AUTO_INCREMENT
t3	XENGINE	Fixed	1	2097203	2097203	0	2097152	0	NULL
DELETE FROM mysql.table_stats;
DELETE FROM mysql.index_stats;
DROP TABLE t2,t3;
SET SESSION information_schema_stats_expiry= default;
