DROP TABLE IF EXISTS c1;
CREATE TABLE c1 (
id INT NOT NULL,
gmt_modified DATETIME NOT NULL DEFAULT CURRENT_TIMESTAMP,
value VARCHAR(50) NOT NULL,
PRIMARY KEY (id, gmt_modified)
) ENGINE=InnoDB;
insert into c1 values (1, "2022-09-10 10:30:14", "a");
insert into c1 values (2, "2022-09-10 10:30:16", "b");
call polarx.changeset_start('c1');
TABLE
c1
call polarx.changeset_fetch('c1');
OP	PK
insert into c1 values (3, "2022-09-10 10:30:18", "a");
insert into c1 values (4, "2022-09-10 10:35:16", "b");
insert into c1 values (5, "2022-09-10 12:30:16", "c");
select * from c1;
id	gmt_modified	value
1	2022-09-10 10:30:14	a
2	2022-09-10 10:30:16	b
3	2022-09-10 10:30:18	a
4	2022-09-10 10:35:16	b
5	2022-09-10 12:30:16	c
call polarx.changeset_stats('c1');
SCHEMA	TABLE	NUM_INSERTS	NUM_UPDATES	NUM_DELETES	NUM_FILES	MEMORY_SIZE
test	c1	3	0	0	0	195
call polarx.changeset_fetch('c1');
OP	id	gmt_modified
INSERT	5	2022-09-10 12:30:16
INSERT	4	2022-09-10 10:35:16
INSERT	3	2022-09-10 10:30:18
update c1 set value = "f" where value = "a";
update c1 set gmt_modified = "2022-09-10 12:50:40" where id = 5;
delete from c1 where value = "b";
select * from c1;
id	gmt_modified	value
1	2022-09-10 10:30:14	f
3	2022-09-10 10:30:18	f
5	2022-09-10 12:50:40	c
call polarx.changeset_stats('c1');
SCHEMA	TABLE	NUM_INSERTS	NUM_UPDATES	NUM_DELETES	NUM_FILES	MEMORY_SIZE
test	c1	3	3	2	0	715
call polarx.changeset_fetch('c1');
OP	id	gmt_modified
DELETE	4	2022-09-10 10:35:16
DELETE	2	2022-09-10 10:30:16
DELETE	1	2022-09-10 10:30:14
INSERT	1	2022-09-10 10:30:14
DELETE	5	2022-09-10 12:30:16
DELETE	3	2022-09-10 10:30:18
INSERT	3	2022-09-10 10:30:18
INSERT	5	2022-09-10 12:50:40
call polarx.changeset_stats('c1');
SCHEMA	TABLE	NUM_INSERTS	NUM_UPDATES	NUM_DELETES	NUM_FILES	MEMORY_SIZE
test	c1	3	3	2	0	520
call polarx.changeset_stop('c1');
SEQ	ROW
insert into c1 values (6, "2022-09-10 12:33:16", "f");
call polarx.changeset_stats('c1');
SCHEMA	TABLE	NUM_INSERTS	NUM_UPDATES	NUM_DELETES	NUM_FILES	MEMORY_SIZE
test	c1	3	3	2	0	520
call polarx.changeset_fetch('c1');
OP	PK
call polarx.changeset_stats('c1');
SCHEMA	TABLE	NUM_INSERTS	NUM_UPDATES	NUM_DELETES	NUM_FILES	MEMORY_SIZE
test	c1	3	3	2	0	0
call polarx.changeset_finish('c1');
SEQ	ROW
call polarx.changeset_stats('c1');
SCHEMA	TABLE	NUM_INSERTS	NUM_UPDATES	NUM_DELETES	NUM_FILES	MEMORY_SIZE
select * from c1;
id	gmt_modified	value
1	2022-09-10 10:30:14	f
3	2022-09-10 10:30:18	f
5	2022-09-10 12:50:40	c
6	2022-09-10 12:33:16	f
DROP TABLE IF EXISTS c1;
