call mtr.add_suppression('Unsafe statement written .*');
call mtr.add_suppression('Found .*');
SET @base_seq = (SELECT CAST(variable_value AS UNSIGNED) FROM performance_schema.global_status WHERE variable_name = 'Lizard_current_gcn');
create database db_tc;
create table db_tc.t(id int);
SET SESSION debug="+d,simulate_crash_after_sync_binlog";
begin;
insert into db_tc.t values(1);
commit;
ERROR HY000: Lost connection to MySQL server during query
select * from db_tc.t;
id
select * from db_tc.t;
id
1
SET SESSION debug="+d,simulate_crash_after_sync_binlog";
begin;
update db_tc.t set id = 2;
commit;
ERROR HY000: Lost connection to MySQL server during query
select * from db_tc.t;
id
1
select * from db_tc.t;
id
2
SET SESSION debug="+d,simulate_crash_after_sync_binlog";
xa start 'xx_1';
insert into db_tc.t values(1);
xa end 'xx_1';
xa prepare 'xx_1';
ERROR HY000: Lost connection to MySQL server during query
xa commit 'xx_1';
include/assert.inc [expect_gcn == actual_gcn]
include/assert.inc [expect_state == actual_state]
SET SESSION debug="+d,simulate_crash_after_sync_binlog";
xa start 'xx_2';
update db_tc.t set id = 2;
xa end 'xx_2';
xa prepare 'xx_2';
ERROR HY000: Lost connection to MySQL server during query
xa commit 'xx_2';
include/assert.inc [expect_gcn == actual_gcn]
include/assert.inc [expect_state == actual_state]
SET SESSION debug="+d,simulate_crash_after_sync_binlog";
xa start 'xx_3';
insert into db_tc.t values(1);
xa end 'xx_3';
xa commit 'xx_3' one phase;
ERROR HY000: Lost connection to MySQL server during query
include/assert.inc [expect_gcn == actual_gcn]
include/assert.inc [expect_state == actual_state]
SET SESSION debug="+d,simulate_crash_after_sync_binlog";
xa start 'xx_4';
update db_tc.t set id = 2;
xa end 'xx_4';
xa commit 'xx_4' one phase;
ERROR HY000: Lost connection to MySQL server during query
include/assert.inc [expect_gcn == actual_gcn]
include/assert.inc [expect_state == actual_state]
xa start 'xx_5';
insert into db_tc.t values(1);
xa end 'xx_5';
xa prepare 'xx_5';
SET SESSION debug="+d,simulate_crash_after_sync_binlog";
xa commit 'xx_5';
ERROR HY000: Lost connection to MySQL server during query
include/assert.inc [expect_gcn == actual_gcn]
include/assert.inc [expect_state == actual_state]
xa start 'xx_6';
update db_tc.t set id = 2;
xa end 'xx_6';
xa prepare 'xx_6';
SET SESSION debug="+d,simulate_crash_after_sync_binlog";
xa commit 'xx_6';
ERROR HY000: Lost connection to MySQL server during query
include/assert.inc [expect_gcn == actual_gcn]
include/assert.inc [expect_state == actual_state]
xa start 'xx_7';
insert into db_tc.t values(1);
xa end 'xx_7';
xa prepare 'xx_7';
SET SESSION debug="+d,simulate_crash_after_sync_binlog";
xa rollback 'xx_7';
ERROR HY000: Lost connection to MySQL server during query
include/assert.inc [expect_gcn == actual_gcn]
include/assert.inc [expect_state == actual_state]
xa start 'xx_8';
insert into db_tc.t values(1);
update db_tc.t set id = 2;
xa end 'xx_8';
xa prepare 'xx_8';
SET SESSION debug="+d,simulate_crash_after_sync_binlog";
xa rollback 'xx_8';
ERROR HY000: Lost connection to MySQL server during query
include/assert.inc [expect_gcn == actual_gcn]
include/assert.inc [expect_state == actual_state]
drop table db_tc.t;
drop database db_tc;
